|ABSTRACT If someone has the ability to take control of a botnet, can they just clean up all the infected hosts? Can we deceive users, if our goal is to better understand how they are de- ceived by attackers? Can we demonstrate the need for better methods, by breaking something that people rely on today? To be effective, we must find ways to balance societal needs and ethical issues surrounding our research, lest we drift to the extremes—becoming the very thing we deplore, or ced- ing the Internet to the miscreants because we fear to act In this paper, we advocate for a community dialogue on the ethical issues in computer security and the ethical standards that we intend to enforce as a community 1 INTRODUCTION Modern threats such as Denial of Service Attacks, Worms, Viruses, Phishing, and Botnets underscore the need for secu- rity research in an increasingly networked and computation- ally reliant society|,Non-data,115
| Unfortunately, as our understanding of these phenomena have grown, so has the uncertainty in the computer security research community on the appropriate ways in which to observe and address these problems For example, consider the area of botnet research, which centers around the detection and mitigation of large num- bers of infected hosts, or bots, networked into a single dis- tributed system, or botnet We have recently seen a steady increase in criminal activity using botnets In response, we see an increase in academic research and federal funding to counter this threat|,Non-data,115
| This criminal activity is compounded by the emergence of politically motivated attacks, such as those against elements of the cyber-infrastructure of Estonia Re- sponses to these threats vary, from passive measurement and observation, to calls for the legal right to defend computer systems from attack using aggressive countermeasures Unfortunately, the structured public discussion of an ethi- cal framework to guide decision making about actions taken while researching and countering botnet attacks, and indeed in a broader set of computer security research, has not kept pace Existing structures for determining the ethical behav- ior (e|,Non-data,115
|g, Institutional Review Boards (IRB), Professional Codes of Conduct) fail to provide detailed actionable guid- ance due to the absence of technical expertise in this spe- cific domain and a lack community shared values [1] There is growing frustration expressed by researchers, program committees, and professional organizations about the lim- its of ethical research and who has responsibility to enforce them [1, 4] Our primary goal in this work is to encourage a contin- uing dialogue on the ethics of computer security research|,Non-data,115
| Through this dialogue, we hope to build both an expertise that can be used in various policy enforcement bodies (eg, program committees, IRBs) and will help us arrive at a form of community consensus 2|,Non-data,115
| UNDERSTANDING THE NEED LxLabs, a company based in Bangalore, India, markets a web server virtualization system called HyperVM, which uses an administration interface named Kloxo One com- pany who uses HyperVM and Kloxo is UK-based Vacertcom On Sunday, June 7, 2009, Vacert|,Non-data,115
|com suffered a compro- mise of their web hosting system, resulting in over 100,000 accounts being deleted from the system On Monday, June 8, 2009, LxLabs’ CEO, 32 year old K T Ligesh, was found dead in his apartment of an apparent suicide [6] Just a few days before, on June 6, 2009, an analysis of “several dozen vulnerabilities in kloxo” with complete details on how to exploit these vulnerabilities was posted anonymously to the web site milw0rm The time line in this analysis describes an attempt by the unknown secu- rity researcher to correspond with staff at LxLabs about the vulnerabilities, which includes such problems as file permis- sion bypass, cross-site scripting, symbolic link exploitation, denial of service, and arbitrary command execution at el- evated privilege through unclean user input|,Non-data,115
| The posting claims an initial report was sent two weeks prior and that resources demonstrating the vulnerabilities were made avail- able to assist LxLabs in confirming and fixing the problems After two email exchanges with an unnamed LxLabs em- ployee, no further communication as promised from LxLabs, and no observed attempts by LxLabs to even review the re- sources, the researcher posted the full analysis and exploit details Within days, multiple sites using Kloxo (including Vacertcom) were attacked by unknown parties|,Non-data,115
| It is not known whether there is any relationship between the person(s) who attacked and damaged the web sites and the security researcher who published the vulnerability in- formation, nor the identity of the person who the researcher was in communication with at LxLabs There is no indica- tion that the security researcher attempted to report these problems to any other organizations Finally, there is no in- dication that the researcher considered releasing only partial details in order to warn Kloxo users or the general public and give them a chance to protect themselves prior to re- lease of full details including exploits, as is recommended in various responsible vulnerability disclosure guidelines 3|,Non-data,115
| BUILDING ETHICAL STANDARDS While the previous case study may seem extreme it is representative of a growing set of cases [3], which challenge program committees, institutional review boards, and our broad community to evaluate the risks and benefits of secu- rity research Increasingly we require fine-grained guidance in a form that could be evaluated and acted on Researchers themselves need to be able to include in their publications an indication that they have made the effort to evaluate their work against the ethical concerns Such internal and external evaluations need to be performed in a way that is uniform across all research situations and topics|,Non-data,115
| The approach adopted here is close to that of Johnson and Miller [5] in that we are concerned with building expertise in practical decision making Bynum and Rogerson [2] suggest a multi-staged approach to case study analysis in order to build ethical judgement capabilities These stages include: identifying key ethical principles, detailing the case study, identifying specific ethical issues raised by the case, calling on your own experience and skills for evaluation, then the abilities of others, and finally, applying a systematic analysis technique In the following sections we briefly summarize an application of these approaches|,Non-data,115
| 31 General Ethical Issues ulation, and if so, which population? When considering actions related to research or mitiga- tion of malicious or illegal activity, there are many issues that must be considered These involve issues of (a) propor- tionality, (b) targeting, (c) necessity, (d) desired outcome, (e) potential consequences, and (f) the greater moral good to society that is expected to result (and whether it out- weighs any potential harm to innocent third parties) For example, the kinds of questions that researchers should ask themselves include (but are not limited to): • Are the research results intended to protect a specific pop- • Is there a way to achieve multiple benefits to society si- • Who will benefit more from publication of research find- ings, and in which order: Victims of criminal acts; au- thorities responsible for protecting their citizens; the re- searchers themselves; or the criminals who are perpetrat- ing computer crimes? • Is there any other way to accomplish the desired research • What is the safest way to disseminate research results without risk of improper use by individuals who may not share the researchers’ ethical standards? multaneously when studying criminal behavior? result(s)? 3|,Non-data,115
|2 Analyzing Case Studies Systematically Following Bynum and Rogerson, we have identified a hand- ful of issues that researchers can use to evaluate their re- search However, to build consensus across a wide range of research and situations, it is advantageous to explore formal methodologies for evaluating these questions Such method- ologies allow for comparisons to be made across researchers and projects In the following section we examine some po- tential methodologies|,Non-data,115
| 321 Stakeholder Analysis Stakeholder Analysis identifies the key players in the sit- uation in terms of their interests, involvement, and their relationship (ie|,Non-data,115
|, producer or recipient) of outcomes such as benefit or harm We will adapt the definitions of stakehold- ers from http://wwwtheasaorg/networks/apply/ethics/ analysis/stakeholder|,Non-data,115
|htm for the purposes of this section • Primary stakeholders are, “those ultimately affected, either [positively or negatively]” These will typically be the end-users of computer systems, and consumers of in- formation or information system products or services • Secondary stakeholders are, “intermediaries in deliv- ery” of the benefits and harms|,Non-data,115
| In the computer secu- rity context, these would be service providers, operators, or other parties responsible for integrity, availability, and confidentiality of information and information systems • Key stakeholders are, “those who can significantly in- fluence, or are important to the success [or failure] of the project” We will include the researcher(s), vendor(s), those who design and implement systems, and criminals or attackers 3|,Non-data,115
|22 Roles and Responsibilities Analysis Roles and Responsibilities Analysis takes the identified Stakeholders, and lists both their role or roles in the situa- tion, as well as their responsibilities towards each other and to society as a whole Once stakeholders have been identi- fied, and roles and responsibilities mapped out, one can start to define desired outcomes in terms of maximizing benefits and minimizing harms to stakeholders Alternative actions that fall within the delineated roles and responsibilities can then be weighed against each other in terms of expected out- comes|,Non-data,115
| One of the hardest challenges is in trying to identify potential negative outcomes that may result from alterna- tive actions in order to minimize unintended consequences This is where involvement of trusted external parties, such as peer-review of proposed actions or protocols, can help 4 REVISITING KLOXO / HYPERVM The study of kloxo is interesting and unique in terms of the possible relationship with the suicide of the CEO of the vendor and it brings in many issues of risk/benefit across many parties|,Non-data,115
| In kloxo, we can identify the following stake- holders: • Key Stakeholders The researcher who discovered the vulnerabilities The programmers who were responsible for creating the HyperVM system and Kloxo administra- tive front end The corporate management of the vendor (LxLabs), which includes the CEO The Criminals and Attackers who would exploit vulnerabilities for their own purposes|,Non-data,115
| • Secondary Stakeholders The service providers who pur- • Primary Stakeholders The customers of the service providers who use the virtual servers The consumers who obtain products or services from the customers of the ser- vice providers (eg, the online merchants using virtual storefronts hosted on HyperVM virutal machines|,Non-data,115
|) chased HyperVM / Kloxo The researcher attempted to contact the corporate man- agement of LxLabs, presumably to convince them to make decisions that would direct the programmers to fix the bugs that the researcher identified Implicitly, we assume the researcher chose to contact the vendor privately to allow them to fix the problem in order to protect the primary stakeholders (ie|,Non-data,115
|, virtual machine customers and their end consumers) The action of the researcher as a key stakeholder to make detailed vulnerability and exploit information to the vendor is intended to assist the vendor in correcting the problems and eliminating the vulnerability This creates a benefit to the primary stakeholders by protecting their services and accounts, as well as benefiting the secondary stakeholders by improving their product and protecting their customers It is the vendor’s responsibility as a key stakeholder to use this information to minimize potential harm to the primary stakeholders|,Non-data,115
| While the researcher did not state this ex- plicitly, we can assume that the researcher has taken upon himself/herself the responsibility of assisting in protecting the primary and secondary stakeholders We can infer that the action of reporting was intended to obtain the outcome of protecting the primary stakeholders by minimizing harm to them that would result from a malicious actor finding and exploiting these vulnerabilities before the vendor corrected them The researcher had several optional pathways that could achieve this same goal: • The researcher could have taken a high-level outline of the vulnerabilities and provided them to a reporter, who could have written a news article disclosing (in general terms) that vulnerabilities in the HyperVM / Kloxo sys- tem were discovered and warning the primary stakehold- ers (ie|,Non-data,115
|, customers and end consumers) The primary stakeholders could then take their own actions to ask questions, harden defenses, ensure they had current back- ups, or consider moving their storefronts to other service providers • The researcher could have identified a representative set of HyperVM / Kloxo customers and warn them (again, in general terms) of the vulnerabilities, and/or provided mit- igation details These customers could have been encour- aged to contact LxLabs and put pressure on the vendor to fix the problems|,Non-data,115
| This would also have the same added benefits in terms of minimization of harm as the previ- ous option This would not be as easy as contacting a single reporter, or reporting to a CERT organization, but would still move towards achieving the goal of protecting the customers and end consumers • The researcher could have published a high-level sum- mary of the vulnerabilities, rather than full exploit de- tails This may well result in calls from full-disclosure advocates to provide more details, and possibly criticism of the researcher for over-stating the significance of their findings|,Non-data,115
| Anyone with the same (or greater) skills would be able to repeat the research and thus possess the same ability to exploit these vulnerable systems, however this would take time that the vendor may be able to use to fix the problems before any harm is done to the primary stakeholders The researcher thus has to balance personal benefit from first discovery and/or immediate full disclo- sure, potential harm resulting from criticism for partial disclosure, and potential harm to primary stakeholders from release of exploit information prior to patches being available to fix the bugs The use of anonymity by the researcher for unstated rea- sons leaves open many questions (i) It may indicate that there is no personal gain to the researcher from disclosure|,Non-data,115
| Then again, it also has the potential of avoiding account- ability for any actions that are taken, including unintended consequences that cause harm (ii) Releasing full details only two weeks after first contacting the vendor is another difficult issue Because there was no evidence of the vendor even looking at the vulnerability details, could the researcher have been acting with a punitive motive against the vendor? (iii) The researcher may be a disgrunteled current/former employee with a retributive motive It is unreasonable for the researcher to anticipate the CEO would commit suicide, nor is it provable that the pressure from disclosure and resulting damage from exploitation of the vulnerabilities contributed to the suicide|,Non-data,115
| It is foresee- able, however, that disclosure of full exploit details without warning would likely result in one or more parties using this information to do anything made possible, up to and includ- ing destroying the contents of any servers they could find The exploit details alone do not help the primary stake- holders in protecting themselves, as there is nothing they can do (short of immediately switching to another virtual machine provider, which would take significant effort and time) Since the researcher provided no mitigation details, the information that was released reasonably can be seen to benefit attackers more Thus, if the primary goal of the researcher was to minimize harm to the primary stakehold- ers, the choice to disclose the vulnerabilities two weeks after first attempting to contact the vendor resulted in the exact opposite result (i|,Non-data,115
|e, increased harm and decreased benefit to both primary and secondary stakeholders) 5 CONCLUSION More questions are typically raised about the ethics of computer security research activities than answers are pro- vided|,Non-data,115
| To help understand these issues and define a workable ethical framework, we believe that a more structured series of public discussions are urgently needed For a glimpse at our efforts to help energize this needed dialog, please see our extended technical report [3] 6 |,Non-data,115
|Abstract threats propagate randomly, The Internet today is beset with constant attacks tar- geting users and infrastructure One popular method of detecting these attacks and the infected hosts behind them is to monitor unused network addresses Because many Internet infection attempts can be captured by monitoring the unused spaces be- tween live addresses Sensors that monitor these unused address spaces are called darknets, network telescopes, or blackholes|,Non-data,116
| They capture important information about a diverse range of threats such as Internet worms, denial of services attacks, and botnets In this paper, we describe and analyze the important measurement issues associated with deploying darknets, evaluating the placement and service configuration of darknets, and analyzing the data collected by darknets To support the discussion, we lever- age 4 years of experience operating the Internet Motion Sensor (IMS), a network of distributed darknet sensors monitoring 60 distinct address blocks in 19 organizations over 3 continents I|,Non-data,116
| Introduction Monitoring packets destined to unused Internet ad- dresses has become an increasingly important measure- ment technique for detecting and investigating malicious Internet activity Since there are no legitimate hosts or devices in an unused address block, any observed traf- fic must be the result of misconfiguration, backscatter from spoofed source addresses, or scanning from worms and other network probing Systems that monitor unused address space have been called darknets [8], network telescopes [11], blackhole monitors [17], Sinkholes [9], or background radiation monitors [13], and capture important information about a diverse range Internet threats such as denial of service attacks [12], random scanning worms [3], [10], [15], [16], and botnets [7] In this paper, we describe and analyze the important measurement issues associated with deploying darknets, configuring darknets, and analyzing the data collected by darknet monitors|,Non-data,116
| The goal is to provide a general overview of darknet measurement and give researchers with the information needed to deploy and analyze the data from darknet monitoring systems Our approach does not focus on a particular architecture and is meant to be complementary to existing work [1], [11], [19], [21] We begin by describing how to setup a darknet and how to configure the network to forward traffic destined for unused addresses to a monitoring system Next, we analyze data from different sized darknets to assess the storage and network resources required for darknet measurements|,Non-data,116
| We next discuss how the placement of a darknet within address space and the surrounding network topology influences the visibility of monitoring systems We also describe how visibility is impacted by the response to incoming packets In particular, we show how no response, a SYN-ACK responder, an emulated operating system and application- level response, and a real honeypot host response represent a spectrum of interactivity that can provide additional intelligence on network events and threats Finally, with this understanding of how to deploy and configure darknet monitors, we describe different methods of identifying important events in data collected by darknet monitors|,Non-data,116
| To inform our analysis we use data from the globally deployed Internet Motion Sensor (IMS) distributed darknet monitoring system The IMS consists of 60 darknet blocks at 18 organizations including broadband providers, major service providers, large enterprises, and academic networks in 3 continents It monitors over 17 million addresses which represents more than 125% of all routed IPv4 space|,Non-data,116
| 2 Fig 1 A sample configuration which illustrates the three major darknet deployment models; capturing traffic out-bound to reserved space (lines 6-8), traffic destined to a statically configured, unused subnet (line 4), or capturing all unused space within an allocation (line 5) II|,Non-data,116
| Darknet Deployment The deployment of a darknet monitoring system re- quires an understanding of the topology of the local network Since a darknet monitor observes traffic to unused addresses, the upstream router or dynamic host configu- ration server must be instructed to forward undeliverable packets to the monitor In this section we highlight some of the important challenges associated with configuring the network and then discuss how to provision adequate storage and network resources for a darknet system A|,Non-data,116
| Configuration There are three general techniques for forwarding pack- ets to a darknet monitoring system The simplest approach is to configure the monitoring box to send ARP replies for each unused address to the router This works well when the darknet is well-defined and spans a few addresses or when access to the upstream router is not possible However, it is far less efficient with thousands or millions of monitored addresses|,Non-data,116
 A more scalable approach is to configure the upstream router to statically route an entire address block to the monitor This idea is illustrated in line 4 of the router configuration in Figure 1 This figure depicts a darknet monitoring setup in which the monitor is connected to a switch which is then connected to an upstream router The use of a static route illustrated in the figure is simple but requires that darknet address block be specifically set aside for monitoring,Non-data,116
| A more flexible approach is to route all packets destined to locations that do not have a more specific address configured (and would thus be dropped) to the monitoring system by means of a blackhole (also called a fall-through route) Thus, if an organization is allocated a /8, then it could create a static route to the darknet monitor for the entire /8 Packets to valid addresses will hit more specific prefixes and only packets to unused addresses will fall through to the /8 route This idea is also illustrated in Figure 1 and is similar to adding a route to prevent flooding attacks against persistent loops [20]|,Non-data,116
| The setup thus far has assumed monitoring of unused addresses that are both globally addressable and reachable It is also possible to monitor unused and non-routable addresses [5] For example, RFC 1918 addresses are often used within service providers and enterprises for local systems and unused addresses in these ranges can also be monitored by darknet systems Lines 6-8 of the router configuration in Figure 1 demonstrate how to setup static fall-through routes for the three major RFC 1918 ranges|,Non-data,116
| B Resource Provisioning Understanding the storage and network requirements of a darknet is critical to correctly provision the monitoring system as the amount of incoming traffic can be quite large These requirements are typically dependent on the number of addresses monitored To provide a general overview of the data rates observed at darknets of different sizes, we measured the packets per day per IP for various sized darknet blocks|,Non-data,116
| The results are shown on the left of Figure 2 Note that the darknets that monitored less addresses tended to receive more packets per day per IP than the larger darknets We explore these differences in more detail in the next section On average, we found that a small /24 sensor is likely to see a sustained rate of 9 packets per second, a moderately sized /16 monitor will see roughly 75 packets per second, and a large /8 monitor over 5,000 packets per second|,Non-data,116
 An important caveat that biases these results is that the /24 monitors actively responded to certain incoming connections We found that the traffic was between 11 to 16 times greater on average than nearby passive /24 monitor Details on the response are described in the next section,Non-data,116
| Another consideration is that the average rates can be deceptive because traffic routinely bursts two to three orders of magnitude above the sustained rate For example, one IMS sensor has had a sustained rate of 9 packets per seconds over the last 25 years with a daily low of 6 packets per second and a daily high 31|,Non-data,116
000/8310,Non-data,116
023110,Non-data,116
0/161:2:3:4:5:6:7:8:interface FastEthernet2/0ip address 31001 255,Non-data,116
255255252arp 310,Non-data,116
02 00096b49f013 ARPAip route 31,Non-data,116
110 255255,Non-data,116
