 encryptions of their underlying messages We describe our method in greater detail in Section 5 New lower bounds for OPE The core building block in our new ORE construction is a small-domain ORE with best-possible security,Non-data,77
| This raises the natural question of whether we could construct a small-domain OPE that also achieves best-possible security Previously, Boldyreva et al [9, 10] and Popa et al [50] gave lower bounds that ruled out schemes where the ciphertext space is subexponential in the size of the plaintext space|,Non-data,77
| But when the plaintext has size poly(λ) for a security parameter λ, there could conceivably exist an efficient OPE scheme with best-possible security In this work, we show that this is in fact impossible Us- ing a very different set of techniques compared to [9, 10, 50], we show (Section 6) that no efficient (stateless and non-interactive) OPE scheme can satisfy best-possible secu- rity, even when the message space contains only 3 elements! Thus, to achieve strong security even in the small-domain setting, it is necessary to consider relaxations of OPE, such as ORE Experimental evaluation|,Non-data,77
| Finally, we implement and compare our new ORE scheme to the ORE scheme by Ch- enette et al [22] and the OPE scheme by Boldyreva et al [9] For typical parameters, our new ORE scheme is over 65 times faster than the Boldyreva et al|,Non-data,77
| scheme, but has longer ciphertexts For example, when working with byte- size blocks, encrypting a 32-bit integer requires just 55 μs and produces a ciphertext that is 224 bytes Typically, range queries are not performed over extremely long fields, so the extra space overhead of our scheme is not unreasonable Given the superior security conferred by our scheme (in both the online and offline settings), and faster throughputs, our ORE scheme is a very compelling replacement for existing OPE schemes|,Non-data,77
| Applying ORE To conclude, we make a cautionary note that because of the leakage associated with any ORE scheme, the primitive is not always suitable for applications that de- mand a high level of security Our hope, however, is that by giving precise, concrete characterization of the leakage profile of our construction (in both the online and offline settings when used to support encrypted database queries), practitioners are able to make better-informed decisions on the suitability of our construction for a specific application 2|,Non-data,77
| PRELIMINARIES For n ∈ N, we write [n] to denote the set of integers {1,    , n}|,Non-data,77
| If P is a predicate on x, we write 1(P(x)) to denote the indicator function for P: that is, 1(P(x)) = 1 if and only if P(x) = 1, and 0 otherwise For a distribution D, we write x ← D to denote a draw from D For a finite set r←− S to denote a uniformly random draw from S, we write x S In this work, we write λ to denote a security parameter|,Non-data,77
| We say a function f (λ) is negligible in λ if f = o(1/λc) for all c ∈ N We write negl(λ) to denote a negligible function in λ and poly(λ) to denote a polynomial in λ We say that an event occurs with negligible probability if the probability of the event occurring is negl(λ) For two bit strings x, y, we write x(cid:107)y to denote the concatenation of x and y|,Non-data,77
| We also review the standard definition of pseudorandom functions (PRFs) [31] A function F : K×X → Y is a secure PRF if no efficient adversary can distinguish (except perhaps 1169with negligible probability) the outputs (on arbitrary points chosen adaptively by the adversary) of F (k,·) for a randomly r←− K from that of a truly random function f (·) chosen k from X to Y Similarly, a function F : K × X → X is a secure pseudorandom permutation (PRP) if for all k ∈ K, F (k,·) is a permutation on X and no efficient adversary can distinguish the outputs of F (k,·) where k r←− K from the outputs of π(·) where π is a random permutation on X  2|,Non-data,77
|1 Order-Revealing Encryption An order-revealing encryption (ORE) scheme [12, 22] is a tuple of three algorithms Π = (ORESetup, OREEncrypt, ORECompare) defined over a well-ordered domain D with the following properties: • ORE|,Non-data,77
|Setup(1λ) → sk: On input a security parameter λ, the setup algorithm outputs a secret key sk • OREEncrypt(sk, m) → ct: On input a secret key sk and a message m ∈ D, the encryption algorithm outputs a ciphertext ct • ORE|,Non-data,77
|Compare(ct1, ct2) → b: On input two ciphertexts ct1, ct2, the compare algorithm outputs a bit b ∈ {0, 1} Correctness We say an ORE scheme over a well-ordered domain D is correct if for sk ← ORESetup(1λ) and all mes- sages m1, m2 ∈ D, Pr[ORE|,Non-data,77
|Compare(ct1, ct2) = 1(m1 < m2)] = 1 − negl(λ) (ORE Decryption) Our above schema Remark 21 for ORE does not include a decryption function, but as noted by Chenette et al|,Non-data,77
| [22, Remark 23], this is without loss of generality In particular, we can construct a decryption algo- rithm OREDecrypt using the ORE|,Non-data,77
Encrypt and ORECompare algorithms (by performing a binary search) Security The “best-possible” notion of security for order- revealing encryption is the notion of indistinguishability un- der an ordered chosen plaintext attack (IND-OCPA) intro- duced by Boldyreva et al,Non-data,77
| [9] The IND-OCPA notion of se- curity is a generalization of semantic security [34], and states that no efficient adversary can distinguish between the en- cryptions of any two sequences of messages, provided that the ordering of the messages in the two sequences is identi- cal We give the formal definition in the full version [43] Due to the apparent difficulty in constructing efficient schemes that satisfy IND-OCPA security, Chenette et al|,Non-data,77
 [22] introduced a weaker simulation-based notion of security for ORE schemes that allows for some leakage beyond just the ordering of the plaintexts We recall their definition here Definition 22 (ORE with Leakage [22]),Non-data,77
| Let Π be an ORE scheme—that is, Π = (ORESetup, OREEncrypt, ORECompare), and let A = (A1, |,Non-data,77
|   ,Aq) be an adversary for some q = poly(λ) Let S = (S0,S1, |,Non-data,77
|   ,Sq) be a sim- ulator, and let L(·) be a leakage function We define the experiments REALoreA (λ) and SIMoreA,S,L(λ) in Figure 1|,Non-data,77
| We say that Π is a secure ORE scheme with leakage function L(·) if for all polynomial-size adversaries A = (A1,    ,Aq), there exists a polynomial-size simulator S = (S0,S1, |,Non-data,77
|   ,Sq) such that the outputs of the two distributions REALoreA (λ) and SIMoreA,S,L(λ) are computationally indistinguishable Remark 2|,Non-data,77
|3 (Best-Possible Security) The strongest notion of simulation-security is security with respect to the leakage function that only reveals the ordering of the plain- texts This is the minimal leakage possible from an order- revealing encryption scheme In particular, we define Lcmp as follows: Lcmp(m1, |,Non-data,77
|   , mt) = {(i, j, cmp(mi, mj) || 1 ≤ i < j ≤ t)} , where cmp(mi, mj) is the comparison function that outputs −1 if mi < mj, 0 if mi = mj and 1 if mi > mj 3|,Non-data,77
| ORE FOR SMALL DOMAINS The order-revealing encryption in [22] reveals a significant amount of information, namely, the index of the first bit position that differs between two encrypted plaintexts In this work, we show how to construct an ORE scheme that only leaks the first block that differs, where a block is a collection of one or more bits For instance, we can construct an ORE scheme that only reveals the first byte that differs between two encrypted plaintexts, and nothing more The starting point for our construction is a “small-domain” ORE scheme with best-possible simulation security|,Non-data,77
| The limitation is that the length of the ciphertexts in our ORE scheme grows linearly with the size of the message space, hence the restriction to small (polynomially-sized) domains We show in Section 4 how to extend our small-domain ORE to obtain an order-revealing encryption scheme over large domains (ie, exponentially-sized) that leaks strictly less in- formation compared to the scheme by Chenette et al|,Non-data,77
| [22] As described in Section 11, we give our ORE construc- tion in the left/right framework where we decompose the OREEncrypt function into two functions: ORE|,Non-data,77
|EncryptL and OREEncryptR We refer to them as the “left encryption” and “right encryption” functions, respectively Our particular construction has the property that only “left ciphertexts” can be compared with “right ciphertexts|,Non-data,77
|” Note that this is with- out loss of generality and we can recover the usual notion of ORE by simply defining the output of OREEncrypt(sk, m) to be the tuple (OREEncryptL(sk, m), OREEncryptR(sk, m))|,Non-data,77
| 31 Small-Domain ORE Construction We begin with a high-level overview of our construction Our scheme is defined with respect to a plaintext space [N ] where N = poly(λ) First, we associate each element x ∈ [N ] in the domain with an encryption key kx|,Non-data,77
| A (right) ciphertext for a value y ∈ [N ] consists of N encryptions of the comparison output cmp(x, y) between y and every el- ement x ∈ [N ] in the domain, where the value cmp(x, y) is encrypted under kx The left encryption of a value x is simply the encryption key kx Given kx and an encryp- tion of cmp(x, y) under kx, the evaluator can decrypt and learn the comparison bit cmp(x, y) The values of the other comparison bits are hidden by semantic security of the en- cryption scheme|,Non-data,77
| Note, however, that we still need a way for the evaluator to determine which of the N ciphertexts is encrypted under kx without learning the value of x To en- sure this, we sample a random permutation π on the domain [N ] during setup The components in the right ciphertexts are then permuted according to π and the left encryption of x includes the permuted position π(x) Given π(x), the evaluator learns which component in the right ciphertext to decrypt, but learns nothing about x|,Non-data,77
| Finally, to show sim- 1170REALoreA (λ): 1 sk ← ORESetup(1λ) 2 (m1, stA) ← A1(1λ) 3|,Non-data,77
| c1 ← OREEncrypt(sk, m1) 4 for 2 ≤ i ≤ q: (a) (mi, stA) ← Ai(stA, c1,  |,Non-data,77
|  , ci−1) (b) ci ← OREEncrypt(sk, mi) SIMoreA,S,L(λ): 1 stS ← S0(1λ) 2|,Non-data,77
| (m1, stA) ← A1(1λ) 3 (c1, stS ) ← S1(stS ,L(m1)) 4 for 2 ≤ i ≤ q: (a) (mi, stA) ← Ai(stA, c1,  |,Non-data,77
|  , ci−1) (b) (ci, stS ) ← Si(stS ,L(m1,   |,Non-data,77
| , mi)) 5 output (c1,   |,Non-data,77
| , cq) and stA 5 output (c1,   |,Non-data,77
| , cq) and stA Figure 1: Real and ideal experiments for ORE with leakage (Definition 22) ulation security, we require a “non-committing” encryption scheme, and for this, we rely on a random oracle [6]4 Construction|,Non-data,77
| Let [N ] be the message space Let F : {0, 1}λ×{0, 1}λ → {0, 1}λ be a secure PRF and H : {0, 1}λ× {0, 1}λ → Z3 be a hash function (modeled as a random ora- cle in the security proof) Let cmp be the comparison func- tion from Remark 23|,Non-data,77
| Our ORE scheme Π(s) ore is defined as follows: • ORESetup(1λ) The setup algorithm samples a PRF key r←− {0, 1}λ for F , and a uniformly random permutation • OREEncryptL(sk, x)|,Non-data,77
| Write sk as (k, π) The left en- cryption algorithm computes and returns the tuple ctL = (F (k, π(x)), π(x)) • OREEncryptR(sk, y)|,Non-data,77
| Write sk as (k, π) First, the right r←− {0, 1}λ k π : [N ] → [N ] The secret key sk is the pair (k, π)|,Non-data,77
| encryption algorithm samples a random nonce r Then, for each i ∈ [N ], it computes the value vi = cmp(π −1(i), y) + H(F (k, i), r) (mod 3) Finally, it outputs the ciphertext ctR = (r, v1, v2   |,Non-data,77
| , vN ) • ORECompare(ctL, ctR) The compare algorithm first parses (cid:48) ctL = (k , h) and ctR = (r, v1, v2, |,Non-data,77
|   , vN ), and then outputs the result vh − H(k(cid:48), r) (mod 3) (cid:48) , ct(y) Correctness|,Non-data,77
| Let sk = (k, π) ← ORESetup(1λ), and take any x, y ∈ [N ] Let ct(x) L = (k(cid:48), h) ← OREEncryptL(sk, x) R = (r, v1, |,Non-data,77
|   , vN ) ← OREEncryptR(sk, y), Then, and and ct(y) setting z = ORE|,Non-data,77
|Compare(ct(x) z = vh − H(k = cmp(π = cmp(π = cmp(x, y) ∈ Z3, Note that cmp(x, y) provides the same amount of informa- tion as 1(x < y) and 1(y < x), so correctness follows −1(h), y) + H(F (k, h), r) − H(k −1(π(x)), y) + H(F (k, π(x)), r) − H(F (k, π(x)), r) R ), we have , r) , r) (cid:48) L Space usage Before we give our formal security analy- sis, we first characterize the length of the ciphertexts in our ORE scheme for a message space of size N  The left cipher- texts ctL in our scheme consists of a PRF key and an index, which are λ + (cid:100)log N(cid:101) bits long|,Non-data,77
| The right ciphertexts ctR consists of a nonce, together with N elements in Z3, which 4We believe we can replace the random oracle with a PRF if we aim to prove an indistinguishability notion of security for our construction For simplicity of presentation in this paper, we work with a simulation-based definition and prove security in the random oracle model can be represented using λ + (cid:100)N log2 3(cid:101) bits Thus, a com- plete ciphertext consists of 2λ + (cid:100)log N(cid:101) + (cid:100)N log2 3(cid:101) bits|,Non-data,77
| However, as we note in the following remark, it is possible to obtain shorter ciphertexts if we allow the comparison algo- rithm to take the full ciphertext (ctL, ctR) as opposed to only the left half of the first ciphertext and the right half of the second ciphertext Thus, when using the construction as a pure ORE scheme, we can obtain shorter ciphertexts When leveraging our ORE scheme to build a range query system (Section 5), we will exploit the fact that comparisons can be performed given just the left component of one ciphertext and the right component of the other L Remark 3|,Non-data,77
|1 (Shorter Ciphertexts) For a domain of size N , the right ciphertexts in our ORE construction contain N elements of Z3 Suppose instead we replaced the comparison function cmp with a function cmp(cid:48) where cmp(cid:48)(x, y) = 1 if x ≤ y and 0 otherwise Then, a left encryp- tion ct(x) of y can be used to compute cmp(cid:48)(x, y), or equivalently, whether x ≤ y|,Non-data,77
| If , ct(x) the comparison algorithm takes as input ct(x) =(cid:0)ct(x) and ct(y) =(cid:0)ct(y) (cid:1) (cid:1), then it can compute both cmp(cid:48)(x, y) of x and a right encryption ct(y) and cmp(cid:48)(y, x) This means that given ct(x) and ct(y), the comparison algorithm can still determine if x < y, x = y, or x > y With this modification, the right ciphertexts in our scheme have length N rather than (cid:100)N log2 3(cid:101) L , ct(y) R R R L In the full version [43], we also show how our construction above can be extended to support more general function- alities (beyond just comparisons) over polynomial-sized do- mains|,Non-data,77
| We now state our main security theorem, but defer the formal proof to the full version Theorem 32 The ORE scheme Π(s) ore is secure with the best-possible leakage function Lcmp from Remark 2|,Non-data,77
|3 assum- ing that F is a secure PRF and H is modeled as a random oracle 4 DOMAIN EXTENSION FOR ORE Although our small-domain ORE construction from Sec- tion 3 achieves the strongest possible notion of security for ORE, it is limited to polynomially-sized message spaces In this section, we show how to construct an efficient ORE scheme for large domains which achieves provably stronger security guarantees than all existing efficient ORE construc- tions for large domains|,Non-data,77
| Our construction can be viewed as a composition of our small-domain ORE construction together with the ORE scheme by Chenette et al [22] Intuitively, we can view the techniques used in the Ch- enette et al construction as a domain-extension mechanism 1171for ORE|,Non-data,77
| In particular, their construction can be viewed as a general transformation that takes as input a k-bit ORE scheme and outputs an kn-bit ORE scheme, with ciphertext expansion that grows linearly in n and a slight reduction in security (that degrades with n) Under this lens, the Ch- enette et al construction can be viewed as taking a 1-bit ORE scheme (with best-possible security) and extending it to an n-bit ORE scheme In this work, we apply this general domain-extension technique to our small-domain ORE from Section 3, and show how we can start with a d-bit ORE and extend it to a dn-bit ORE|,Non-data,77
| By varying the parameters n and d, we obtain a performance-security tradeoff At a high level, our composed construction implements encryption via several parallel (prefix-dependent) instances of the small- domain ORE scheme Π(s) ore from Section 3, one for each block of the plaintext Using the techniques of Chenette et al [22], a blinding factor is derived from the prefix of each block and used to mask the Π(s) ore ciphertexts for that block|,Non-data,77
| We give the precise leakage of our construction in Theorem 41 Construction Fix a security parameter λ ∈ N, a message space size N > 0, and integers d, n > 0 such that dn ≥ N |,Non-data,77
| Let F : {0, 1}λ×[N ] → {0, 1}λ be a secure PRF on variable- length inputs,5 H : {0, 1}λ×{0, 1}λ → Z3 be a hash function (modeled as a random oracle), and π : {0, 1}λ × [d] → [d] be a secure PRP For a d-ary string x = x1x2 ··· xn, let x||i = x1x2 ··· xi denote the d-ary string representing the first i digits of x (ie, the length-i prefix of x), and let x||0 be the empty prefix|,Non-data,77
| We define our ORE scheme Πore = (ORESetup, OREEncryptL, OREEncryptR, ORE|,Non-data,77
|Compare) as follows • ORESetup(1λ) The setup algorithm samples PRF keys r←− {0, 1}λ|,Non-data,77
| The master secret key is sk = (k1, k2) • OREEncryptL(sk, x) Let sk = (k1, k2)|,Non-data,77
| For each i ∈ [n], the left encryption algorithm first computes the quantity ̃x = π(F (k2, x||i−1), xi) and then sets ui = (F (k1, x||i−1(cid:107) ̃x), ̃x) It returns the ciphertext ctL = (u1,   |,Non-data,77
| , un) • OREEncryptR(sk, y) Let sk = (k1, k2)|,Non-data,77
| First, the right en- r←− {0, 1}λ cryption algorithm uniformly samples a nonce r Then, for each i ∈ [n] and j ∈ [d], it first sets j∗ = π−1(F (k2, y||i−1), j), it computes k1, k2 zi,j = cmp(j ∗ , yi) + H(F (k1, y||i−1(cid:107)j), r) (mod 3) It then defines the tuple vi = (zi,1,  |,Non-data,77
|  , zi,d) and outputs the ciphertext ctR = (r, v1, v2   |,Non-data,77
| , vn) • ORECompare(ctL, ctR) The compare algorithm first parses ctL = (u1, |,Non-data,77
|   , un) and ctR = (r, v1, v2,  |,Non-data,77
|  , vn), where for each i ∈ [n], we write ui = (k(cid:48) i, hi) and vi = (zi,1,   |,Non-data,77
| , zi,d) Then, let (cid:96) be the smallest index i for which zi,hi − H(k(cid:48) i, r) (cid:54)= 0 (mod 3) If no such (cid:96) exists, output 0 Otherwise, output z(cid:96),h(cid:96) − H(k(cid:48) (cid:96), r) (mod 3)|,Non-data,77
 Correctness Correctness follows similarly to that for the small-domain ORE in Section 3 We give the full argument in the full version [43] Security,Non-data,77
| Before stating our security theorem, we first spec- ify our leakage function L(d) blk Each ciphertext block in our 5The Chenette et al ORE construction also used a PRF on variable-length inputs We refer to their construction [22, §3] for one possible way of constructing a PRF on variable-length inputs from a standard PRF|,Non-data,77
| ORE scheme is essentially a ciphertext for the underlying small-domain ORE, and the comparison operation proceeds block-by-block Intuitively then, since our small-domain ORE scheme leaks nothing except the ordering (Theorem 32), the additional leakage of our new ORE scheme is the index of the first block that differs between two ciphertexts In particular, for messages x = x1x2 ··· xn and y = y1y2 ··· yn written in base d, we define the first differing block function diff (x, y) to be the first index i ∈ [n] such that xj = yj ind(d) for all j < i and xi (cid:54)= yi|,Non-data,77
| If x = y, we define ind(d) diff (x, y) to be n + 1 Then, our leakage function L(d) blk for our extended ORE scheme is given by L(d) blk(m1,   |,Non-data,77
| , mt) = {(i, j, blk(mi, mj)) || 1 ≤ i < j ≤ t} , where blk(mi, mj) = (cmp(mi, mj), ind(d) diff (mi, mj)) In gen- eral, we refer to the parameter d as the arity (or base) of the plaintext space, which grows exponentially in the length (in bits) of the block We now state our main security theorem Theorem 4|,Non-data,77
1 The ORE scheme Πore is secure with leak- age function Lblk assuming that F is a secure PRF and H is modeled as a random oracle The proof of Theorem 41 can be viewed as a composition of the security proof for our underlying small-domain ORE (Theorem 3,Non-data,77
|2) and the security proof of the Chenette et al scheme [22, Theorem 32] We give the proof in the full version|,Non-data,77
| Space usage Ciphertexts in our new ORE scheme con- sist essentially of n ciphertexts for our small-domain ORE scheme (with domain size d) More concretely, a left cipher- text in our new scheme consists of n(λ + (cid:100)log d(cid:101)) bits and a right ciphertext consists of λ + n(cid:100)d log2 3(cid:101) bits Since the size of the plaintext space N satisfies N ≤ dn, ciphertext size in our new ORE scheme grow as O((λ + d) logd N )|,Non-data,77
| Non-uniform block sizes In practice, some bits of the plaintext may be more sensitive than others Leaking infor- mation about these bits is less desirable than leaking infor- mation about less sensitive bits To accommodate the differ- ent sensitivities, we can use different input bases (e|,Non-data,77
|g, use larger blocks for more sensitive bits) for the different blocks of the ciphertext The leakage in the resulting scheme is still the index of the first (variable-sized) block that differs between two messages Correctness is unchanged|,Non-data,77
| 5 ENCRYPTED RANGE QUERIES In this section, we formally define the properties of a client-server protocol for range queries over an encrypted database In our model, a client stores an encrypted database on the server The client can update the database (e|,Non-data,77
|g, by adding or removing records) and issue range queries against the database In a range query, the client specifies a numeric interval and the server responds by returning all ciphertexts whose underlying messages fall within that interval Although our definitions are stated in terms of numeric in- tervals, our methods are broadly applicable to more general settings—in particular, to any well-ordered domain such as English names|,Non-data,77
| For example, when the database consists of encrypted alphanumeric strings, range queries can be used for both exact-keyword as well as prefixed-based search Our security definitions are adapted from existing defi- nitions for searchable symmetric encryption (SSE) [24, 20] 1172We survey some of the work on SSE in Section 8 In our def- initions we consider both the online and offline settings|,Non-data,77
| In the online setting, the adversary sits on the server and sees both the encrypted database as well as the client’s queries, while in the offline setting, the adversary just obtains a dump of the server’s encrypted database By showing that in the offline setting, the server’s encrypted database pro- vides semantic security, we can argue that our new range query scheme provides robustness against the kinds of of- fline inference attacks considered by Naveed et al [46] After formally defining the security requirements for a range query protocol, we give a construction based on our ORE scheme Πore from Section 4|,Non-data,77
| Our protocol not only satisfies our security properties, but also has several addi- tional appealing properties such as sublinear query time (in the size of the database) and optimal round complexity Our proposed protocol is easily extensible to the multi- client setting where many clients are interacting with the server Each authorized client is simply given the secret key needed to query and update the database 5|,Non-data,77
|1 Range Query Schemes We begin with a formal definition of a range query scheme, followed by our notions of online and offline security We describe a range query scheme in terms of a set of algo- rithms, where each algorithm is a single-round protocol be- tween the client and the server In each protocol, the client is always stateless, but the server is stateful—in particular, the server’s state represents the information stored on the server needed to efficiently respond to the client’s queries, including the encrypted database itself Initially, the client runs a setup procedure that takes as input a plaintext database D of values and outputs a se- cret key sk and some token t representing the encrypted database|,Non-data,77
| The token t is given to the server, and the server outputs some initial state st Then, for each query (range query, insert query, delete query), the client uses the secret key sk to derive a token t representing its query, and sends t to the server This token contains a masked version of the client’s input for the query On input a query token t, the server processes the query and updates its internal state|,Non-data,77
