| • Discovering correlations between anomalous traffic types detected with deep inspection techniques and traffic feature entropy variations. • Providing a traffic-type dissection (in-depth and entropy based) of a representative portion of the IBR for three weeks of April, 2012, with a 10-minute time scope|,Data,167
 Following is the summary of information about these data sets:  1. Data set from PREDICT USA [24] which contains traces of a DNS distributed denial of service attack (DDOS),Data,168
  from optical  2. Data set from CAIDA USA [25] which contains internet internet connectivity from 2002 and 2003,Data,168
  3. Data set from our experiment in which a PCAP file is captured from a lab computer which is being used for browsing and software development for the cyber security project,Data,168
| That is, we define the functional- ity f×(a, b) = (c, d) where c⊕ d = a· b The folklore protocol for computing f× works as follows: 1 Parties P1 and P2 hold input bits a ∈ {0, 1} and b ∈ {0, 1}, respectively 2|,Non-data,76
| P1 chooses a random r ∈ {0, 1} P1 sets x0 = r and x1 = r ⊕ a 3 P1 and P2 run a bit oblivious transfer where P1 plays the sender with inputs (x0, x1) and P2 plays the receiver with input bit b|,Non-data,76
 Party P2 receives xb 4 P1 outputs r and P2 outputs xb Observe that xb = r ⊕ a · b (since b = 0 implies that xb = x0 = r and b = 1 implies that xb = x1 = r ⊕ a),Non-data,76
| Thus, r ⊕ xb = a · b, as required The cost of securely computing f× is therefore a single OT The protocol is trivially secure since the only information received is via the OT; thus P1 learns nothing and P2 learns only its share of the output Secure string-bit multiplication|,Non-data,76
| Observe that within Eq (2), we need to also multiply Rj by a bit It is possible to use f× for this However, since Rj is of length κ (in practice, say 128), this increases the number of oblivious transfers by κ, which is very significant|,Non-data,76
| We therefore would like to securely compute the functionality f κ×(s, b) = (c, d) where c ⊕ d = s · b and where s ∈ {0, 1}κ and b ∈ {0, 1} Fortunately, f κ× can be securely computed using a single string OT in the exact same way as f× with P1 inputting (r, r ⊕ s) in the oblivious transfer Thus, this also costs a single oblivious transfer 3|,Non-data,76
|12 The Protocol for FGC We describe our protocol in the (f×, f κ×)-hybrid model where the parties have access to a trusted party computing f× and f κ× for them As we have seen, these functionalities can be securely computed efficiently using oblivious transfer Protocol 3|,Non-data,76
|1 (Securely Computing Eq (2)) 1 Step 1: In this step, the parties securely compute XOR def= λu · λv|,Non-data,76
| Recalling that each party Pi shares of λuv holds λi u, λi v, we have that λuv = λu · λv = (cid:16)⊕n = i=1λi u · λi v (cid:16)⊕n (cid:17) ·(cid:16)⊕n (cid:17) ⊕(cid:16)⊕i(cid:54)=jλi i=1λi u i=1λi u u · λj v (cid:17) (cid:17)  (3) u · λi u, λi u·λi v In addition, u, λj v) v) in order to obtain XOR shares of the prod- v together with all of the uv Each party Pi can locally compute λi each pair of parties Pi, Pj (with i (cid:54)= j) runs f×(λi and f×(λj ucts|,Non-data,76
| Finally, each Pi XORs λi output shares received from f×; denote the result by λi By Eq (3), it follows that ⊕n uv = λuv, as required 2 Step 2: Given shares of λuv = λu · λv, the parties gener- def= λu · ̄λv ⊕ def= ̄λu · ̄λv ⊕ λw|,Non-data,76
| def= λuv ⊕ λw, of λu ̄vw ate XOR shares of λuvw λw, of λ ̄uvw This can be carried out using local computation only def= ̄λu · λv ⊕ λw, and of λ ̄u ̄vw i=1λi uv ⊕ λi w (where λi Trivially, in order to obtain shares of λuvw it suffices for each Pi to compute λi uvw = λi w is its input share on the output wire) Furthermore, observe that λu · ̄λv = λu · (λv ⊕ 1) = λu · λv ⊕ λu Thus, each Pi can compute its share λi u ̄vw = uv ⊕ λi λi w|,Non-data,76
| In a similar way, each Pi computes its u⊕λi v⊕λi shares λi w (where P1 XORs its result with 1 in this last case) u ⊕ λi ̄uvw = λi uv⊕λi uv⊕λi  ̄u ̄vw = λi w and λi v⊕λi 3 Step 3: In this step, the parties securely compute XOR shares of Rj · ((λu ⊕ α) · (λv ⊕ β) ⊕ λw), for every j = 1,  |,Non-data,76
|  , n and every α, β ∈ {0, 1} Observe that they al- ready have XOR shares of λuvw, λu ̄vw, λ ̄uvw, λ ̄u ̄vw, and so need only to run f κ× That is, for every j = 1, |,Non-data,76
|   , n, party Pj runs four invocations of f κ× with every Pi In ev- ery invocation Pj inputs Rj, whereas Pi inputs its share λi uvw in the first invocation, λi u ̄vw in the second invoca- tion, and so on|,Non-data,76
| Denote by ρi j,α,β party Pi’s share of Rj · ((λu ⊕ α) · (λv ⊕ β) ⊕ λw) 4 Step 4: In this final step, the parties conclude the secure computation of Eq (2); recall that the aim is for each party to hold the 4n values { ̃gj j=1|,Non-data,76
| We describe this for general α, β and use the shares of ρi that were generated above 1,1}n 1,0, ̃gj 0,1, ̃gj 0,0, ̃gj j,α,β 584For every j = 1,   |,Non-data,76
| , n and every α, β ∈ {0, 1}, party Pj sends F 2 j,α,β to all other parties, u,α,kj kj (g ◦ j) ⊕ kj w,0 ⊕ ρj v,β and each party Pi sends the string F 2 u,α,ki j,α,β ki to all other parties The parties then XOR all these values together, and the result is ̃gj α,β, as required v,β (g◦j)⊕ρi Security Intuitively, the protocol is secure since in Steps 1– 3 the only values that the parties see are random shares out- put from f× and f κ×|,Non-data,76
| Then, in Step 4, the parties all send their shares to each other However, these shares are all random under the constraint that their XOR is ̃gj α,β, and so reveal nothing but the result The full proof of the following will appear in the full version of this paper Theorem 3|,Non-data,76
|2 Protocol 31 securely computes the n-party FGC functionality with n parties in the (f×, f κ×)-hybrid model, in the presence of a semi-honest adversary corrupting any number of parties Cost|,Non-data,76
| Using the OT extension protocol of [20, 3], we have that each (bit or string) oblivious transfer costs two hash function invocations and two rounds of communication (a single message from the receiver to the sender and a sin- gle message back) However, bit-OT is significantly cheaper than string-OT since it requires much less communication, which is the bottleneck Note that bit-OT is much faster than string-OT, but a single string-OT for strings of length κ is much faster than running κ executions of bit-OT We count the number of OT calls run by each party (as sender and as receiver); recall that f× is just a single bit- OT and f κ× is just a single string-OT|,Non-data,76
| The number of OT invocations equals 2(n−1) bit-OT plus 8(n−1) string-OT: in Step 1 each party computes 2(n− 1) bit-OTs, and in Step 3 each party computes 8(n− 1) string-OTs (4(n− 1) as sender and 4(n− 1) as receiver) Observe that the use of f κ× instead of κ calls to f× is very significant and reduces the cost in Step 3 from 8(n − 1)κ bit-OTs to 8(n − 1) string-OTs The number of rounds in the entire protocol is five; two rounds in each of Step 1 and 3, and a single message in Step 4 3|,Non-data,76
|13 Reducing the Number of String-OTs We now show that it is possible to reduce the number of string-OTs from 8(n−1) to 6(n−1), saving 25% Specifically, we show how it is possible to securely compute ̃gj 1,1 from the shares ρi j,1,0 (see Step 3 of the protocol) without running any OTs As a result, the parties do not need to run the f κ× invocations where the receiver inputs its share of λi ̄u ̄vw|,Non-data,76
| This means that each Pj only needs to run three invocations of f κ× as sender, instead of four j,0,1⊕ρj parties, and each party Pi sends the string F 2 ki u,1,ki j,0,0 ⊕ ρi ρi XOR of all these values is ̃gj denote ⊕n the XOR of all these values equals 1,1, party Pj sends the message j,1,0 to all other (g◦ j)⊕ j,1,0 to all other parties We argue that the In order to see this, first (g ◦ j) by Kg,j Then, we have that w,0 ⊕ Rj(cid:1)⊕ρj (g◦j)⊕(cid:0)kj In order to compute ̃gj i=1F 2 ki u,1,ki j,0,1 ⊕ ρi j,0,0⊕ρj F 2 kj u,1,kj j,0,1, ρi j,0,0, ρi 1,1|,Non-data,76
| v,1 v,1 v,1 Kg,j ⊕ kj w,0 ⊕ Rj ⊕ Rj · (λu · λv ⊕ λw) ⊕ Rj ·(cid:0) ̄λu · λv ⊕ λw (cid:1) ⊕ Rj ·(cid:0)λu · ̄λv ⊕ λw (cid:1)  Rewriting the above, we have that it equals Kg,j ⊕ kj ⊕Rj · (1 ⊕ λu · λv ⊕ ̄λu · λv ⊕ λu · ̄λv ⊕ λw) w,0 (Note that v,1 λw appears 3 times and so 2 cancel out) Now, for any bits x, y ∈ {0, 1}, it holds that 1 ⊕ x · y ⊕ ̄x · y ⊕ x · ̄y = ̄x · ̄y|,Non-data,76
| Thus, we conclude that the XOR of all the values equals Kg,j ⊕ kj w,0 ⊕ Rj ·(cid:0) ̄λu · ̄λv ⊕ λw (cid:1) which is exactly ̃gj 1,1 The security of this optimization holds since all messages (g◦j) and therefore reveal noth- sent are masked by F 2 ki u,1,ki ing (They look random and so can be easily simulated) 3|,Non-data,76
|14 Using More Efficient OT It was shown in [3] that in the Yao protocol, it is pos- sible to use a variant of OT – called correlated OT – that is significantly more efficient This version of OT can be used when there is a difference ∆ and the sender’s input is a random pair (x0, x1) with x0 ⊕ x1 = ∆ When using the free-XOR method within Yao’s protocol, it follows that the garbled labels on the input wires can be random un- der the constraint that they have a fixed difference|,Non-data,76
| Thus, correlated-OT suffices Observe now that all the calls to OT are for computing f× and f κ× In these protocols, party P1 with input bit a (resp, string s) runs the OT-sender with random inputs (x0, x1) under the constraint that x0⊕x1 = a (resp|,Non-data,76
|, x0 ⊕ x1 = s) The protocols are not described in that way, but this is the result of choosing r and setting x0 = r and x1 = r⊕ a Thus, it is possible to use the correlated-OT protocol here and save additional cost 3|,Non-data,76
|2 A New BGW-Based Protocol The FairplayMP [7] system used the information-theoretic BGW protocol [8] in order to securely compute the FGC functionality In this section, we present a protocol that also uses the BGW protocol in order to securely compute FGC  However, there are a number of important differences: 1 We point out and fix a small bug in the FairplayMP pro- tocol: In FairplayMP, each party singlehandedly chooses all the keys for its input wires|,Non-data,76
| This renders the protocol insecure: every party is able to compute the circuit mul- tiple times, with different inputs of its own (with a fixed setting of the other parties’ inputs) 2 FairplayMP works over a prime-order field In contrast, we work in GF (2k) which is a field of characteristic 2|,Non-data,76
| First and foremost, this makes it possible to incorporate the free-XOR technique into BMR Second, by using a field of characteristic 2, we are able to reduce the round complexity of the protocol This is due to the fact that in such a field the XOR of λuv with λw (as required when computing Eq (2)) can be carried out with local compu- tation only|,Non-data,76
| In contrast, FairplayMP requires interaction to compute this (XOR is not addition in their finite field, and so they need a protocol to compute this) 3 We use a finite field that is large enough to embed each individual key kj u,α, whereas FairplayMP embed the en- u,α of length n · κ in the finite u,α,  |,Non-data,76
|  , kn tire “superseed” k1 In the case of 33 parties and keys of length 128 field bits, FairplayMP would have to work in a finite field with elements of size at least 4,224 bits This means that Fair- playMP scales poorly for large numbers of parties (since each operation becomes more expensive)|,Non-data,76
| In contrast, we work with each key separately and so the finite field is always of length κ, resulting in linear growth in the cost per party (at least with respect to the basic operations over k1 u,α,    , kn u,α)|,Non-data,76
| 5854 We compute multiplications of the λ combinations only with R1,   |,Non-data,76
| , Rn In contrast, FairplayMP compute their analog of Eq (2) by multiplying both k1 u,0 and u,1 ◦ ··· ◦ kn k1 u,1 with the λ combinations u,0 ◦···◦ kn As we will see below, the focus of our protocol design here was to reduce the number of rounds to an absolute minimum|,Non-data,76
| Our basic BGW-based protocol In general, BGW can be used to compute any arithmetic circuit Furthermore, addition is free in the circuit, and multiplication requires in- teraction (and computation) When working in a finite field of characteristic 2, it follows that XOR equals addition, mak- ing the computation of Eq|,Non-data,76
| (2) trivial Specifically, Eq (2) simply defines an arithmetic circuit over the field with two multiplications and 4n additions To be exact, in order to compute ̃gj α,β: ⊕ kj F 2 kj u,α,kj 1|,Non-data,76
| Party Pj inputs values Kj, Rj, Uj, Vj, Wj where Kj = v ⊕ β and Wj = λj w 2 Each party Pi (i (cid:54)= j) inputs Ki, Ui, Vi, Wi where Ki = u⊕ α, Vj = λj w,0, Uj = λj v,β F 2 u,α,ki ki v,β , Ui = λi u, Vi = λi v and Wi = λi w 3|,Non-data,76
| Using BGW, the parties evaluate the circuit for: i=1Wi)) i=1Ki)⊕Rj·((⊕n i=1Vi)⊕(⊕n i=1Ui)·(⊕n (⊕n Beyond the ability to use free-XOR, we therefore see that the choice of the field to be of characteristic 2 yields a much simpler protocol as well Since BGW is secure, we have that this protocol for computing FGC is automatically secure Protocol details and round complexity – BGW4|,Non-data,76
| The above BGW protocol can be carried out in just 4 rounds of communication; for this reason we call it BGW4 (to distin- guish it from other variants that we will describe below) In order to see how 4 rounds suffice, we describe its steps in de- α,β values (for all j = 1,   |,Non-data,76
| , n, all α, β ∈ {0, 1} and tail All ̃gj all gates) are computed in parallel Each value is computed as follows: Communication round 1: All inputs are shared using t-out- of-n Shamir secret sharing, with t = (cid:100)n/2(cid:101) − 1 Local computation: The parties carry out local additions, as required by the circuit, in order to obtain shares of λu⊕ α = i=1Ui and λv⊕β = ⊕n ⊕n i=1Vi|,Non-data,76
| In addition, the parties locally multiply their shares of λu ⊕ α and λv ⊕ β Denote this product by λα,β u,v  Communication round 2: The parties run the GRR [14] de- gree reduction step on the product λα,β u,v to recover legitimate shares of λα,β u,v of degree t This is best achieved by each party i resharing ci · λα,β u,v in a t-out-of-n sharing, where ci is a fixed (degree-reduction) constant of that party (which is precomputed once), and then summing the received shares|,Non-data,76
| u,v ⊕ λw with Rj Local computation: The parties locally add their shares of λw to λα,β u,v  Next, the parties once again locally multiply their shares of λα,β Communication round 3: The parties run the GRR degree reduction step on Rj · (λα,β Local computation: The parties locally add the shares of the Ki values to the result of the previous step Communication round 4: The parties send their shares to each others and reconstruct to obtain ̃gj u,v ⊕ λw) as above|,Non-data,76
| α,β Computational complexity The above is repeated 4n times for each gate with each computation requiring 3 Shamir secret sharings Each sharing requires evaluating a degree-t polynomial on n points, which takes t· n ≈ n2/2 field multi- plications|,Non-data,76
| The number of multiplications is therefore dom- inated by the first and third communication rounds, where the number of shares is ≈ 4n per gate, thus requiring ≈ 2n3 multiplications per gate Therefore, asymptotically, the par- ties compute 4n3 field multiplications per gate of the circuit (concretely, there are slightly more), which is cubic in the number of parties As we will see in Section 4, this signifi- cantly affect performance when the number of parties is not small (We stress that the number of multiplications would be only quadratic had we worked in a field of size n·κ|,Non-data,76
| How- ever, since multiplication is quadratic, the cost of computing one multiplication in a field of size n · κ is n2 · κ2, versus a cost of n · κ2 for n multiplications in a field of size κ) 33 Reducing the Round Complexity In this section, we briefly describe how the number of rounds can be further reduced The idea of reducing rounds by omitting reduction steps in BGW already appeared in [19], but the following is a more concretely efficient way of achieving this|,Non-data,76
| BGW3 – three rounds with an honest majority The protocol described above that is secure with an honest ma- jority has 4 rounds of communication However, it is possible to save one round of communication by simply not running the degree reduction step on the Rj · (λα,β u,v ⊕ λw) values This works since the parties only add their shares of the Ki values to Rj · (λα,β u,v ⊕ λw)|,Non-data,76
| Thus, if the Ki values are shared using a 2t-degree polynomial instead (at the onset), then the degrees of the shares of Ki and Rj ·(λα,β u,v ⊕λw) will be equal, and so they can be locally added The reconstruction works in the same way, and thus this yields a 3-round protocol We remark that beyond the fact that this has one round less, it also has far less communication This is because the second degree-reduction is carried out on the shares of Rj · (λα,β u,v ) and so there are 4n degree-reductions per gate, resulting in a large amount of bandwidth|,Non-data,76
| Thus, as we will see in Sec- tion 4, this protocol is always better, and often significantly better, than the 4-round protocol BGW4 BGW2 – two rounds with more than 2/3 honest It is possible to further reduce the round complexity of the protocol to just two rounds in the case that more than 2/3 of the parties are guaranteed to be honest, since no degree reduction is needed at all However, this has less effect on the amount of communication (since there are only a small number of degree reductions remaining)|,Non-data,76
 34 Optimizing Field Multiplications We use κ = 128 and therefore work in GF (2128) We use the Intel PCLMULQDQ carry-less multiplication instruc- tion to obtain extremely fast pipelined multiplication oper- ations in GF (2128) [16] This works by combining 4 carry- less multiplication operations over 64-bit operands,Non-data,76
| In addi- tion, observe that the majority of the multiplications are for generating Shamir secret sharing This works by taking a distinct field element ωi for every party, and evaluating ran- dom polynomials on these values (which means multiplying by ωi, ω2 i ) By choosing ωi to be of small degree, we have that for a small enough d, all of ωi, ω2 i are less i ,  |,Non-data,76
|  , ωd i ,   |,Non-data,76
| , ωd 586than 64 bits long, and so a 128-bit element is multiplied with a 64-bit element This can be achieved in just 2 carry-less multiplications instead of 4 When the number of parties exceeds 15, at least 5 bits are needed for each ωi value and so the length of ωd i exceeds 64 bits, making the optimization no longer applicable 4|,Non-data,76
| EXPERIMENTAL EVALUATION We implemented our protocols and ran multiple experi- ments for different circuit sizes and depths, different num- ber of parties, and different latencies In order to obtain a deeper understanding of the strengths and (possible) weak- nesses of the BMR protocol, we included the GMW proto- col in our experiments The GMW protocol has multiple rounds of communication, but far less bandwidth than the BMR protocol In addition, it is currently the only other general protocol for multiparty computation for the case of dishonest majority known|,Non-data,76
| We used the code of [10] for these experiments As described in Section 13, this code is highly optimized and uses OT extension in an offline phase for precomputing the oblivious transfers We ran their code on the same circuits and platforms as our BMR code|,Non-data,76
| (For the sake of brevity, in this section we refer to “BMR” as our different protocols; it is not to be misinterpreted as the original protocol of [5] which was purely theoretical) We measured times separately for the offline and online portion of the executions In BMR, the entire construction of the circuit can be run offline, before the inputs are given Thus, the online phase has very little communication and is dominated by local computation of the circuit|,Non-data,76
| In con- trast, in the GMW protocol, the offline phase consists only of preprocessing the oblivious transfers We stress that the code of [10] does not merely run the base OTs as part of the OT extensions in the offline phase Rather, they run random OTs and use the OT preprocessing method of [4] Thus, in the online phase, the receiver sends a single bit to the sender and the sender replies with two bits|,Non-data,76
| In addition, the parties entire computation requires merely XORing the preprocessed bits with the actual inputs As a result, the GMW online phase has very little computation and com- munication, but many rounds of communication We stress that in applications where low latency is required, the online time of a protocol is the main factor to be considered (as- suming reasonable offline time) In contrast, in cases where the overall throughput is what is important, the total time is the main factor to be considered|,Non-data,76
| Platforms and parameters We ran our experiments on three different platforms First, we ran them on a clus- ter with a very low latency network called CREATE [1] (which is part of the DETER project) The cluster is com- prised of Intel XEON 2|,Non-data,76
|20 GHz machines (E5-2420) with 6 cores running Linux (Ubuntu1404-64-STD), and with a 1Gb connection and ping time between computers of ap- proximately 01ms In addition, we ran our experiments on Amazon c48xlarge instances (running Windows Server 2012 R2 Base) in two configurations: in the first, all ma- chines are located in a single zone (Virginia); in the second, the machines were split between Ireland and Virginia (in preliminary experiments, this gave similar performance to where the latency was the same between all parties)|,Non-data,76
| The ping time within a single region is approximately 1ms, and the ping time between Virginia and Ireland is approximately 75ms The bandwidth of all connections (according to Ama- zon’s specifications) is 10Gb The experiments in CREATE provide a very clean (low-latency) environment without ex- ternal network effects, whereas the experiments in Amazon reflect performance in more “real-world” settings with net- working fluctuation We ran the protocol for 3, 5, 7, 9, 11 and 13 parties, and in some cases 33 parties|,Non-data,76
| We used 2 different circuits: a circuit computing the AES function with 6,800 AND gates and 256 input wires per party, and a circuit computing SHA256 with 90,825 AND gates and 512 input wires per party Since the depth of the circuit is very significant for GMW, we also generated 4 synthetic circuits of the same size as the SHA256 circuit, but with respective depths of d = 10, d = 100, d = 1000 and d = 4000 (the real SHA256 circuit has depth 4000) Raw results Each experiment was run 50 times, and we computed the mean and standard deviation of all runs|,Non-data,76
| The numbers in the tables here are measured in milliseconds, and present a 95% confidence interval Observe that the interval is sometimes very large This is especially true in Amazon in Virginia-Ireland This expresses the reality that when sending a large amount of data over the Internet, the fluctuations are significant|,Non-data,76
 The full tables containing all results will appear in the full version of this paper 41 Protocol Improvements Measurements We measured the effect of the different protocol optimiza- tions on the running time We ran the basic OT-based pro- tocol without additional optimizations (Section 3,Non-data,76
|12), with the reduced number of OTs (Section 313), using correlated- OT (Section 3|,Non-data,76
|14), with the free-XOR optimization, and with two threads between every pair of parties (increasing to more than two threads between every pair of parties reduced performance since the number of threads becomes very high with many parties) Our measurements were made on the CREATE platform, with 13 parties and the SHA-256 circuit with 90,825 AND gates and 42,029 XOR gates The results are as follows: Basic Red|,Non-data,76
| OT Free-XOR 2 OT-Threads OT-Off 6434 5549 ± 207 4011 ± 156 2851 ± 101 2633 ± 117 311 ± 20 OT-On 434 ± 36 399 ± 46 313 ± 18 C-OT The gain by using a reduced number of OTs and by using the correlated-OT protocol is very significant In all cases, free-XOR provides exactly the expected speedup by drop- ping the cost by the ratio of XOR gates to overall gates Since all the improvements are also related to communica- tion, we also tested them in a network with network latency of 76 ms (with 13 parties and the SHA-256 circuit, as above) The results are: Basic Red|,Non-data,76
| OT Free-XOR 2 OT-Threads OT-Off 45631 42408 ± 6300 40644 ± 6266 31071 ± 6720 28805 ± 6878 OT-On 664 ± 128 746 ± 56 773 ± 49 655 ± 81 C-OT We also ran our 3-round BGW-based protocol in the LAN setting on the CREATE platform, measuring the influence of optimized multiplications, free-XOR, and multithreading Basic Opt Mult Free-XOR 2 Mult|,Non-data,76
