 6303. DATASETS Our Internet-wide study of key sharing in the HTTPS ecosystem is driven by four datasets: SSL certificates We use SSL certificates from full IPv4 scans as the basis of our measurements,Data,0
| Our SSL scans [30] also contain information on the IP address(es) that advertised each certificate. To obtain in- formation about the entity that controls this IP address, we use full IPv4 reverse DNS scans [29] that are also conducted by Rapid7|,Data,0
| Each AS is assigned an AS Number (ASN): for example, MIT is AS 3 and the Chicago Public Schools are AS 1416 [26]. CAIDA collects and publishes mappings between IP addresses and ASNs via their Route- Views datasets [7]|,Data,0
| For example, AT&T owns 160 unique ASNs. To aggregate these, we use CAIDA’s AS- to-Organization dataset [8] to group together ASes owned by the same organization|,Data,0
| For that, we rely on WHOIS [12], a protocol for querying domain registrars to obtain data on the domain owner. In practice, WHOIS data often contains fields such as the con- tact information for the owner of the domain, the contact for technical issues, where to send abuse complaints, and so on|,Data,0
| Here, we expand upon these prior findings by evaluating whether there is a correlation between centralized management and the quality of the keys chosen. Figure 13 compares several different features of self- managed and outsourced certificates across our entire cor- pus of leaf certificates (3,275,635 self-managed and 1,781,962 outsourced): (a) Key lengths in self-managed certificates are nearly identical to those managed by third-party hosting providers|,Data,0
|1 Combining Packet Capture (PCAP) Files The data set used in this study is a combination of the packet capture files obtained from two main sources. First of all, the APTs were collected from Contagio malware database [15] contributed by Mila Parkour|,Data,1
| First of all, the APTs were collected from Contagio malware database [15] contributed by Mila Parkour. The normal and non-malicious data is obtained from PREDICT internet data set repository [18] under the category of “DARPA Scalable Network Monitoring (SNM) Program Traffic”|,Data,1
| The data collection was performed during April 2016 using ZGrab, an application-layer scanner that operates with ZMap [15]. In the first phase, we performed an Internet-wide scan of all IPv4 addresses on port 500 to determine which hosts were configured 16This defect was corrected quite recently, years after the version of OpenSSL ScreenOS uses was written|,Data,6
|, download from an external source). Running on 71,000 articles collected from 45 leading technical blogs, this new approach demonstrates a remarkable performance: it gener- ated 900K OpenIOC items with a precision of 95% and a coverage over 90%, which is way beyond what the state-of-the-art NLP tech- nique and industry IOC tool can achieve, at a speed of thousands of articles per hour|,Data,7
| To structure our efforts, we followed a multi- step process. First, we collected exploits from various online databases and exploit frameworks, including Metasploit (22 exploits)3, Exploit-DB (2)4, Packet Storm (5)5, from the security research company Security Explorations (52)6, and an online repository for Java exploits7|,Data,11
| To structure our efforts, we followed a multi- step process. First, we collected exploits from various online databases and exploit frameworks, including Metasploit (22 exploits)3, Exploit-DB (2)4, Packet Storm (5)5, from the security research company Security Explorations (52)6, and an online repository for Java exploits7|,Data,11
| To structure our efforts, we followed a multi- step process. First, we collected exploits from various online databases and exploit frameworks, including Metasploit (22 exploits)3, Exploit-DB (2)4, Packet Storm (5)5, from the security research company Security Explorations (52)6, and an online repository for Java exploits7|,Data,11
| To structure our efforts, we followed a multi- step process. First, we collected exploits from various online databases and exploit frameworks, including Metasploit (22 exploits)3, Exploit-DB (2)4, Packet Storm (5)5, from the security research company Security Explorations (52)6, and an online repository for Java exploits7|,Data,11
| To structure our efforts, we followed a multi- step process. First, we collected exploits from various online databases and exploit frameworks, including Metasploit (22 exploits)3, Exploit-DB (2)4, Packet Storm (5)5, from the security research company Security Explorations (52)6, and an online repository for Java exploits7|,Data,11
 5. ANALYSIS AND FINDINGS In the following we use the extensive documentation of the 61 minimal exploits to provide insight into how attackers use specific vulnerabilities and features of the Java platform to implement their attacks,Data,11
| We run our event analysis on the top 100 free applications in the Android application store to determine how often this happens. In total, our analysis finds 1060 errors across 88 of the top 100 applications (10|,Data,12
| To our knowledge, AUTOREB is the first work that explores the user review information and utilizes the review semantics to predict the risky behaviors at both review-level and app-level. We crawled a real-world dataset of 2, 614, 186 users, 12, 783 apps and 13, 129, 783 reviews from Google play, and use it to comprehensively evaluate AUTOREB|,Data,14
| 4.1 Data collection For each team, we collected a variety of observed and self- reported data|,Data,16
| To demonstrate this, we scraped greatfire.org for websites in the top 1000 Alexa websites that are blocked by the GFW|,Data,18
| (cid:15) Identifying New Vulnerabilities. Our tool successfully an- alyzed 1,591 service interfaces of all the 80 system services in Android 5|,Data,19
| To understand the scope and magnitude of this new XARA threat, we developed an ana- lyzer for automatically inspecting Apple apps’ binaries to deter- mine their susceptibility to the XARA threat, that is, whether they perform security checks when using vulnerable resource-sharing mechanisms and IPC channels, a necessary step that has never been made clear by Apple. In our study, we ran the analyzer on 1,612 most popular MAC apps and 200 iOS apps, and found that more than 88|,Data,24
| To assist software developers (or secu- rity analysts) in tracking down a memory corruption vulnerability, CREDAL also performs analysis and highlights the code fragments corresponding to data corruption. To demonstrate the utility of CREDAL, we use it to analyze 80 crashes corresponding to 73 memory corruption vulnerabilities archived in Offensive Security Exploit Database|,Data,25
| These techniques may be applicable in other scenarios. We implemented and evaluated the attacks against the popular Gmail and Bing services, in several environments and ethical experiments, taking careful, IRB-approved mea- sures to avoid exposure of personal information|,Data,26
|, CSPAutoGen can handle all the inline and dynamic scripts. We have implemented a prototype of CSPAutoGen, and our eval- uation shows that CSPAutoGen can correctly render all the Alexa Top 50 websites|,Data,27
| 5. EXPERIMENTAL RESULTS This section reports on our evaluation of the moments ac- countant, and results on two popular image datasets: MNIST and CIFAR-10|,Data,28
| 6.1 Mobility Trace Dataset We use the CRAWDAD dataset roma/taxi [2, 3] for our simu- lations|,Data,31
 6.1 Evaluation We evaluated the performance of Σoφoς using 4 data sets of increasing size and also the English Wikipedia,Data,33
|1 Datasets, Metrics, Competitors & Settings Datasets. We test EpicRec on two real-world datasets: MovieLens1: a movie rating dataset collected by the Grou- pLens Research Project at the University of Minnesota through the website movielens|,Data,36
| 1 http://grouplens.org/datasets/movielens 188Yelp2: a business rating data provided by RecSys Chal- lenge 2013, in which Yelp reviews, businesses and users are collected at Phoenix, AZ metropolitan area|,Data,36
| The number of movie categories is 18. We use the MovieLens- 1M, with 1000,209 ratings from 6,040 users on 3,883 movies|,Data,36
| Our goal is to show that an ad- versary can insert an unbounded number of Sybil identities in the SybilLimit protocol, breaking its security guarantees. For our evaluation, we consider a real-world Facebook inter- action graph from the New Orleans regional network [28]|,Data,38
| We utilize these papers to extract Android malware behaviors and to construct the semantic network. From the electronic proceedings distributed to conference participants, we collect the papers from the IEEE Sympo- sium on Security and Privacy (S&P’08–S&P’15)4, the Com- puter Security Foundations Symposium (CSF’00–CSF’14), and USENIX Security (Sec’11)|,Data,39
 We conduct experiments on two publicly available set-valued datasets. • AOL search log dataset [1],Data,45
 90% of the users have fewer than 84 keywords in their logs. • Kosarak dataset [2],Data,45
 We select one month of data for our study. The data logs we used are col- lected from more than 30 machines with various server mod- els and operating systems,Data,46
| This paper rigorously investigates how users’ security beliefs, knowledge, and demographics corre- late with their sources of security advice, and how all these factors influence security behaviors. Using a carefully pre- tested, U|,Data,48
 We have ported Valgrind to iOS and implemented a prototype of iRiS on top of it. We evaluated iRiS with 2019 applications from the official App Store,Data,54
| from manufacturing equipment, as shown in Figure 1. We capture the relevant sensor data by deliberately or accidentally placing an attack-enabled phone close to, on top of, or inside a piece of manu- facturing equipment while the machinery is fabricating the target object|,Data,55
| Our new metric helps us compare in a fair way previously proposed attack-detection mechanisms. (ii) We compare previous attack-detection proposals across three di↵erent experimental settings: a) a testbed operating real-world systems, b) network data we collected from an operational large-scale Supervisory Control and Data Acqui- sition (SCADA) system that manages more than 100 Pro- grammable Logic Controllers (PLCs), and c) simulations|,Data,57
| Evaluation. We ran Oyente on 19, 366 smart contracts from the first 1, 460, 000 blocks in Ethereum network and found that 8, 833 contracts potentially have the documented bugs|,Data,58
| First, we consolidate the eight origin-exposing vectors into one auto- mated origin-exposing system called Cloudpiercer. Then, we assemble a list of clients from five CBSP companies by studying their DNS configurations and obtaining their adop- tion rate across the Alexa top 1 million websites|,Data,59
| The vast majority of them were exposed through their A record, indicating a brief dis- abling of the protection system. SSL certificate exposure In order to find IP addresses hosting SSL certificates associ- ated with the domains in the evaluation set, we made use of the publicly available data of Rapid7’s Project Sonar [42]|,Data,59
| 4. LARGE-SCALE ANALYSIS To assess the magnitude of the origin-exposure problem, we conduct a large-scale analysis in which we attempt to uncover the origin of CBSP-protected domains|,Data,59
|1 Dataset Description The dataset was first presented and used by Keller et al. in [23], and is publicly available in the gene expression om- nibus (GEO) database under reference GSE61741|,Data,61
| Although the cost of stor- age and processing have diminished, the cost of maintaining reliable infrastructure for transaction logs is still noticeable. Figure 1: A plot of transaction fee versus frequency for 1 million transactions in May 2015|,Data,65
| To estimate the cost of producing the preprocessing data (multiplication triples, random bits etc.), we used figures from the recent MASCOT protocol [31], which uses OT ex- tensions to obtain what are currently the best reported triple generation times with active security|,Data,67
| In this section, we validate whether the smartphone’s acoustic data can be utilized to deduce the movements. To conduct the validation, we implement an application on Nexus 5 (Android OS v6|,Data,68
| As seen in Table 4, we found that about half of the servers in Alexa’s top 10 support a large number of requests without rekeying. For a better estimate of the number of vulnerable servers, we tested servers from Alexa’s top 10k that negotiate 3DES with a modern client|,Data,72
| For a better estimate of the number of vulnerable servers, we tested servers from Alexa’s top 10k that negotiate 3DES with a modern client. We identified 11483 different HTTPS servers11, and found that 226 of them (1|,Data,72
| In this paper, we study the possible techniques to detect and measure this fraud and evaluate the real impact of OTT bypass on a small European country. For this, we performed more than 15,000 test calls during 8 months and conducted a user study with more than 8,000 users|,Data,78
|, the server cannot learn their relative order) after some number of queries are performed over real-world data. Specifically, we ran an experiment where we inserted over 2 million public employee salary figures from [1] and then performed 1000 random range queries|,Data,79
| In this study, we are interested in finding answers to security- and privacy-related questions about libraries, such as “How prevalent are third- party libraries in the top apps and how up-to-date are the library versions?”, “Do app developers update the libs included in their apps and how quickly do they update?”, or “How prevalent are vulnerabilities identified in prior research [28, 9] in libraries and how many apps are affected?” To answer these questions, we first built a comprehensive repository of third-party libraries and applications (see Section 5). Our library set contains 164 libraries of different categories (Ad- vertising, Cloud,|,Data,84
|) and a total of 2,065 versions. We then collected and tracked the version histories for the top 50 apps of each category on Play between Sep 2015 and July 2016, accumulating to 96,995 packages from 3,590 apps|,Data,84
|6.1, we found in our sample set 360 affected packages from 23 distinct apps, when only considering exact library matches|,Data,84
|15 for Android, which contained an account hijacking vulnerability, on 06/11/2014. In the histories of our sample set apps, we discovered, in total, 394 affected packages from 51 distinct apps, when only considering packages with exact matches of the vulner- able lib version|,Data,84
| We used LibScout to detect the affected application packages in our data set. In total 2,667 app versions of 296 distinct apps with a cumu- lative install-base of 3|,Data,84
| We observed that there is a significant variance in ACFG size. To reduce the sampling bias, we first collect a dataset which covers ACFGs of different functions from various architec- tures|,Data,89
| This dataset was used for base- line comparison, and all functions in this dataset has known ground truth for metric validation. We prepared this dataset using BusyBox (v1|,Data,89
| Dataset II – Public dataset. Recent work such as Pewny et al [45] and Eschweiler et al [23] used the same public dataset based upon two publicly-available firmware images for baseline comparison [7, 8]|,Data,89
| Dataset III – Firmware image dataset. This dataset of 33,045 firmware images was collected from the wild|,Data,89
| As a result, we created a freely available vulnerability database for this effort and for the broader research community. To build this database, we mined official software websites to collect lists of vulnerabilities with the corresponding CVE num- bers|,Data,89
| We selected OpenSSL for demonstration, since it is widely used in IoT devices. The resulting vulnerability database includes 154 vulnerable functions|,Data,89
| Roughly speaking, our measurement methods can be divided into two kinds: those that could be fully automated and scaled eas- ily, and those that required some manual interaction. For the latter, we used a set of 302938 major email providers and email genera- tors, while for the former, we used a much larger set of a million popular providers occurring in the Adobe leak and the Alexa top million Web sites (as potential email generators)|,Data,90
1.2 Provider List We created the set of popular email providers based on the top 1 million email address domains occurring in the leaked Adobe user data set of September 2013,Data,90
| Using a combination of mea- surement techniques, we determine whether major providers sup- ports TLS at each point in their email message path, and whether they support SPF and DKIM on incoming and outgoing mail. We found that while more than half of the top 20,000 receiving MTAs supported TLS, and support for TLS is increasing, servers do not check certificates, opening the Internet email system up to man- in-the-middle eavesdropping attacks|,Data,90
|26 and are configured with 4G RAM and 2 virtual processors. The VMs for TorA run on a workstation and are connected to a campus wired network, whereas the VMs for TorB and TorC are run on a laptop and connect to a home wired network, Each of these three datasets contains 30,000 traces collected as follows: (1) For each target obfuscator, we used our trace collection framework to visit Alexa Top 5,000 websites to collect 5,000 traces (labeled as obfs3, obfs4, fte, meekG, and meekA, corresponding to obfsproxy3, obfsproxy4, FTE, meek-google, and meek-amazon respectively); (2) In addition, we visited the same set of websites without Tor and obfuscators to collect 5,000 traces and labeled them as nonTor|,Data,91
|26 and are configured with 4G RAM and 2 virtual processors. The VMs for TorA run on a workstation and are connected to a campus wired network, whereas the VMs for TorB and TorC are run on a laptop and connect to a home wired network, Each of these three datasets contains 30,000 traces collected as follows: (1) For each target obfuscator, we used our trace collection framework to visit Alexa Top 5,000 websites to collect 5,000 traces (labeled as obfs3, obfs4, fte, meekG, and meekA, corresponding to obfsproxy3, obfsproxy4, FTE, meek-google, and meek-amazon respectively); (2) In addition, we visited the same set of websites without Tor and obfuscators to collect 5,000 traces and labeled them as nonTor|,Data,91
| 3.1 Datasets We use two major types of datasets: (1) packet-level traffic traces collected at various locations in a campus network, and (2) packet-level traces for Tor Pluggable Transport traffic collected in controlled environments|,Data,91
 Evaluation: local mixing time in social graphs. We use 10 various large-scale real-world social network topolo- gies that mainly come from the Stanford Large Network Dataset Collection [23] and other sources [45] to evaluate the local mixing time for nodes in social graphs,Data,92
| Feature Functions and Weights. To learn all feature functions and weights, we downloaded 1784 non-obfuscated Android applications from F-Droid [3], a popular repository for open-source Android applications|,Data,93
2.2 Experiments with Malware Samples We randomly selected one sample from each of the 49 mal- ware families reported in [40],Data,93
1_r1). Apps in our dataset used for the case study are downloaded from the Google official market (Google Play) in May 2016,Data,95
| • Using SInspector, we perform the first study of Unix domain sockets on Android, including the categoriza- tion of usage, existing security measures being en- forced, and common flaws and security implications. We analyze 14,644 apps and 60 system daemons, find- ing that 45 apps, as well as 9 system daemons, have vulnerabilities, some of which are very serious|,Data,98
| We presented SInspector, a tool for discovering potential security vulnerabilities through the process of identifying socket addresses, detecting authen- tication checks, and performing data flow analysis on na- 90tive code. We analyzed 14,644 Android apps and 60 system daemons, finding that some apps, as well as certain system daemons, suffer from serious vulnerabilities, including root privilege escalation, arbitrary file access, and factory reset- ting|,Data,98
| Our results show that many of our attacks succeed with a 100% chance such that the Sound-Proof cor- relation algorithm will accept the attacked audio samples as valid. Third, we collect general population statistics via an online sur- vey to determine the phone usage habits relevant to our attacks|,Data,100
 We find that the larger width of integer types and the increased amount of addressable memory introduce previously non-existent vulnerabilities that often lie dormant in program code. We empirically evaluate the prevalence of these flaws on the source code of Debian stable (“Jessie”) and 200 popular open-source projects hosted on GitHub,Data,104
| We have applied UniSan to the latest Linux kernel and Android kernel and found that UniSan can successfully prevent 43 known uninitialized data leaks, as well as many new ones. In particular, 19 of the new data leak vulnerabilities in the latest kernels have been confirmed by the Linux community and Google|,Data,107
| This allows us to prevent replay attacks, which are possibly the most applicable attack vectors against biometric authentication. Using a gaze tracking device, we build a prototype of our system and perform a series of systematic user experiments with 30 participants from the general public|,Data,108
| If two commits were blamed for the same amount of lines, blame both. Our heuristic maps the 718 CVEs of our dataset to 640 VCCs|,Data,109
| However, improving our blame heuristics further is an interesting avenue for future research. Apart from the 640 VCCs, we have a large set of 169,502 unclassified commits|,Data,109
|9 The SVM detected a high amount of excep- tions, a high number of changed code, inline ASM code, and variables containing user input such as __input and user. 6As previously mentioned we use the years 2011–2014 as the test dataset, since we have ground truth data on which to base the discussion|,Data,109
| When given a source file, Flawfinder returns lines with suspected vul- nerabilities. It offers a short explanation of the finding as well as a link to the Common Weakness Enumeration (CVE) database|,Data,109
| The paper makes three contributions. First, we conducted the first large-scale mapping of CVEs to GitHub commits in order to create a vulnerable commit database|,Data,109
| Our results show that our approach significantly outperforms the vulner- ability finder Flawfinder. We created a large test database containing 66 C and C++ project with 170,860 commits on which to evaluate and compare our approach|,Data,109
 VoiceLive takes advantages of the user’s unique vocal system and high quality stereo recording of smartphones. • We conduct extensive experiments with 12 participants and three different types of phones under various ex- perimental settings,Data,111
| To test if WebCapsule can successfully record and subsequently replay real-world phishing attacks, we proceeded as follows, us- ing Chromium on our desktop machine. We selected a large and diverse set of recently reported phishing web pages from Phish- Tank8|,Data,112
| 2.4 Datasets and implementation We use two real geographic datasets Cal, SpitzLoc, one synthetic geographic distribution Globe, and one real time- stamp dataset SpitzTime|,Data,113
|4 Datasets and implementation We use two real geographic datasets Cal, SpitzLoc, one synthetic geographic distribution Globe, and one real time- stamp dataset SpitzTime. The dataset Cal represents the latitude and longitude of about 21,000 intersections in the California road network1 (also used by Mavroforakis et al|,Data,113
294258. The dataset SpitzLoc consists of latitude and longitude coordinates tracking the movement of German Green party politician Malte Spitz over six months,Data,113
| In this section, we aim to explore whether the differences of keystroke wave- forms are large enough to be used for recognizing different keys inputs in the real-world setting. We collected training and testing data from 10 volunteers|,Data,114
 B. Real Attacks MAD uniformly detects attacks more quickly than the PAD; we use the former method to detect the presence of an attack in real Internet traces3,Data,119
 III. DATA SET  changes  The data used was the PREDICT ID USC-Lander!  (- 60  The total  were DNS attack packets,Data,120
|395326000  files IPs. There are total 59,928,920 packet counts out of which there was a total of  DoS_DNS_amplification-20130617 (2013-06-17) (2013-06-17) with anonymized million) 358019 DNS packets|,Data,120
| The maximum number of unique hosts per day we measured was 106,000. To understand these differences, we compared the observations from our network monitor to data collected from DShield (www|,Data,121
| 3.1 From our own transactions We engaged in 344 transactions with a wide variety of services, listed in Table 1, including mining pools, wallet services, bank ex- changes, non-bank exchanges, vendors, gambling sites, and mis- cellaneous services|,Data,122
| Wallets. We kept money with most of the major wallet services (10 in total), and made multiple deposit and withdrawal transac- Bank exchanges|,Data,122
|, in which the exchange rate is not fixed) also function as banks. As such, we tagged these services just as we did the wallets: by depositing into and withdrawing from our accounts (but rarely par- ticipating in any actual currency exchange)|,Data,122
