|info/tags, including both addresses provided in users’ signatures for Bitcoin forums, as well as self-submitted tags. We collected all of these tags — over 5,000 in total — keeping in mind that the ones that were not self-submitted (and even the ones that were) could be regarded as less reliable than the ones we collected ourselves|,Data,122
| 3.1 Data analysis overview We use three data sets, summarized in Table 1|,Data,123
|1 PlanetLab Deployment We deployed tracebox on PlanetLab, using 72 machines as vantage points (VPs). Each VP had a target list of 5,000 items build with the top 5,000 Alexa web sites|,Data,124
|1 PlanetLab Deployment We deployed tracebox on PlanetLab, using 72 machines as vantage points (VPs). Each VP had a target list of 5,000 items build with the top 5,000 Alexa web sites|,Data,124
| We also describe our application of the technique to the IPv6 interface-level graph captured by CAIDA’s Archipelago (Ark) infrastructure [14] for March 2013. The graph consists of all the 52,986 IPv6 interfaces numbered within the 2000::/3 unicast prefix captured from all 27 Ark vantage points (VPs) with IPv6 connectivity|,Data,125
| cause the counters of distinct routers to diverge, and (4) confirm aliases with pairwise probing. Given the absence of velocity in ID counters and the large probes required for the technique to work, we probe at a low rate of 20pps from a single VP, producing 26Kbps of traffic|,Data,125
| 3. METHODOLOGY In this section, we describe the design of our experiment and our data collection methodology, as well as the mitigating steps and proactive measurements we conducted to ensure a minimal im- pact of our covering routes|,Data,126
| of IPs 1622 1219 159 9,409 9 12,418 No. of Unique ASNs 603 530 62 3,654 8 4,857 In order to validate minimal impact on data plane connectivity, we performed the following: We collected a set of public IPv6 addresses by querying the Alexa top 1M domains [2] for AAAA records|,Data,126
| of IPs 1622 1219 159 9,409 9 12,418 No. of Unique ASNs 603 530 62 3,654 8 4,857 In order to validate minimal impact on data plane connectivity, we performed the following: We collected a set of public IPv6 addresses by querying the Alexa top 1M domains [2] for AAAA records|,Data,126
| Our IPv6 network telescope results suggest sev- eral important differences (and some similarities) compared to that body of work. To produce a more recent and valid comparison, we analyzed a single week of IPv4 background radiation captured during the course of our ongoing IPv6 packet capture|,Data,126
| 4. DATA COLLECTION In this section we describe the datasets used in our analysis, which we summarize in Table 1|,Data,127
| DATA COLLECTION In this section we describe the datasets used in our analysis, which we summarize in Table 1. Our primary dataset consists of changes made to the |,Data,127
| domains, (2) the removal of existing domains, and (3) changes to existing domains in terms of revisions to their associated name- servers. Our data includes captures of the DNZA files as recorded every five minutes, time periods we refer to as epochs|,Data,127
| Since we lack comprehensive ground truth regarding the ultimate use of domains, to this end we use two proxies: subsequent appearance of a newly registered do- main in: (1) an email spam campaign, or (2) a domain blacklist. For the first of these, we operated a spam trap, i|,Data,127
|com), by restricting our focus to domains recently registered (March–July 2012) we can filter down the do- mains appearing in the spam trap to those very likely used for spam- ming. For the second, we subscribed to three major DNS blacklists, URIBL, SURBL, and Spamhaus DBL|,Data,127
| In this paper, we examine the effectiveness of these inter- ventions in the context of an understudied market niche, counterfeit luxury goods. Using eight months of empirical crawled data, we identify 52 distinct SEO campaigns, document how well they are able to place search results for sixteen luxury brands, how this ca- pability impacts the dynamics of their order volumes and how well existing interventions undermine this business when employed|,Data,128
| For a small number of stores, we were also able to collect user traffic data that directly measures an SEO campaign’s effectiveness in attracting customers to their stores. Specifically, we were able to periodically collect AWStats data for 647 storefronts in 12 cam- paigns|,Data,128
| One issue that undermines coverage is that Google only labels the root of a Web site as “hacked”, and does not label search results that link to sub-pages within the same root domain. In the PSR data set, we found 68,193 “hacked” search results|,Data,128
| We begin by exam- ining the properties of individual darknets and in particular the behavior of source IP addresses. We provide these char- acterizations by looking at data from 14 darknet monitors ranging in size from a /25 monitor to a /17 monitor over a period of 10 days between August 18, 2004 and August 28, 2004|,Data,129
| Figure 10: The number of darknets (of 31) reporting a port in the top 10 ports over a day, week, and month time frame. The analysis is performed for the top 10 destination ports over a day, top 10 destination ports over a week, and top 10 destination ports over a month|,Data,129
| 3.6 Datasets This paper uses DNS datasets from three authorities: one national-level top-level domain, operators of two root servers as shown in Table 1|,Data,130
 JP-DNS operates the .jp country code domain for Japan; we have data from all seven of their anycast sites,Data,130
|) part of the 2014 DITL collection [16] (for B-Root, shortly after 2014 DITL). We also use data for M-Root’s 2015 DITL collection (§ 4|,Data,130
 These root datasets are available to re- searchers through DNS-OARC. For longitudinal analysis we draw on 9 months of data taken at the M-Root server,Data,130
| However, we treat the union of these classes together. We use data from 103 surveys taken between April 2006 and February 2015, and performed initial studies based on 2011–2013 data, but focus on the most recent of them, in January and February of 2015 for data quality and time- liness|,Data,131
| We use data from 103 surveys taken between April 2006 and February 2015, and performed initial studies based on 2011–2013 data, but focus on the most recent of them, in January and February of 2015 for data quality and time- liness. The dataset consists of all echo requests that were sent as part of the surveys in this period, as well as all echo responses that were received|,Data,131
|, “host unreachable”); we ignore all probes as- sociated with such responses since the latency of ICMP error responses is not relevant. In later sections, we will complement this dataset with results from Zmap [5] and additional experiments includ- ing more frequent probing with Scamper [13] and Scrip- troute [22]|,Data,131
| 3.2 Milking 3 Methodology To collect the information needed to cluster servers into oper- ations, we have built an infrastructure to track individual exploit servers over time, periodically collecting and classi- fying the malware they distribute|,Data,132
 2. We receive feeds of drive-by download URLs (Sect,Data,132
 2. CHARACTERISTICS OF CHECK-INS We use three different datasets that capture human mobility,Data,133
 First we consider two online location-based social networks. We col- lected all the public check-in data between Feb,Data,133
| There are 196,591 nodes, 950,327 edges in Gowalla and 58,228 nodes, 214,078 edges in Brightkite. To ensure that our observations on human movement are not specific to data based on check-ins from location-based social net- works, we also include a dataset of cell phone location trace data|,Data,133
| Backscatter DDoS is a commonly seen behaviour in darknets where the attacker uses simultaneous bots to generate the actual attack packets to reach the targeted (original) victim. In our study, five publicly available network traffic datasets from CAIDA’s archives are employed|,Data,134
| Datasets Employed In this research, five publicly available real-life network traffic traces (datasets) from CAIDA’s archives are employed. Three of them, which were captured by a passive darknet in 2007, 2008 and 2012 [27][26][28], namely UCSD Network Telescope [21], include mostly one-way malicious traffic while the remaining ones collected in 2008 [29] and 2014 [30] via CAIDA’s Internet backbone links include only normal traffic|,Data,134
| 3 Approach This section presents our approach for the evalua- tion of reputation based blacklists. We evaluated the blacklists by deploying them in a large academic net- work of over 7,000 hosts|,Data,135
| This was a preliminary step to preventing inexperienced and non-serious workers from participating in our survey. Our survey is based on the participants’ actual check-ins on Foursquare posted over the last 24 months (that we collected through a specific application we developed), and it requires a significant amount of time to complete (30-45 minutes)|,Data,136
| The third phase of worm activ- ity is the persistence phase which for the Blaster worm has continued through 2004. In this one-week period of measurement, the IMS system observed over 286,000 unique IP addresses displaying the characteristics of Blaster activity|,Data,137
| published a study in 2011 that focused on the dynamics of leaf cer- tificates and the distribution of certificates among IP addresses, and attempted to roughly classify the overall quality of served certifi- cates. The study was based on regular scans of the Alexa Top 1 Mil- lion Domains [1] and through passive monitoring of TLS traffic on the Munich Scientific Research Network [17]|,Data,138
| Our study is founded on what is, to the best of our knowledge, the most comprehensive dataset of the HTTPS ecosystem to date. Between June 2012 and August 2013, we completed 110 exhaustive scans of the public IPv4 address space in which we performed TLS handshakes with all hosts publicly serving HTTPS on port 443|,Data,138
| Between June 2012 and August 2013, we completed 110 exhaustive scans of the public IPv4 address space in which we performed TLS handshakes with all hosts publicly serving HTTPS on port 443. Over the course of 14 months, we completed upwards of 400 billion SYN probes and 2|,Data,138
| Content Provider e Service Provider v i t c e p s r e P Content Consumer Addressing Prerequisite IP Functions Routing Naming A1: Address Allocation; A2: Address Advertisement N1: Nameservers; R1: Server Readiness N2: Resolvers N3: Queries A2: Address Advertisement; T1: Topology End-to-End Reachability R1: Server Readiness Operational Characteristics Usage Profile Performance U3: Transition Technologies U1: Traffic Volume; U3: Transition Technologies P1: Network RTT R2: Client Readiness U2: Application Mix; N3: Queries Table 2: Dataset summary showing the time period, scale, and public or new status of the datasets we analyzed. Dataset RIR Address Allocations Routing: Route Views Routing: RIPE Google IPv6 Client Adoption Verisign TLD Zone Files CAIDA Ark Performance Data Arbor Networks ISP Traffic Data Verisign TLD Packets: IPv4 Verisign TLD Packets: IPv6 Alexa Top Host Probing Time Period Metrics Jan 2004 – Jan 2014 A1 Jan 2004 – Jan 2014 A2, T1 Jan 2004 – Jan 2014 A2, T1 Sep 2008 – Dec 2013 R2, U3 Apr 2007 – Jan 2014 N1 P1 Dec 2008 – Dec 2013 U1, U2, U3 Mar 2010 – Dec 2013 Jun 2011 – Dec 2013 N2, N3 N2, N3 Jun 2011 – Dec 2013 Apr 2011 – Dec 2013 R1 Recent Scale ≈18K allocation snapshots (5 daily) 45,271 BGP table snapshots millions of daily global samples daily snapshots of ≈2|,Data,139
com & .net) ≈10 million IPs probed daily ≈33-50% of global Internet traffic; 2013 daily median: 50 terabits/sec (avg,Data,139
| To put the IPv6 allocation data in context, Figure 1 also shows IPv4 prefix allocations over the same period. The number of IPv4 prefix allocations grows from roughly 300 per month at the begin- ning of our observation period to a peak of 800–1000 per month at the start of 2011, after which it drops to around 500 per month in the last year, as the number of available addresses at RIRs has dwindled|,Data,139
| There were less than 30 IPv6 prefixes al- located per month prior to 2007, generally increasing thereafter. In the past several years, we typically find more than 300 prefixes allocated per month, with a high point of 470 prefix allocations in February 2011|,Data,139
| The number of IPv4 prefix allocations grows from roughly 300 per month at the begin- ning of our observation period to a peak of 800–1000 per month at the start of 2011, after which it drops to around 500 per month in the last year, as the number of available addresses at RIRs has dwindled. 1 Overall, we find nearly 69K IPv4 prefix allocations at the beginning of our dataset and just over 136K at the end|,Data,139
| We deployed this detection mechanism on an Alexa top 10 website, Facebook, which terminates connections through a diverse set of network operators across the world. We analyzed 3, 447, 719 real-world SSL connections and successfully discovered at least 6, 845 (0|,Data,140
| We deployed this detection mechanism on an Alexa top 10 website, Facebook, which terminates connections through a diverse set of network operators across the world. We analyzed 3, 447, 719 real-world SSL connections and successfully discovered at least 6, 845 (0|,Data,140
| Table 1 shows the datasets we use in our paper. We use two ICMP surveys taken by USC [12]: IT17ws and IT16ws; IT17ws is the main dataset used in this paper, while we use IT16ws for validation in Section 6|,Data,142
2. We collected VUSC s at our enterprise in order to compare our inferences with network operators as discussed in Section 6,Data,142
| # of Data-Oriented Attacks gives the number of attacks generated by FLOWSTITCH, includ- ing privilege escalation attacks and information leakage attacks. FLOWSTITCH generates 19 data-oriented attacks from 8 vulnerable programs|,Data,144
| Third, this method is not specific to C or C++, and can be applied to any programming language. We collected C++ source of thousands of contestants from the annual international competition “Google Code Jam”|,Data,145
| Finally, we analyze various attributes of programmers, types of programming tasks, and types of features that appear to influence the success of attribution. We identified the most important 928 fea- tures out of 120,000; 44% of them are syntactic, 1% are layout-based and the rest of the features are lexical|,Data,145
|3.1ScalingWecollectedalargerdatasetof1,600programmersfromvariousyears|,Data,145
| ) s y a D n i (    e m T i  7  6  5  4  3  2  1  10  20  30  40  50  60  70  80  90 Time Before Accounts Suspension Number of IP Addresses 2 Motivation: Analysis of Malicious Activ- ity on a Webmail Service We want to understand the way in which cybercrimi- nals abuse accounts on online services, to identify weak points that we could leverage for detection. To this end, we observed the email-sending activity on a large web- mail service|,Data,147
| Following accepted frameworks for qualitative research [18, 30, 35], we focus closely on a small number of participants. We interviewed 15 journalists employed in a range of well-respected journalistic institutions in the United States and France, analyzing these interviews using a grounded theory approach [18, 30]|,Data,146
| 3.1 Datasets We examine 13,345 passwords from four sets created under composition policies ranging from the typical to the currently less common to understand the suc- cess of password-guessing approaches against passwords of different characteristics|,Data,149
| Had we used any major password leak, their analysts would have already been familiar with most or all of the passwords contained in the leak, biasing results. The passwords in these sets were collected using Ama- zon’s Mechanical Turk crowdsourcing service|,Data,149
| The decision for or against pinning is always a trade- off between increasing security and keeping mainte- nance efforts at an acceptable level. In this paper, we present an extensive study on the applicability of pinning for non-browser software by analyzing 639,283 Android apps|,Data,152
| Therefore, we instrument telemetry data from a popular anti-virus software provider. We evaluate the update behaviour of 871,911 unique users from January 2014 to December 2014 and find that only 50% of the users update to a new app version within the first week after release|,Data,152
| Developer View Although pinning is only ap- plicable in relatively few cases, the nominal-actual comparison leaves room for improvement. We there- fore collected feedback from 45 developers of apps for which we would recommend pinning|,Data,152
| Section 4). Altogether we found 20,020,535 calls to network related API calls (cf|,Data,152
| Instability of the routes to the sensor address space can also result in reachability problems, especially given that route flap damping can be triggered during convergence to suppress unstable routes [9]. Using the BGP updates data from RouteViews BGP monitor, we studied the availability of the routes to the sensor blocks in our de- ployment from a large set of ASes|,Data,154
| This section probes these differences using three successively more specific views of traffic to a network of distributed blackhole sensors. The data was recorded over a one month period with SYN responders on TCP port 135, 445, 4444, and 9996 across all sen- sors|,Data,154
|  V. EXPERIMENT RESULTS  In this section, we mainly focus on how our router-to-AS Mapping method and other baseline methods behave on global router-level topology, as discussed above, we use PeeringDB data as ground truth, and apply clustering method on global topology based on CAIDA ITDK project|,Data,155
| It describes the properties that a dataset should have in order to be used for comparison purposes. The dataset used in the paper includes an IRC-based Botnet attack1, but the bot used for the attack was developed by the authors and therefore it may not represent a real botnet behavior|,Data,156
| This dataset may be downloaded with authorization. The Protected Repository for the Defense of Infrastructure Against Cyber Threats (PRE- DICT) indexed three Botnet datasets2 until May 16th, 2013|,Data,156
 None of them are labeled. A custom botnet dataset was created to verify five P2P botnet detection algorithms in Saad et al,Data,156
| Unfortunately, there is only one infected machine for each type of botnet, therefore no synchronization analysis can be done. The Traffic Laboratory at Ericsson Research created a normal dataset that was used in Saad et al|,Data,156
 This is the only normal dataset that is labeled inside the pcap file. A considerable amount of malware traffic in pcap format was published in the Contagio blog9,Data,156
| But since each scenario includes only one infected computer, it should be possible to label them. Another dataset with malware logs and benign logs was collected in NexGinRC (2013)|,Data,156
 Access to this dataset may be granted upon request10. The last dataset analyzed is currently created by the MAWI project described in Cho et al,Data,156
| Methodology and datasets We deployed Paris Traceroute with its Multipath Detection Algorithm (MDA) [29] enabled in 90 PlanetLab nodes. We configured each node to trace IP-level routes toward 10 thou- sand destinations selected at random from a list of 102,404 reachable destinations in different /16 prefixes we obtained from the PREDICT project [11]|,Data,158
| We configured each node to trace IP-level routes toward 10 thou- sand destinations selected at random from a list of 102,404 reachable destinations in different /16 prefixes we obtained from the PREDICT project [11]. Our dataset contains more than 900 thousand IP-level (multi)routes and 324,313 IP addresses|,Data,158
1 3.1 Address Allocation and BGP Data We analyzed BGP announcements captured by all collectors (24 collectors peering with 184 peers) of the Routeviews [3] and RIPE RIS [52] projects,Data,159
| For each /24 block, we computed the maximum number of peers that saw it reachable at any time within the full observation period of 92 days. To determine which address blocks are available for assignment, we used a dataset compiled by Geoff Hus- ton [23], which merges the extended delegation files from the 5 RIRs [4, 6, 7, 41, 51] with IANA’s published registries [31–36]|,Data,159
| SWITCH. We collected unsampled NetFlow records from all the border routers of SWITCH, a national aca- demic backbone network serving 46 single-homed uni- versities and research institutes in Switzerland [55]|,Data,159
| R-ISP. We collected per-flow logs from a vantage point monitoring traffic of about 25,000 residential ADSL customers of a major European ISP [21]|,Data,159
 UCSD-NT. We collected full packet traces from the /8 network telescope operated at the University of Cal- ifornia San Diego [1],Data,159
| IXP. Our fourth VP is a large European IXP inter- connecting more than 490 networks, exchanging more than 400 PB monthly [5]|,Data,159
|3 Active Measurements ISI. We used the ISI Internet Census dataset it55w- 20130723 [37], obtained by probing the routed IPv4 address space with ICMP echo requests and retaining only those probes that received an ICMP echo reply from an address that matched the one probed (as rec- ommended [38])|,Data,159
| HTTP. We extracted IP addresses from logs of Project Sonar’s HTTP (TCP port 80) scan of the entire IPv4 address space on October 29, 2013 [24]|,Data,159
| Definitions of graph parameters measuring metric tree-likeness of a graph, as well as notions and notations local to a section, are given in appropriate sections. 3 Datasets Our datasets come from different domains like Internet measurements, biological datasets, web graphs, social and collaboration networks|,Data,160
| The experiments were executed as follows. Traces were col- lected by using ICMP, UDP, and TCP Traceroute to probe the paths to a set of 100 destination websites from a source located on the Pennsylvania State University, University Park campus|,Data,161
| For UDP and TCP Traceroute, traces were collected using the default destination port numbers. We also collected traces using other ports and observed similar results|,Data,161
| Realistic Networks Here we compare the merged topologies produced by iTop, MN, and Isomap for realistic topologies. We use the Au- tonomous System (AS) topologies from both the Rocketfuel [20] and the CAIDA [21] projects, which represent IP-level connections between backbone/gateway routers of several ASes from major Internet Service Providers (ISPs) around the globe|,Data,161
| Although the paris-traceroute output of ITDK is more reliable than that of IPlane’s traceroute, the random selection of endpoints implemented by CAIDA hinders the collection of routes between the same vantage- and endpoints. Therefore we used the data of IPlane’s traceroute measurements|,Data,162
| They can also be used for constructing maps of the Internet at the Autonomous Systems level [, ]. In this work we used the CAIDA router-level Internet map from October th,  []|,Data,163
| 3 Table 1: Dataset Description Name BGP Usage AS Geolocation; Detour Detection Date 2016-01 Sources Info RouteViews, RIPE 38,688 RIBS, 416 peers, RIS 30 countries, 55GB Infrastructure IP List AS Geolocation 2016-01 to 2016-03 CAIDA Ark, iPlane, OpenIPMap, RIPE Atlas Measurements 3M Router IPs Infrastructure IPs to AS Mapping Infrastructure IP geolocation 2015-08 CAIDA ITDK, iPlane 6.6M IP to AS mappings AS to IXP Mapping AS Relationship AS Geolocation 2016-01 to 2016-03 Filtering peered paths from detection 2016-01 Traceroute Detour Validation 2016-05-01 IXP websites, PeeringDB, PCH CAIDA AS Relationship RIPE Atlas MaxMind Prefix Geolocation; Detour Validation 2016-01, 2016-03 MaxMind GeoLite City (free and paid) 368 IXP websites crawled 482,657 distinct relationships Used by Netra, 163 traceroutes Paid version used only for geolocating infrastructure IPs and detour validation longest prefix match on the global routing table and map the IP to the AS announcing the longest matching prefix|,Data,164
| As shown in Figure 3, we install LaBrea on a /29 subnetwork and use PlanetLab [9] to probe from multiple vantage points the entire /24 aggre- gate to which the /29 belongs. We scan the /24 network by attempting to establish TCP connections to each IP address in the subnet and capture the packets for further analysis|,Data,165
| • Active IPs in a Subnet: Intuitively, we might ex- pect high-occupancy subnets to be good indicators of pos- sible tarpits. To this end, we initially investigated using a hitlist of probable tarpits as inferred from the /24 subnets with more than 240 responding web hosts in the scans|,Data,165
| To facilitate large-scale scanning and avoid triggering anomaly detectors, degreaser uses permu- tation scanning [7, 12] to pseudo-randomly iterate through the IP address space when probing. Our real-world Internet scan, which probes at least one address in each /24 network in the Internet, discovers 107 different tarpit subnetworks (cid:20)(cid:24)(cid:25) ranging in size from /16 (with up to 216 fake hosts) to /24 (with up to 28 fake hosts)|,Data,165
  III. DATA SET  The data used in this work was the PREDICT ID USC-Lander/ DoS_DNS_amplification-20130617 (2013- 06-17) to (2013-06-17) [26],Data,166
  III. DATA SET  The data used in this work was the PREDICT ID USC-Lander/ DoS_DNS_amplification-20130617 (2013- 06-17) to (2013-06-17) [26],Data,166
