| More importantly, BitLocker is not designed to with- stand coercion and can provide only limited defence against password guessing attacks (discussed more in Section 8) We propose Hypnoguard to protect all memory-resident OS/user data across S3 suspensions, against memory ex- traction attacks, and guessing/coercion of user passwords during wakeup-time re-authentication Memory extraction is mitigated by performing an in-place full memory encryp- tion before entering sleep, and then restoring the plaintext content/secrets after the wakeup process The memory en- cryption key is encrypted by a Hypnoguard public key, the private part of which is stored in a Trusted Platform Mod- ule (TPM v1|,Non-data,50
|2) chip, protected by both the user password and the measurement of the execution environment sup- ported by CPU’s trusted execution mode, eg, Intel Trusted Execution Technology (TXT [30]) and AMD Virtualization (AMD-V/SVM [2]) The memory encryption key is thus bound to the execution environment, and can be released only by a proper re-authentication process|,Non-data,50
| 945Guessing via Hypnoguard may cause the memory content to be permanently inaccessible due to the deletion of the TPM-stored Hypnoguard private key, while guessing with- out Hypnoguard, eg, an attacker-chosen custom wakeup procedure, is equivalent to brute-forcing a high-entropy key, due to TPM protection A user-defined policy, e|,Non-data,50
|g, three failed attempts, or a special deletion password, determines when the private key is deleted As a result, either the pri- vate key cannot be accessed due to an incorrect measurement of an altered program, or the adversary takes a high risk to guess within the unmodified environment By encrypting the entire memory space, except a few system-reserved regions, where no OS/user data resides, we avoid per-application changes|,Non-data,50
| We leverage modern CPU’s AES-NI extension and multi-core processing to quickly en- crypt/decrypt commonly available memory sizes (up to 8GB, under a second), for avoiding degraded user experi- ence during sleep-wake cycles For larger memory systems (eg, 32/64GB), we also provide two variants, for encrypt- ing memory pages of user selected applications, or specific Hypnoguard-managed pages requested by applications|,Non-data,50
| Due to the peculiarity of the wakeup-time environment, we face several challenges in implementing Hypnoguard Un- like boot-time (when peripherals are initialized by BIOS) or run-time (when device drivers in the OS are active), at wakeup-time, the system is left in an undetermined state, eg, empty PCI configuration space and uninitialized I/O controllers|,Non-data,50
| We implement custom drivers and reuse dor- mant (during S3) OS-saved device configurations to restore the keyboard and VGA display to facilitate easy user in- put/output (inadequately addressed in the past, cf [46]) Several boot-time solutions (eg|,Non-data,50
|, [31, 64, 70]) also per- form system integrity check, authenticate the user, and may release FDE keys; however, they do not consider memory at- tacks during sleep-wake cycles For lost/stolen computers, some remote tracking services may be used to trigger remote deletion, assuming the computer can be reached online (with doubtful effectiveness, cf [13, 62]) Contributions: 1|,Non-data,50
| We design and implement Hypnoguard, a new approach that protects confidentiality of all memory regions con- taining OS/user data across sleep-wake cycles We pro- vide defense against memory attacks when the computer is in the wrong hands, and severely restrict guessing of weak authentication secrets (cf [70]) Several propos- als and tools exist to safeguard data-at-rest (e|,Non-data,50
|g, disk storage), data-in-transit (eg, network traffic), and data- in-use (e|,Non-data,50
|g, live RAM content); with Hypnoguard, we fill the gap of securing data-in-sleep 2 Our primary prototype implementation in Linux uses full memory encryption to avoid per-application changes|,Non-data,50
| The core part of Hypnoguard is decoupled from the under- lying OS and system BIOS, for better portability and security Leveraging modern CPU’s AES-NI extension and multi-core processing, we achieve around 87GB/s encryption/decryption speed for AES in the CTR mode with an Intel i7-4771 processor, leading to under a second additional delay in the sleep-wake process for 8GB RAM 3|,Non-data,50
| For larger memory systems (eg, 32GB), where full mem- ory encryption may add noticeable delay, we provide pro- tection for application-selected memory pages via the POSIX- compliant system call mmap() (requiring minor changes in applications, but no kernel patches) Alternatively, Hypnoguard can also be customized to take a list of ap- plications and only encrypt memory pages pertaining to them (no application changes)|,Non-data,50
| 4 We enable wakeup-time secure processing, previously un- explored, which can be leveraged for other use-cases, eg, OS/kernel integrity check|,Non-data,50
| 2 TERMINOLOGIES, GOALS AND THREAT MODEL We explain the terminologies used for Hypnoguard, and our goals, threat model and operational assumptions We use CPU’s trusted execution mode (eg|,Non-data,50
|, Intel TXT, AMD- V/SVM), and the trusted platform module (TPM) chip We provide brief description of some features as used in our proposal and implementation; for details, see, eg, Parno et al|,Non-data,50
| [48], Intel [30], and AMD [2] 21 Terminologies Hypnoguard key pair (HGpub, HGpriv): A pair of public and private keys generated during deployment The pri- vate key, HGpriv, is stored in a TPM NVRAM index, pro- tected by both the measurement of the environment and the Hypnoguard user password|,Non-data,50
| HGpriv is retrieved through the password evaluated by TPM with the genuine Hypnoguard program running, and can be permanently deleted in ac- cordance with a user-set policy The public key, HGpub, is stored unprotected in TPM NVRAM (for OS/file system independence), and is loaded in RAM after each boot Memory encryption key (SK): A high entropy symmetric key (eg|,Non-data,50
|, 128-bit), randomly generated each time before en- tering sleep, and used for full memory encryption Before the system enters sleep, SK is encrypted using HGpub and the resulting ciphertext is stored in the small non-encrypted region of memory Hypnoguard user password: A user-chosen password to un- lock the protected key HGpriv at wakeup-time It needs to withstand only a few guesses, depending on the actual un- locking policy|,Non-data,50
| This password is unrelated to the OS unlock password, which can be optionally suppressed TPM “sealing”: For protecting HGpriv in TPM, we use the TPM_NV_DefineSpace command, which provides envi- ronment binding (similar to TPM_Seal, but stores HGpriv in an NVRAM index) and authdata (password) protec- tion We use the term “sealing” to refer to this mechanism for simplicity 2|,Non-data,50
|2 Goals We primarily consider attacks targeting extraction of se- crets through physical access to a computer in S3 sleep (unattended, stolen, or when the owner is under coercion) We want to protect memory-resident secrets against side- channel attacks (eg, DMA/cold-boot attacks), but we do not consider compromising a computer in S3 sleep for evil- maid type attacks (unbeknownst to the user)|,Non-data,50
| More specifically, our goals include: (G1) Any user or OS data (secrets or otherwise), SK, and HGpriv must not remain in plaintext anywhere in RAM before resuming the OS to make memory attacks inapplicable (G2) The protected con- tent (in our implementation, the whole RAM) must not be retrieved by brute-forcing SK or HGpriv, even if Hypnoguard is not active, eg, via offline attacks|,Non-data,50
| (G3) No guessing at- tacks should be possible against the Hypnoguard user pass- 946word, unless a genuine copy of Hypnoguard is loaded as the only program in execution (G4) The legitimate user should be able to authenticate with routine effort, eg, memoriza- tion of strong passwords is not required|,Non-data,50
| (G5) Guessing the user password when Hypnoguard is active should be severely restricted by the penalty of having the secrets deleted An additional goal for coercion attacks during wakeup (similar to the boot-time protection of [70]): (AG1) when deletion is successful, there should be a cryptographic ev- idence that convinces the adversary that the RAM secrets are permanently inaccessible 23 Threat model and assumptions 1|,Non-data,50
| The adversary may be either an ordinary person with skills to mount memory/guessing attacks, or an organi- zation (non-state) with coercive powers, and considerable but not unbounded computational resources For exam- ple, the adversary may successfully launch sophisticated cold-boot attacks (eg, [25, 22]), but cannot brute-force a random 128-bit AES key, or defeat the TPM chip and CPU’s trusted execution environment (for known imple- mentation bugs and attacks, see e|,Non-data,50
|g, [59, 68, 54]); see also Item (f) in Section 7 2 Before the adversary gains physical control, the computer system (hardware and OS) has not been compromised|,Non-data,50
| After the adversary releases physical control, or a lost computer is found, the system is assumed to be untrust- worthy, ie, no further use without complete reinitial- ization We thus only consider directly extracting se- crets from a computer in sleep, excluding any attacks that rely on compromising first and tricking the user to use it later, the so-called evil-maid attacks, which can be addressed by adapting existing defenses, e|,Non-data,50
|g, [20] for wakeup-time However, no known effective defense exists for more advanced evil-maid attacks, including hardware modifications as in NSA’s ANT catalog [21] Note that, our AES-GCM based implementation can restrict modi- fication attacks on encrypted RAM content|,Non-data,50
| 3 The host OS is assumed to be general-purpose, eg, Win- dows or Linux; a TXT/SVM-aware kernel is not needed|,Non-data,50
| Also, the Hypnoguard tool may reside in an untrusted file system and be bootstrapped from a regular OS 4 We assume all user data, the OS, and any swap space used by the OS are stored encrypted on disk, eg|,Non-data,50
|, us- ing a properly configured software/hardware FDE sys- tem (cf [44, 12]) A secure boot-time solution should be used to enforce strong authentication (cf [70])|,Non-data,50
| The FDE key may remain in RAM under Hypnoguard’s protection This assumption can be relaxed, only if the data on disk is assumed non-sensitive, or in the case of a diskless node 5 Any information placed in memory by the user/OS is treated as sensitive|,Non-data,50
| With full memory encryption, it is not necessary to distinguish user secrets from non- sensitive data (eg, system binaries) 6|,Non-data,50
| The adversary must not be able to capture the computer while it is operating, ie, in Advanced Configuration and Power Interface (ACPI [1]) S0 We assume the computer goes into sleep after a period of inactivity, or through user actions (e|,Non-data,50
|g, lid-close of a laptop) 7 The adversary may attempt to defeat Hypnoguard’s pol- icy enforcement mechanism (i|,Non-data,50
|e, when to delete or unlock HGpriv during authentication) With physical access, he may intervene in the wakeup process, eg|,Non-data,50
|, by tampering Figure 1: Memory layout and key usage of Hypnoguard Shaded areas represent encrypted/protected data; different patterns refer to using different schemes/key types with the UEFI boot script for S3 [67], and may attempt to observe the input and output of our tool and influence its logic In all cases, he will fail to access HGpriv, unless he can defeat TXT/SVM/TPM (via an implementation flaw, or advanced hardware attacks)|,Non-data,50
| 8 In the case of coercion, the user never types the correct password but provides only deletion or incorrect pass- words, to trigger the deletion of HGpriv Coercion has been considered recently during boot-time [70], requir- ing the computer to be in a powered-off state before the coercive situation We consider coercion during wakeup; ideally, both systems should be used together|,Non-data,50
| 9 We require a system with a TPM chip and a TXT/SVM- capable CPU with AES-NI (available in many consumer- grade Intel and AMD CPUs) Without AES-NI, full memory encryption will be slow, and users must resort to partial memory encryption 3|,Non-data,50
| DESIGN In this section, we detail the architecture of Hypnoguard, and demonstrate how it achieves the design goals stated in Section 22 Technical considerations not specific to our cur- rent implementation are also discussed Overview|,Non-data,50
| Figure 1 shows the memory layout and key usage of Hypnoguard across sleep-wake cycles; the transition and execution flows are described in Section 41 User secrets are made unavailable from RAM by encrypting the whole system memory, regardless of kernel or user spaces, with a one-time random symmetric key SK before entering sleep Then SK is encrypted using HGpub and stored in system memory|,Non-data,50
| At this point, only HGpriv can decrypt SK HGpriv is sealed in the TPM chip with the measurements of the genuine copy of Hypnoguard protected by a user password At wakeup-time, Hypnoguard takes control in a trusted execution session (TXT/SVM), and prompts the user for the Hypnoguard user password Only when the correct pass- 947word is provided in the genuine Hypnoguard environment, HGpriv is unlocked from TPM (still in TXT/SVM)|,Non-data,50
| Then, HGpriv is used to decrypt SK and erased from memory im- mediately The whole memory is then decrypted with SK and the system exits from TXT/SVM back to normal OS operations SK is not reused for any future session 3|,Non-data,50
|1 Design choices and elements Trusted execution mode We execute the unlocking pro- gram in the trusted mode of modern CPUs (TXT/SVM), where an unforgeable measurement of the execution envi- ronment is generated and stored in TPM (used to access HGpriv) The use of TXT/SVM and TPM ensures that the whole program being loaded and executed will be re- flected in the measurement; ie|,Non-data,50
|, neither the measurement can be forged at the load time nor can the measured pro- gram be altered after being loaded, eg, via DMA attacks The memory and I/O space of the measured environment is also protected, e|,Non-data,50
|g, via Intel VT-d/IOMMU, from any external access attempt We choose to keep Hypnoguard as a standalone module (a) Small trusted separate from the OS for two reasons computing base (TCB): If Hypnoguard’s unlocking program is integrated with the OS, then we must also include OS components (at least the kernel and core OS services) in the TPM measurement; this will increase the TCB size sig- nificantly|,Non-data,50
| Also, in a consumer OS, maintaining the cor- rect measurements of such a TCB across frequent updates and run-time changes, will be very challenging Unless mea- suring the entire OS is the purpose (cf Unicorn [38]), a TXT/SVM-protected application is usually a small piece of code, not integrated with the OS, to achieve a stable and manageable TCB (eg|,Non-data,50
|, Flicker [40]) In our case, only the core Hypnoguard unlock logic must be integrity-protected (ie, bound to TPM measurement)|,Non-data,50
| The small size may also aid manual/automatic verification of the source code of an implementation (b) Portability: We make Hypnoguard less coupled with the hosting OS except for just a kernel driver, as we may need to work with different distributions/versions of an OS, or completely different OSes TPM’s role TPM serves three purposes in Hypnoguard: 1|,Non-data,50
| By working with TXT/SVM, TPM’s platform configura- tion registers (PCRs) maintain the unforgeable measure- ment of the execution environment 2 We use TPM NVRAM to store HGpriv safely with two layers of protection First, HGpriv is bound to the Hypno- guard environment (e|,Non-data,50
|g, the Intel SINIT module and the Hypnoguard unlocking program) Any binary other than the genuine copy of Hypnoguard will fail to ac- cess HGpriv Second, an authdata secret, derived from the Hypnoguard user password, is also used to protect HGpriv|,Non-data,50
 Failure to meet either of the above two condi- tions will lead to denial of access 3 If HGpriv is deleted by Hypnoguard (eg,Non-data,50
|, triggered via multiple authentication failures, or the entry of a deletion password), we also use TPM to provide a quote, which is a digest of the platform measurement signed by the TPM’s attestation identity key (AIK) seeded with an arbitrary value (eg, time stamp, nonce) Anyone, including the adversary, can verify the quote using TPM’s public key at a later time, and confirm that deletion has happened|,Non-data,50
| 4 For generation of the long-term key pair HGpriv and HGpub, and the per-session symmetric key SK, we need a reliable source of randomness We use the TPM_GetRandom command to get the required number of bytes from the random number generator in TPM [60] (and optionally, mix them with the output from the RDRAND instruction in modern CPUs) Necessity of HGpriv and HGpub|,Non-data,50
| Although we use ran- dom per sleep-wake cycle symmetric key (SK) for full mem- ory encryption, we cannot directly seal SK in TPM (un- der the Hypnoguard password), ie, avoid using (HGpriv, HGpub) The reason is that we perform the platform-bound user re-authentication only once at the wakeup time, and without involving the user before entering sleep, we cannot password-seal SK in TPM|,Non-data,50
| If the user is required to enter the Hypnoguard password every time before entering sleep, the user experience will be severely affected We thus keep SK encrypted under HGpub in RAM, and involve the password only at wakeup-time to release HGpriv (ie, the password input is similar to a normal OS unlock process)|,Non-data,50
| 32 Unlock/deletion policy and deployment Unlocking policy A user-defined unlocking policy will determine how Hypnoguard reacts to a given password, ie|,Non-data,50
|, what happens when the correct password is entered vs when a deletion or invalid password is entered If the policy al- lows many/unlimited online (ie|,Non-data,50
|, via Hypnoguard) guessing attempts, a dictionary attack might be mounted, violating goal G5 ; the risk to the attacker in this case is that he might unknowingly enter the deletion password If the composition of the allowed password is not properly chosen (eg, differ- ent character sets for the correct password and the deletion password), an adversary may be able to recognize the types of passwords, and thus avoid triggering deletion|,Non-data,50
| Static policies can be configured with user-selected pass- words and/or rule-based schemes that support evaluating an entered password at run-time Security and usability trade- offs should be considered, eg, a quick deletion trigger vs|,Non-data,50
| tolerating user mistyping or misremembering (cf [11]) Dur- ing setup, both unlocking and deletion passwords are cho- sen by the user, and they are set as the access passwords for corresponding TPM NVRAM indices: the deletion password protects an index with a deletion indicator and some random data (as dummy key), and the unlocking password protects an index containing a null indicator and HGpriv (similar to [70]) Note that, both the content and deletion indicator of an NVRAM index are protected (i|,Non-data,50
|e, attackers cannot exploit the indicator values) Multiple deletion passwords can also be defined We also use a protected monotonic counter to serve as a fail counter, sealed under Hypnoguard, and initialized to 0|,Non-data,50
| We use a regular numeric value sealed in NVRAM (ie, inaccessible outside of Hypnoguard); the TPM monotonic counter facility can also be used The fail counter is used to allow only a limited number of incorrect attempts, after which, deletion is triggered; this is specifi- cally important to deal with lost/stolen cases|,Non-data,50
| At run-time, only when the genuine Hypnoguard program is active, the fail counter is incremented by one, and a typed password is used to attempt to unlock the defined indices, sequentially, until an index is successfully opened, or all the indices are tried In this way, the evaluation of a password is performed only within the TPM chip and no information about any defined plaintext passwords or HGpriv is leaked in RAM—leaving no chance to cold-boot attacks If a typed password successfully unlocks an index (ie|,Non-data,50
|, a valid pass- 948word), the fail counter is decremented by one; otherwise, the password entry is considered a failed attempt and the incremented counter is not decremented When the counter reaches a preset threshold, deletion is triggered The counter is reset to 0 only when the correct password is entered (ie|,Non-data,50
|, HGpriv is successfully unlocked) Thus, a small thresh- old (eg, 10) may provide a good balance between security (quick deletion trigger) and usability (the number of incor- rect entries that are tolerated)|,Non-data,50
| For high-value data, the threshold may be set to 1, which will trigger deletion imme- diately after a single incorrect entry Deployment/setup phase With a setup program in the OS, we generate a 2048-bit RSA key pair and save HGpub in TPM NVRAM (unprotected), and ask the user to create her passwords for both unlocking and deletion With the unlocking password (as authdata secret), HGpriv is stored in an NVRAM index, bound to the expected PCR values of the Hypnoguard environment at wakeup (computed ana- lytically); similarly, indices with deletion indicators are al- located and protected with the deletion password(s)|,Non-data,50
| There is also certain OS-end preparation, eg, loading and initial- izing the Hypnoguard device drivers; see Section 41|,Non-data,50
| 33 How goals are achieved Hypnoguard’s goals are defined in Section 22 G1 is ful- filled by Hypnoguard’s full memory encryption, i|,Non-data,50
|e, replace- ment of all plaintext memory content, with corresponding ciphertext generated by SK As the OS or applications are not involved, in-place memory encryption can be performed reliably SK resides in memory encrypted under HGpub (right after full memory encryption is performed under SK)|,Non-data,50
| HGpriv can only be unlocked with the correct environment and password at wakeup-time, and is erased from RAM right after its use in the trusted execution mode A random SK with adequate length generated each time before entering sleep, and a strong public key pair (HGpub, HGpriv) generated during setup guarantee G2 TPM sealing (even with a weak Hypnoguard user pass- word) helps achieve G3 Without loading the correct binary, the adversary cannot forge the TPM measurement and trick TPM to access the NVRAM index (cf|,Non-data,50
| [30, 60]); note that, learning the expected PCR values of Hypnoguard does not help the attacker in any way The adversary is also unable to brute-force the potentially weak user password, if he is willing to program the TPM chip without Hypnoguard, as TPM ensures the consistent failure message for both incor- rect passwords and incorrect measurements The user is required to memorize a regular password for authentication If the adversary keeps the genuine environ- ment but does not know the correct password, he may be only left with a high risk of deleting HGpriv|,Non-data,50
| The legitimate user, however, knows the password and can control the risk of accidental deletion, eg, via setting an appropriate dele- tion threshold Therefore G4 is satisfied|,Non-data,50
| When the adversary guesses within Hypnoguard, the pass- word scheme (unlocking policy) makes sure that no (or only a few, for better usability) guessing attempts are allowed before deletion is triggered This achieves G5 The additional goal for coercion attacks is achieved through the TPM Quote operation The quote value relies on mainly two factors: the signing key, and the measurement to be signed|,Non-data,50
| An RSA key pair in TPM called AIK (Attestation Identity Key) serves as the signing key Its public part is signed by TPM’s unique key (Endorsement Key, aka EK, generated by the manufacturer and never leaves the chip in any operations) and certified by a CA in a separate process (eg|,Non-data,50
|, during setup) This ensures the validity of the signa- ture The data to be signed is the requested PCR values In TXT, the initial PCR value is set to 0, and all subsequent extend operations will update the PCR values in an unforge- able manner (via SHA1)|,Non-data,50
| As a result, as long as the quote matches the expected one, the genuine copy of the program must have been executed, and thus AG1 is achieved 4 IMPLEMENTATION In this section, we discuss our implementation of Hypno- guard under Linux using Intel TXT as the trusted exe- cution provider Note that Hypnoguard’s design is OS- independent, but our current implementation is Linux spe- cific; the only component that must be developed for other OSes is HypnoOSService (see below)|,Non-data,50
| We also performed an experimental evaluation of Hypnoguard’s user experi- ence (for 8GB RAM); no noticeable latency was observed at wakeup-time (eg, when the user sees the lit-up screen) We assume that a delay under a second before entering sleep and during wakeup is acceptable|,Non-data,50
| For larger memory sizes (eg, 32GB), we implement two variants to quickly encrypt selected memory regions 4|,Non-data,50
