|04 e t 003 a r  h c t a m s M i 002 001 A B C 6FHQDULRV D 0   A B C Scenarios     F H V  V W L E   t e a r  t i b  t e r c e S 0 0 0 0 TDS KEEP ASBG Mathur CGC D 40 30 20 10 0 s t n u o c  n o i t a l i c n o c e r  n o i t a m r o f n I A B C Scenarios D A B C Scenarios D Figure 17: Entropy of the keys Figure 18: Bit error rate Figure 19: Secret bit gen- eration rate Figure 20: reconciliation counts Information distance, TDS has no mismatched bit, while other methods may cause around 2% to 4% mismatched bits|,Non-data,53
| Figure 19 shows the bit generation rates Obviously TDS has signifi- cantly higher generation speed Note the bit generation rate of TDS is slower than previous results It is because in this set of experiments, Alice and Bob do not listen to a public WiFi but use the communication among them for sampling|,Non-data,53
| This is the only model that the other protocols can work but TDS is not restricted to it Figure 20 shows the num- ber of rounds for information reconciliation Since there are no mismatched bit, TDS only uses 4 times pass check to guarantee the consistency of transmitted secret bits 6|,Non-data,53
| RELATED WORK To ensure data confidentiality, creating keys based on the physical layer information of wireless channels is promising due to its efficiency and security [18] [25] [5] [7] [26] Most of existing methods focus on pairwise key generation by mea- suring the time-varying channel [11] [29] [21] Exploiting temporal and spatial variations of wireless channels, RSS based techniques are widely used [16][20][8] They tend to transform the RSS values to a sequence of bits, and create secrets based on the reconciled bits|,Non-data,53
| However, RSS may vary at different receivers, so the key generation rate of RSS based methods is low For example, Radiotelepathy [16] extracts secret keys using the channel impulse response (CIR) in the wireless channel and its key generation rate is only around 1 bit per second Pinpoint [27] can fast exchange informa- tion exploiting CIR with reversed jamming noise between two devices, yet with little scalability Contrast with RSS, CSI is much richer source of secret in- formation|,Non-data,53
 It can be obtained via the Orthogonal Frequency- Division Multiplexing (OFDM) Liu et al [14] theoretically prove the feasibility of CSI and high key generation using CSI A practical CSI based key exaction system [12] has been implemented which works in both static and mobile environments,Non-data,53
| However, CSI measurements among adjacent subcarriers have strong correlations, so the key generated from nearby subcarriers also have correlation, which is vul- nerable to key cracking attacks To avoid such a risk, KEEP [28] introduces a validation-recombination mechanism that combines the information of all subcarriers and is resilient to the key cracking attack In many applications, it is necessary to establish a col- laborative key among a group of wireless devices Key es- tablishment concerning the shared group key is discussed in [13]|,Non-data,53
| In a group key establishment scheme, each node keeps a matrix, which includes the values measured from all its channels to its neighbors In summary, none of existing methods can achieve instant and robust key agreement among multiple devices 7 CONCLUSION TDS is a device authentication and key agreement proto- col that helps multiple devices to agree on a secret key in a couple of seconds|,Non-data,53
| Compared with prior solutions for mobile networks, it has four important advantages: i) its key gen- eration rate is faster by more than an order of magnitude; ii) it supports more than two devices; iii) it can agree on an arbitrary key with strong randomness; iv) it can effective- ly defend against predictable channel attacks We conduct rigorous analysis to show the feasibility and security of our protocol We also implement TDS in commodity off-the- shelf WiFi devices The experiment results demonstrate the high efficiency and robustness of TDS|,Non-data,53
| We believe the idea of TDS can be extended in other communication scenarios 8 ACKNOWLEDGMENTS This work is supported by the National Natural Science Foundation of China under Grant No 61325013, 61190112, 61572396, and 61402359|,Non-data,53
| Chen Qian is supported by UC Santa Cruz Startup Grant and National Science Foundation grant CNS-1464335 Sheng Zhong is supported in part by the Jiangsu Province Double Innovation Talent Program and in part by the Na- tional Natural Science Foundation of China under Grant No 61300235, 61321491, 61402223, and 61425024 Xiang-Yang Li is partially supported by NSF ECCS-1247944, NSF CMMI 1436786, NSF CNS 1526638, National Natural Science Foundation of China under Grant No|,Non-data,53
|ABSTRACT We show that equivocation, ie, making conflicting state- ments to others in a distributed protocol, can be monetar- ily disincentivized by the use of crypto-currencies such as Bitcoin To this end, we design completely decentralized non-equivocation contracts, which make it possible to pe- nalize an equivocating party by the loss of its money|,Non-data,56
| At the core of these contracts, there is a novel cryptographic primitive called accountable assertions, which reveals the party’s Bitcoin credentials if it equivocates Non-equivocation contracts are particularly useful for dis- tributed systems that employ public append-only logs to protect data integrity, eg, in cloud storage and social net- works|,Non-data,56
| Moreover, as double-spending in Bitcoin is a special case of equivocation, the contracts enable us to design a payment protocol that allows a payee to receive funds at several unsynchronized points of sale, while being able to penalize a double-spending payer after the fact Categories and Subject Descriptors C24 [Computer-communication networks]: Distributed systems; K44 [Computers and society]: Electronic com- merce—cybercash, digital cash, payment schemes, security Keywords crypto-currencies; Bitcoin; equivocation; append-only logs; accountability; double-spending; payment channels 1|,Non-data,56
| INTRODUCTION Making conflicting statements to others, or equivocation, is a simple yet remarkably powerful tool of malicious par- ticipants in distributed systems of all kinds [4, 19, 20, 33] In distributed computing protocols, equivocation leads to Byzantine faults and fairness issues When feasible, equivo- cation is handled by assuming an honest majority (ie|,Non-data,56
|, larger ∗The work was done while the author was still at Saarland University Permission to make digital or hard copies of all or part of this work for personal or classroom use is granted without fee provided that copies are not made or distributed for profit or commercial advantage and that copies bear this notice and the full citation on the first page Copyrights for components of this work owned by others than the author(s) must be honored Abstracting with credit is permitted|,Non-data,56
| To copy otherwise, or republish, to post on servers or to redistribute to lists, requires prior specific permission and/or a fee Request permissions from Permissions@acmorg CCS’15, October 12–16, 2015, Denver, Colorado, USA|,Non-data,56
 Copyright is held by the owner/author(s) Publication rights licensed to ACM ACM 978-1-4503-3832-5/15/10 ,Non-data,56
$1500 DOI: http://dx,Non-data,56
doiorg/101145/28101032813686,Non-data,56
| replication factors [27]), synchrony assumptions and digital signatures [26], or trusted hardware [4, 19, 20, 33] Moreover, publicly verifiable append-only logs [22, 23, 24, 35] make it possible to detect equivocation after the fact but they do not suffice to stop or penalize equivocation Decentralized crypto-currency systems such as Bitcoin [10, 36] and its derivatives follow a novel approach to handle equivocation To protect against equivocation in the form of double-spending, i|,Non-data,56
|e, spending the same funds to differ- ent parties, Bitcoin employs a special decentralized public append-only log based on proof of work called the blockchain: In a decentralized crypto-currency, users transfer their funds by publishing digitally signed transactions Transactions are confirmed only when they are included in the blockchain, which is generated by currency miners that solve proof-of- work puzzles Although a malicious owner can sign over the same funds to multiple receivers through multiple transac- tions, eventually only one transaction will be approved and added to the publicly verifiable blockchain|,Non-data,56
| As a result, to stop equivocation, it is possible to record all messages in a distributed system that are vulnerable to equiv- ocation in a blockchain Nevertheless, due to proof-of-work computations and the decentralized nature of blockchain sys- tems, the process of reaching consensus is not only expensive but also only slowly converging In Bitcoin, it takes tens of minutes to reach consensus on the set of valid transactions To enable transactions be performed faster, a contractual solution in the form of payment channels [45, 48] is emerging in the Bitcoin community [39, 47]|,Non-data,56
| Here, a payer makes a time-locked deposit for his predetermined payee such that double-spending (or equivocation) is excluded even when pay- ments are performed offline and without waiting However, payment channels are not secure against double-spending when the payee runs several geographically distributed and unsynchronized points of sale, eg, a bus company selling tickets on buses with only sporadic Internet connectivity|,Non-data,56
 Our goal in this paper is to address these equivocation issues by a generic solution that disincentives paltering and is applicable to various distributed systems and scenarios including the aforementioned payment channels with unsyn- chronized points of sale 11 Contributions Our key idea towards preventing equivocation is to use Bitcoin to prescribe a monetary penalty for equivocation Accountable Assertions,Non-data,56
| As a first step, we establish a cryptographic connection between equivocation and the loss of funds by introducing a cryptographic primitive called 219accountable assertions (Section 4) The main idea of this primitive is to bind statements to contexts in an accountable way: if the attacker equivocates, ie, asserts two contradict- ing statements in the same context, then any observer can extract the attacker’s Bitcoin secret key and, as a result, use it to force the loss of the attacker’s funds|,Non-data,56
| We present a construction of accountable assertions based on chameleon hash functions [30] and prove it secure in the random oracle model under the discrete logarithm as- sumption (Section 5) A performance evaluation of our construction demonstrates its practicality with respect to computation, communication, and storage costs Non-equivocation Contracts To ensure that a secret key obtained through equivocation is indeed associated with funds, every party that should be prevented from equivo- cating is required to put aside a certain amount of funds in a deposit [2, 6, 32, 40]|,Non-data,56
| These funds are time-locked in the deposit, ie, the depositor cannot withdraw them during a predetermined time period This prevents an attacker from spending the funds and thus rendering the secret key useless just before equivocating|,Non-data,56
| Accountable assertions and deposits together enable us to design non-equivocation contracts, a generic method to penalize paltering in distributed systems (Section 6) We propose several applications of non-equivocation contracts to ensure the linearity of append-only logs [22, 23, 24, 35] Asynchronous Payment Channels Bitcoin payment channels protocols [45, 48] enable a user to perform pay- ments to a predetermined party offline and without waiting for the consensus process|,Non-data,56
| However, if a payee is a distributed entity (eg, a bus service with several buses as points of sale with only spo- radic Internet connectivity) then even payment channels do not prevent double-spending Since double-spending is an instance of equivocation, non-equivocation contracts enable us to design asynchronous payment channels, which make it possible to penalize double-spending payers (Section 7)|,Non-data,56
| Double-Authentication-Preventing Signatures Of in- dependent interest, we observe that accountable assertions are similar to double-authentication-preventing signatures (DAPS) as proposed by Poettering and Stebila [38] While accountable assertions are in general a weaker primitive, cer- tain accountable assertions are DAPS It was left as an open problem to construct DAPS based on trees or chameleon hash functions [38]|,Non-data,56
| We solve these problems, and our account- able assertion scheme based on Merkle tress and chameleon hash functions in the random oracle model yields the first DAPS scheme secure under the discrete logarithm assump- tion (Appendix A) For practical parameters, it is two orders of magnitude faster than the original DAPS construction [38], and uses one order of magnitude less communication 2 OVERVIEW We conceptualize decentralized non-equivocation contracts and discuss their potential applications|,Non-data,56
| Problem Statement Equivocation, ie, making conflict- ing statements to different protocol parties, is a universal problem in malicious fault-tolerant security protocols involv- ing three or more parties [4, 19, 20, 33]|,Non-data,56
| In all bounded or partial synchronous communication settings, equivocation can be detected using digital signatures (together with a public-key infrastructure) and some interaction among the parties [20]: two recipients who are expected to receive the same message from a sender can exchange the received signed messages to expose and prove equivocation This principle underlies many append-only logs [22, 23, 24, 35] However, it is often not possible to impose a penalty on the maliciously or carelessly equivocating sender after the fact, as the sender may be anonymous or pseudonymous Even when the sender is not anonymous and may lose her reputation once a case of equivocation is detected, the effect of such paltering on the recipient can be damaging|,Non-data,56
| Key Idea Our key idea is to let the sender create a time- locked Bitcoin deposit [2, 6, 32, 40] that can be opened by the recipients if the sender equivocates In case of an equivocation, the funds will be given either to a predefined beneficiary or, once the expiry time of the deposit is reached, to the miners If the expected loss is high enough, the attacker has no incentive to make conflicting statements|,Non-data,56
| Threat Model The attacker is a malicious sender whose goal is to equivocate without losing the deposit To achieve that goal, the attacker can deviate arbitrarily from the pre- scribed protocol but she does not risk to lose her deposit if the expected loss is higher than the expected gain We assume that the attacker cannot break the fundamental security of Bitcoin, e|,Non-data,56
|g, the attacker does not have the majority of computing power in the Bitcoin network Non-equivocation Contracts We describe the main idea of non-equivocation contracts, which are a form of smart contracts [11, 29, 40], in more detail|,Non-data,56
| The sender A creates a time-locked deposit as a guarantee for her honest behavior The deposit is secured by the sender’s secret key sk A; the corresponding public key is pk A  Furthermore, the deposit expires at some point T in the future That is, even though A owns the secret key sk A, she cannot access the funds in the deposit until time T |,Non-data,56
| Before time T , only A together with a predefined beneficiary P can access the funds This beneficiary will be given the funds if A equivocates (There is also a variant of deposits for which the beneficiary is a randomly selected miner We will explain this later|,Non-data,56
|) Once the deposit is confirmed by the Bitcoin network, parties are ready to receive statements from the sender A Non-equivocating contracts are built on the idea that it is possible to learn the key sk A if the sender A equivocates To enforce this cryptographically, we introduce accountable assertions, which allow the user A to produce assertions τ of statements st in contexts ct (where st and ct can be arbitrary bitstrings) under the public key pk A The sender A is held accountable in the following sense: If A behaves honestly, sk A will stay secret, and A can use it to withdraw the deposit once time T has been reached However, if A equivocates to some honest users B and C, i|,Non-data,56
|e, A asserts two different statements st0 6= st1 in the same context ct, then B and C can use st0, st1, ct and the two corresponding assertions τ0 and τ1 to extract the sender’s secret key sk A Due to the way the deposit is created, the recipients B and C alone cannot make use of sk A However, B and C can send sk A to the beneficiary P , who can use sk A together with his credentials to withdraw the deposit and thereby penalize the malicious sender A|,Non-data,56
| Note that B, C and P could as well be protocol parties that belong to essentially the same distributed entity but are just not synchronized when receiving statements from A  2203 BACKGROUND ON BITCOIN Bitcoin is an online digital cryptographic currency run by a decentralized peer-to-peer network|,Non-data,56
| In this section, we explain the basics of Bitcoin that are relevant to our work For a detailed explanation of the mechanics of Bitcoin, we refer the reader to the Bitcoin developer guide [7] A user in the Bitcoin network is identified using one or more pseudonymous addresses Technically, an address is the hash of a public key pk of the ECDSA signature scheme such that the owner of the corresponding secret key sk can use it to transfer bitcoins (symbol: B) associated with her address to another address by signing transactions|,Non-data,56
| Blockchain Miners include transactions in blocks By solving a proof-of-work (POW) puzzle, a block including its transactions is added to the blockchain Once added, a block and its transactions are difficult to modify because blocks are cryptographically chained together, and modifying a block involves re-doing the POW for this and all sequential blocks|,Non-data,56
| A transaction that has been included in the blockchain and backed up by the POW computations of several blocks is thus difficult to invalidate Most users consider a transaction confirmed if it has has been backed up by least six blocks, and the Bitcoin network takes 10 min on average to perform the POW of one block Scripts Bitcoin employs a scripting language to specify under which conditions an unspent output, i|,Non-data,56
|e, some unspent funds in the blockchain, can be spent The language is a simple stack-based language It is intentionally not Turing- complete to avoid complexity and the possibility of creating scripts that are expensive to execute, and could consequently lead to denial-of-service attacks, because every node in the Bitcoin network must execute them|,Non-data,56
| Each transaction sends funds to a script (called ScriptPub- Key), ie, a small program that specifies the conditions that must be fulfilled to spend the funds To spend the funds, the spender must provide an initial execution stack with input values|,Non-data,56
| The transaction is valid if the script terminates successfully on this initial stack 31 Deposits Using specially-crafted scripts, funds can be locked away in a so-called deposit, where they can only be accessed under a set of predetermined conditions While scripts can express a variety of such conditions [7], we focus on time-locked deposits with the property that the depositor cannot access the funds in the deposit until a specified expiry time|,Non-data,56
| With non-equivocation contracts in mind, we consider two types of deposits that differ in the beneficiary, ie, the party that receives the funds in case of equivocation The deposits of the first type do not specify a beneficiary|,Non-data,56
| In this case, the beneficiary will be a randomly selected miner Deposits of the second type are associated with an explicitly beneficiary P identified by his public key pk P Creating Deposits To create time-locked deposits, we use an upcoming feature [17] in Bitcoin, which introduces a new script command denoted by CHECKLOCKTIMEVERIFY [48]1 This command takes one argument T , the expiry time, from the execution stack and compares it to the nLockTime data field of the transaction|,Non-data,56
| If nLockTime < T , the evaluation 1Deposits with explicit beneficiaries and payment channels as described in the following paragraphs are possible even without CHECKLOCKTIMEVERIFY [1, 40, 45]  impl conf fails and the transaction is consequently invalid Thus, only transactions with nLockTime ≥ T can spend the funds cov- ered by such a script|,Non-data,56
| By the semantics of nLockTime, those transactions are valid only in blocks found after time T , and consequently, the funds protected by CHECKLOCKTIMEVERIFY are spendable only after T  We remark that the value of nLockTime can be specified either by a UNIX timestamp or a height of a block, which is the number of blocks that precede it in the blockchain Throughout the paper, we use timestamps, and to simplify presentation, we ignore that miners have some flexibility to lie about the current time [8]; an safety-margin of at least 120 min must be added to T to account for that issue Deposits Without Explicit Beneficiary|,Non-data,56
| Suppose that some user A wishes to create a deposit with expiration time T without an explicit beneficiary Then, A sends the desired amount B d to the following script: (T + T pkA CHECKSIG in the script denote push The literals (T + T operations that push a constant value on the stack The value T is a safety margin; we postpone its discussion to the analysis of non-equivocation contracts (Section 61)|,Non-data,56
| impl conf ) CHECKLOCKTIMEVERIFY DROP conf ) and pk A impl The first line of the script ensures that the deposit cannot be spent before time T as explained (DROP just drops the constant value from the stack) In the second line, CHECKSIG takes the key pk A and a signature σ from the stack; σ is supposed to be provided by the spender on the initial stack CHECKSIGVERIFY verifies that σ is a valid signature of the spending transaction under the key pk A , pushing the boolean result of the verification on the stack|,Non-data,56
| This boolean value is the output of the script Thus, if the check succeeds, the transaction is valid; otherwise it is invalid In sum, the script ensures that the funds can only be spent after T and only by a transaction signed under pk A If the corresponding secret key sk A is revealed, everybody can create transactions that try to spend the funds from time (T + T conf ) on Whenever this happens, each miner impl has a large incentive to include a transaction in a block that sends the money to him|,Non-data,56
| Consequently, the miner that finds the next block will claim the funds Deposits with Explicit Beneficiary Suppose that a user A wishes to create a deposit with an explicit beneficiary P  Then, A sends the desired amount B d to the following script: IF |,Non-data,56
| pkP CHECKSIGVERIFY ELSE (T + T expl conf + T expl net ) CHECKLOCKTIMEVERIFY DROP conf and T expl ENDIF pkA CHECKSIG In this script T net are safety margins, which will expl be discussed below IF obtains its condition from the stack, allowing the spender to choose the branch to be executed CHECKSIGVERIFY is like CHECKSIG but causes the whole script to fail immediately if the signature is not valid (instead of pushing the result of the signature verification to the stack) This script ensures that before time T , the funds can be spent only if the spending transaction is signed under both pk A |,Non-data,56
| Thus, if P learns sk A before time T , he can spend the funds Otherwise, A is refunded after time conf + T (T + T expl and pk P net ), even if P disappears expl 221The safety margins are necessary because the closing trans- action must have been broadcast to the Bitcoin network and confirmed by it before the deposit can be spent by A alone For the broadcast, T net = 10 min is more than sufficient [21]|,Non-data,56
| expl For the confirmations, we except the network to find 24 blocks in T conf = 240 min Since their arrival is Poisson-distributed, expl the probability that fewer than six desired blocks have been found is Pr[X ≤ 5] < 2−18 for X ∼ Pois(24) 32 Payment Channels Payment channels [45, 48] allow a user A to perform many transactions to a predefined recipient B up to a predefined amount B d of money|,Non-data,56
| Although establishing a channel be- tween A and B involves waiting for a transaction to be confirmed, the advantages of a payment channels are various: First, no matter how many payments are sent, only two transactions have to be included in the blockchain, namely one to establish and one to close the channel This makes payment channels a promising method to scale the Bitcoin network to many more transactions [39, 47] Second, A can perform payments to B even if both parties are offline, once the channel has been established Third, fast transactions are possible through the payment channel, because B does not have to wait for the transaction to be confirmed|,Non-data,56
| Creating a Payment Channel To create a payment channel from A to B with maximal payment value B d and expiry time T , A follows the procedure for creating a deposit with explicit beneficiary B B waits until the deposit is confirmed by the Bitcoin network From now on, the funds can only be spent if both A and B agree because any spending transaction must be signed by both A and B to be valid|,Non-data,56
