Paper ID,Coder,Paper name,URL,Conference,Year,DHS funding,Data Used or Produced?,Description,Public?,In IMPACT / PREDICT?,Data link,Research or Industry?,Data Category
,Muwei,Website-Targeted False Content Injection by Network Operators',https://www.usenix.org/conference/usenixsecurity16/technical-sessions/presentation/nakibly,USENIX,2016,No,Produced,Grouping and analyzing injections,No,No,\,Research,Adverse Events
,Hannah,The MALICIA Dataset: Identification and Analysis of Drive-by Download Operations.,https://lirias.kuleuven.be/bitstream/123456789/464045/1/malicia_dataset.pdf,International Journal of Information Security,2015,No,Produced,"collect over time how exploit servers are configured, which exploits they use, and what malware they distribute, grouping servers with similar configurations intooperations",Yes,No,http://malicia-project.com/,Research,Attacks
,Hannah,Search + Seizure: The Effectiveness of Interventions on SEO Campaigns,http://conferences2.sigcomm.org/imc/2014/papers/p359.pdf,IMC (Internet Measurement Conference),2014,No,Produced,"provide the first large-scale empirical characterization of SEO abuse for luxury brands. fetch visitor data for each store by visiting the publicly ac- cessible default AWStats URL, In the PSR data set, we found 68,193 ‰ÛÏhacked‰Ûù search results.",No,No,\,Research,Attacks
,Hannah,AUDACIOUS: User-Driven Access Control with Unmodified Operating Systems,https://dl.acm.org/authorize?N14357,CCS,2016,No,Produced,1060 errors acros 88 of the top 100 free applications in the Android application store caused by event and click forgery,No,No,\,Research,Attacks
,Hannah,New Security Threats Caused by IMS-based SMS Service in 4G LTE Networks,https://dl.acm.org/authorize.cfm?key=N14328,CCS,2016,No,Produced,Attacks based on those vulnerabilities crafted,Yes,No,Data in paper,Research,Attacks
,Hannah,Analyzing Forged SSL Certificates in the Wild,http://ieeexplore.ieee.org/stamp/stamp.jsp?tp=&arnumber=6956558,SP,2014,No,Produced,~6K websites with forged SSL certificates,No,No,\,Research,Attacks
,Hannah,An Empirical Comparison of Botnet Detection Methods,https://pdfs.semanticscholar.org/eabb/a0b46f4325d28d6e02f4ebbf70f40a1263a5.pdf,N/A,2014,No,Produced, dataset consisted in a set of virtualized computers running the Microsoft Windows XP SP2 operating system on top of a Linux Debian host,Yes,No,https://mcfp.felk.cvut.cz/,Research,Attacks
,Hannah,Toward Understanding Distributed Blackhole Placement,http://dl.acm.org/citation.cfm?id=1029627,WORM 2004,2004,No,Produced,"Three  successively more specific views of traffic to a network of distributed blackhole sensors. The data was recorded over a one month period with SYN responders on TCP port 135, 445, 4444, and 9996 across all sensors",Yes,No,\,Research,Attacks
,Hannah,Reliable Third-Party Library Detection in Android and its Security Applications,https://dl.acm.org/authorize.cfm?key=N14369,CCS,2016,No,Produced,"360 affected packages from 23 distinct apps with vulnerability of Dropbox SDK versions 1.5.4 and 1.6.1,  394 affected packages from 51 distinct apps with an account hijacking vulnerability, 667 app versions of 296 distinct apps with a cumulative install-base of 3.7bn using ad libs with verified crypto misuse",No,No,\,Research,Attacks
,Muwei,Estimating the costs of consumer-facing cybercrime: A tailored instrument and representative data for six EU countries,http://weis2016.econinfosec.org/wp-content/uploads/sites/2/2016/05/WEIS_2016_paper_54-2.pdf,WEIS,2016,No,Produced,"We develop an instrument to measure the prevalence of cybercrime and the costs to consumers. We collected representative data for adult Internet users in the following six European member states (in protocol order): Germany (DE), Estonia (EE), Italy (IT), the Netherlands (NL), Poland (PL), and the United Kingdom (UK).",Yes(regional EU),No,http:// ecrime-project.eu/,Research,Attacks
,Muwei,Consumer Attitudes Toward Data Breach Notifications and Loss of Personal Information,http://weis2016.econinfosec.org/wp-content/uploads/sites/2/2016/05/WEIS_2016_paper_11-2.pdf,WEIS,2016,No,Produced,"The survey was conducted using the American Life Panel, a nationally representative panel of more than 6,000 adults who participate in Internet-based surveys covering a diverse set of issues. Fielded between May 15 and June 1, 2015, the survey was designed to provide a snapshot of the frequency of breach notifications and the types of data compromised, as well as consumer reactions to the breach, the notification process, and the affected company. Our survey was fielded between May 14 and June 1, 2015, to 2,618 adults.",No,No,/,Research,Attacks
,Muwei,National-level risk assessment: A multi-country study of malware infections,http://weis2016.econinfosec.org/wp-content/uploads/sites/2/2016/06/WEIS_2016_paper_38-2-1.pdf,WEIS,2016,No,Produced,"Calculating Infection Rate basing on geometry. The five less infected countries were Aland Islands (1.4%), Japan (3%), Cayman Islands (3.4%), Finland (3.6%) and Liechtenstien (3.7%), while the five most infected countries were Ethiopia (63.8%), Iraq (54.5%), Pakistan (54.2%), Yemen (51.8%) and Sudan (51.2%)",No,No,/,Research,Attacks
,Muwei,Strategic News Bundling and Privacy Breach Disclosures,http://weis2016.econinfosec.org/wp-content/uploads/sites/2/2016/05/WEIS_2016_paper_20-1.pdf,WEIS,2016,No,Produced,I build a novel dataset of privacy breaches and hacking from publicly available data from different privacy specialized websites. I construct a large dataset of stocks and news reports of publicly traded companies ,No,No,/,Research,Attacks
,Muwei,RAPTOR: Routing Attacks on Privacy in Tor,https://www.usenix.org/system/files/conference/usenixsecurity15/sec15-paper-sun.pdf,USENIX,2015,No,Produced,"Attack Tor and measure the actual forwarding path taken by packets entering and exiting the Tor network. 62500 totally possible Tor circuits. #2. 612+ million BGP updates per-taining to 550,000 IP prefixes collected by six RIPE- maintained BGP Looking Glass",Yes,No,https://collector.torproject.org,Research,Attacks
,Muwei,Seeing through Network-Protocol Obfuscation,http://dl.acm.org/citation.cfm?doid=2810103.2813715,CCS,2015,No,Produced,"packet-level traces for Tor Pluggable Transport traffic collected in controlled environments, website fingerprint attack",No,No,/,Research,Attacks
,Muwei,Dissecting Android Malware: Characterization and Evolution.,http://nieh.net/teaching/e6998/papers/OAKLAND12.pdf,IEEE Security and Privacy,2012,No,Produced,"We obtain the list by carefully examining the related security announcements, threat reports, and blog contents from existing mobile anti- virus companies and active researchers, Our dataset has 1260 samples",No,No,/,Research,Attacks
,Muwei,Certified PUP: Abuse in Authenticode Code Signing,http://dl.acm.org/citation.cfm?doid=2810103.2813669,CCS,2015,No,Produced,"The certificate blacklist output by our infrastructure contains 2,170 CA-issued code signing certificates",No,No,/,Research,Attacks
,Muwei,The Ever-Changing Labyrinth: A Large-Scale Analysis of Wildcard DNS Powered Blackhat SEO',https://www.usenix.org/conference/usenixsecurity16/technical-sessions/presentation/du,USENIX,2016,No,Produced,"examined over 13 million domains under 22 TLDs/SLDs and discovered over 458K SEO domains. Finally, we measured the spider-pool ecosystem on top of these domains and analyzed the crawling results from 21 spider pools",No,No,/,Research,Attacks
,Muwei,A Comprehensive Measurement Study of Domain Generating Malware',https://www.usenix.org/conference/usenixsecurity16/technical-sessions/presentation/plohmann,USENIX,2016,No,Produced,43 DGA based malware famillies and variants,Yes,No,https://dgarchive.caad.fkie.fraunhofer.de,Research,Attacks
,Muwei,Towards Measuring and Mitigating Social Engineering Software Download Attacks',https://www.usenix.org/conference/usenixsecurity16/technical-sessions/presentation/nelms,USENIX,2016,No,Produced,collect and reconstruct more than two thousand examples of in-thewild SE download attacks from live network traffic.,No,No,/,Research,Attacks
,Muwei,Finding Unknown Malice in 10 Seconds: Mass Vetting for New Threats at the Google-Play Scale,https://www.usenix.org/conference/usenixsecurity15/technical-sessions/presentation/chen-kai,USENIX,2015,No,Produced,"Over the 127,429 malicious apps detected in our study",No,No,/,Research,Attacks
,Muwei,Evilcohort: detecting communities of malicious accounts on online services,https://www.usenix.org/system/files/conference/usenixsecurity15/sec15-paper-stringhini.pdf,USENIX,2015,Yes,Produced,"In total, Lis com- posed of 66,509 malicious accounts",No,No,/,Research,Attacks
,Hannah,Traveling the Silk Road: A Measurement Analysis of a Large Anonymous Online Marketplace,https://www.andrew.cmu.edu/user/nicolasc/publications/TR-CMU-CyLab-12-018.pdf,WWW 2013 (22nd international world wide web conference),2013,No,Produced,"gather and analyze data over eight months between the end of 2011 and 2012, including daily crawls of the marketplace for nearly six months in 2012 (February 3, 2012 ‰ÛÒ July 24, 2012)",Yes,No,https://arima.cylab.cmu.edu/sr/,Research,Cybercrime Infrastructure
,Muwei,MyTrackingChoices: Pacifying the Ad-Block War by Enforcing User Privacy Preferences,http://weis2016.econinfosec.org/wp-content/uploads/sites/2/2016/05/WEIS_2016_paper_48.pdf,WEIS,2016,No,Produced,"we have approximately 76000 entries for English language. Three additional lists of unigrams and bigrams, although with a fewer number of entries, are also available for French, Spanish and Italian.The collected data is from those users of MyTrackingChoices who downloaded it directly from Chrome Web Store. In order to study blocking ad behaviors.",No,No,/,Research,Cybercrime Infrastructure
,Muwei,Measuring the longitudinal evolution of the online anonymous marketplace ecosystem,https://www.usenix.org/system/files/conference/usenixsecurity15/sec15-paper-soska.pdf,USENIX,2015,Yes,Produced,crawling online anonymous marketplaces,No,No,/,Research,Cybercrime Infrastructure
,Hannah,Chainsaw: Chained Automated Workflow-based Exploit Generation,http://dl.acm.org/citation.cfm?id=2978380,CCS,2016,No,Produced,199 first- and second-order injection exploits,Only a few were discussed,\,Some specific exploits in data paper,Research,Exploits
,Hannah,The Sounds of the Phones: Dangers of Zero-Effort Second Factor Login based on Ambient Audio,https://dl.acm.org/authorize.cfm?key=N14303,CCS,2016,No,Produced,General population statistics via an online survey to determine the phone usage habits and patterns relevant to attacks,No,No,\,Research,Offline Characteristics
,Hannah,When CSI Meets Public WiFi: Inferring Your Mobile Phone Password via WiFi Signals,https://dl.acm.org/authorize.cfm?key=N14314,CCS,2016,No,Produced,Study of ten volunteers and their touch screen usage related to entering passcodes,No,No,\,Research,Offline Characteristics
,Muwei,International Comparison of Bank Fraud Reimbursement: Customer Perceptions and Contractual Terms,http://weis2016.econinfosec.org/wp-content/uploads/sites/2/2016/05/WEIS_2016_paper_78-1.pdf,WEIS,2016,No,Produced," We surveyed the terms and conditions of 30 banks operating in 25 countries. The terms and conditions were reviewed to identify instructions or advice on security. This included how users should handle the PINs associated with their cards, as well as telephone and Internet banking credentials. The documents are worked through by 151 participants.",No,No,/,Research,Offline Characteristics
,Muwei,To Pin or Not to Pin‰ÛÓHelping App Developers Bullet Proof Their TLS Connections,https://www.usenix.org/system/files/conference/usenixsecurity15/sec15-paper-oltrogge.pdf,USENIX,2015,No,Produced,"we instrument telemetry data from a popular anti-virus software provider. We evaluate the update behaviour of 871,911 unique users from January 2014 to December 2014",No,No,/,Research,Offline Characteristics
,Muwei,To Pin or Not to Pin‰ÛÓHelping App Developers Bullet Proof Their TLS Connections,https://www.usenix.org/system/files/conference/usenixsecurity15/sec15-paper-oltrogge.pdf,USENIX,2015,No,Produced,We there- fore collected feedback from 45 developers of apps for which we would recommend pinning.,No,No,/,Research,Offline Characteristics
,Muwei,De-anonymizing Programmers via Code Stylometry,https://www.usenix.org/system/files/conference/usenixsecurity15/sec15-paper-caliskan-islam.pdf,USENIX,2015,No,Produced,"We collected a larger dataset of 1,600 programmers from various years. Each of the programmers had 9 source code samples.",No,No,/,Research,Offline Characteristics
,Muwei,Investigating the Computer Security Practices and Needs of Journalists,https://www.usenix.org/conference/usenixsecurity15/technical-sessions/presentation/mcgregor,USENIX,2015,No,Produced,We interviewed 15 journalists employed in a range of well-respected journalistic institutions in the United States and France,No,No,/,Research,Offline Characteristics
,Muwei,The Million-Key Question‰ÛÓInvestigating the Origins of RSA Public Keys,https://www.usenix.org/system/files/conference/usenixsecurity16/sec16_paper_svenda.pdf,USENIX,2016,No,Produced,"analysed over 60 million freshly generated key pairs from 22 open- and closedsource libraries and from 16 different smartcards, revealing significant leakage",No,No,/,Research,Password Lists
,Muwei,Measuring Real-World Accuracies and Biases in Modeling Password Guessability,https://www.usenix.org/conference/usenixsecurity15/technical-sessions/presentation/ur,USENIX,2015,No,Produced,we leverage passwords that our group col- lected for prior studies of password-composition poli- cies,No,No,/,Research,Password Lists
,Hannah,Reliable Third-Party Library Detection in Android and its Security Applications,https://dl.acm.org/authorize.cfm?key=N14369,CCS,2016,No,Produced,"Comprehensive repository of third-party libraries and applications containing 164 libraries of different categories and a total of 2,065 versions, version histories for the top 50 apps of each category on Play between Sep 2015 and July 2016, accumulating to 96,995 packages from 3,590 apps, meta-information, such as app and library release dates, ",No,No,\,Research,PopulationEnumeration
,Muwei,A Large-Scale Analysis of the Security of Embedded Firmwares,https://www.usenix.org/conference/usenixsecurity14/technical-sessions/presentation/costin,USENIX,2014,No,Produced,"we collected an initial set of 759,273 files (totaling 1.8TB of storage space) from publicly accessible firmware update sites",No,No,/,Research,PopulationEnumeration
,Muwei,The SICILIAN Defense: Signature-based Whitelisting of Web JavaScript,http://dl.acm.org/citation.cfm?doid=2810103.2813710,CCS,2015,No,Produced,"Based on our observation on 33,302 scripts hosted on Alexa‰Ûªs top 500 sites, 93% of the scripts remain static over time and the rest 7% change",No,No,/,Research,PopulationEnumeration
,Muwei,Tracing Information Flows Between Ad Exchanges Using Retargeted Ads',https://www.usenix.org/conference/usenixsecurity16/technical-sessions/presentation/bashir,USENIX,2016,No,Produced,"Crawl to get we collected 571,636 unique images about ads in total",No,No,/,Research,PopulationEnumeration
,Muwei,An In-Depth Analysis of Disassembly on Full-Scale x86/x64 Binaries',https://www.usenix.org/conference/usenixsecurity16/technical-sessions/presentation/bashir,USENIX,2016,No,Produced,We explore a wide variety of 981 realistic binaries,No,No,/,Research,PopulationEnumeration
,Muwei,Internet Jones and the Raiders of the Lost Trackers: An Archaeological Study of Web Tracking from 1996 to 2016',https://www.usenix.org/conference/usenixsecurity16/technical-sessions/presentation/lerner,USENIX,2016,No,Produced,"collects tracking- relevant data, such as third-party requests, cookies, and the use of certain JavaScript APIs",No,No,/,Research,PopulationEnumeration
,Muwei,On Demystifying the Android Application Framework: Re-Visiting Android Permission Specification Analysis',https://www.usenix.org/conference/usenixsecurity16/technical-sessions/presentation/backes_android,USENIX,2016,No,Produced,collect complexity information about the application framework,Yes,No,http://www.axplorer.org,Research,PopulationEnumeration
,Muwei,Harvesting Inconsistent Security Configurations in Custom Android ROMs via Differential Analysis',https://www.usenix.org/conference/usenixsecurity16/technical-sessions/presentation/aafer,USENIX,2016,No,Produced,"We collected 591 Android ROMs from Samsung Updates [4], other sources [3, 1, 2], and physical devices. These images are customized by 11 vendors, for around 135 models, 45 regions and 8 carriers.",No,No,/,Research,PopulationEnumeration
,Muwei,Protecting Privacy of BLE Device Users',https://www.usenix.org/conference/usenixsecurity16/technical-sessions/presentation/fawaz,USENIX,2016,No,Produced,study the behavior of more than 200 types of BLE-equipped devices,No,No,/,Research,PopulationEnumeration
,Hannah,Friendship and mobility: User movement in location-based social networks.,http://cs.stanford.edu/people/jure/pubs/mobile-kdd11.pdf,KDD,2011,No,Produced,"Gowalla data contains 6, 442, 890 check-in locations of 196,586 users over the period of Feb. 2009 to Oct. 2010.",No,No,\,Research,Regular Network/Behavior Data
,Hannah,"Geolife: A collaborative social networking service among user, location and trajectory.",http://sites.computer.org/debull/A10june/geolife.pdf,Bulletin of the IEEE Computer Society Technical Committee on Data Engineering,2010,No,Produced,"Geolife data was collected from 182 users in a period of over three years. It recorded a wide range of users‰Ûª outdoor movements, represented by a series of tuples containing latitude, longitude and timestamp.",Yes,No,\,Research,Regular Network/Behavior Data
,Muwei,Seeing through Network-Protocol Obfuscation,http://dl.acm.org/citation.cfm?doid=2810103.2813715,CCS,2015,No,Produced,packet-level traffic traces collected at various locations in a campus network,No,No,/,Research,Regular Network/Behavior Data
,Muwei,Website-Targeted False Content Injection by Network Operators',https://www.usenix.org/conference/usenixsecurity16/technical-sessions/presentation/nakibly,USENIX,2016,No,Produced,"In ad- dition, we list the length of time we monitored the traffic as well as the total volume traffic and number of sessions the monitoring system processed. In aggregate, we mon- itored the traffic of more than 75,000 users, while pro- cessing 1.4 petabits carried by 129 million HTTP ses- sions contacting servers having more than 1.5 million distinct IP addresses.",No,No,/,Research,Regular Network/Behavior Data
,Muwei,Towards Detecting Anomalous User Behavior in Online Social Networks,https://www.usenix.org/conference/usenixsecurity14/technical-sessions/presentation/viswanath,USENIX,2014,No,Produced,collect data for over 6.8K users using real-world ground-truth data about normal and anomalous user behavior on Facebook.,No,No,/,Research,Regular Network/Behavior Data
,Muwei,Towards Detecting Anomalous User Behavior in Online Social Networks,https://www.usenix.org/conference/usenixsecurity14/technical-sessions/presentation/viswanath,USENIX,2014,No,Produced,"collected the publicly visible like and Timeline [34] activity of 13,991 users over the 26 month period ending in August 2013",No,No,/,Research,Regular Network/Behavior Data
,Muwei,Evilcohort: detecting communities of malicious accounts on online services,https://www.usenix.org/system/files/conference/usenixsecurity15/sec15-paper-stringhini.pdf,USENIX,2015,Yes,Produced,"Our dataset was composed of the emails generated by 21,387,006 distinct online accounts over a period of one day. In total, this dataset contained 72,471,992 emails.",No,No,/,Research,Regular Network/Behavior Data
,Hannah,Uncovering Network Tarpits with Degreaser,http://dl.acm.org/citation.cfm?id=2664285,N/A,2014,Yes,Produced,107 different tarpit subnetworks ranging in size from /16 (with up to 2^16 fake hosts) to /24 (with up to 2^8 fake hosts),No,\,\,Research,Topology/ScanData
,Hannah,A Systematic Analysis of the Juniper Dual EC Incident,https://dl.acm.org/authorize.cfm?key=N14378,CCS,2016,No,Produced,"Internet-wide scan of all IPv4 addresses on port 500, with various messages sent/recieved with certain criteria",No,No,\,Research,Topology/ScanData
,Muwei,Circuit Fingerprinting Attacks: Passive Deanonymization of Tor Hidden Services,https://www.usenix.org/system/files/conference/usenixsecurity15/sec15-paper-kwon.pdf,USENIX,2015,No,Produced,this experiment is to understand the usage of IP and RP circuits from the hidden server and from the client points of view.,Yes,No,http://people.csail.mit.edu/kwonal/hswf.tar.gz,Research,Topology/ScanData
,Muwei,Circuit Fingerprinting Attacks: Passive Deanonymization of Tor Hidden Services,https://www.usenix.org/system/files/conference/usenixsecurity15/sec15-paper-kwon.pdf,USENIX,2015,No,Produced,gathered data to test OP servicing a normal user and a hidden service for both closed and open world settings,Yes,No,http://people.csail.mit.edu/kwonal/hswf.tar.gz,Research,Topology/ScanData
,Muwei,In the Compression Hornet‰Ûªs Nest: A Security Study of Data Compression in Network Services,https://www.usenix.org/conference/usenixsecurity15/technical-sessions/presentation/pellegrino,USENIX,2015,No,Produced,"Nmap Security Scanner tool, HTTP servers of the first 1000 domains of the Alexa DB",No,No,/,Research,Topology/ScanData
,Muwei,A Measurement Study on Co-residence Threat inside the Cloud,https://www.usenix.org/conference/usenixsecurity15/technical-sessions/presentation/xu,USENIX,2015,No,Produced,"Trace-routing from our instances to over 650,000 target instances takes more than 8 days",No,No,/,Research,Topology/ScanData
,Muwei,Analysis of the HTTPS Certificate Ecosystem,http://conferences.sigcomm.org/imc/2013/papers/imc257-durumericAemb.pdf,Sigcomm,2013,Yes,Produced,"completed 110 exhaustive scans of the public IPv4 address space. we completed upwards of 400 billion SYN probes and 2.55 billion TLS handshakes, collecting and parsing 42.4 million unique X.509 certificates from 109 million hosts.",No,No,/,Research,Topology/ScanData
,Muwei,A Comprehensive Measurement Study of Domain Generating Malware',https://www.usenix.org/conference/usenixsecurity16/technical-sessions/presentation/plohmann,USENIX,2016,No,Produced,"Taking data of 3 months starting in May 2015 from this feed, we examined a total of 1,235,443 sandbox runs, performing a total of 15,660,256 DNS queries to- wards 959,607 unique domain names.",No,No,/,Research,Topology/ScanData
,Hannah,"Twice the Bits, Twice the Trouble: Vulnerabilities Induced by Migrating to 64-Bit Platforms",https://dl.acm.org/authorize.cfm?key=N14374,CCS,2016,No,Produced,"Found vulnerabilities related to integers, migrating from 32 bit and larger address space",Yes,No,Data in paper,Research,Vulnerabilities
,Hannah,UniSan: Proactive Kernel Memory Initialization to Eliminate Data Leakages,https://dl.acm.org/authorize.cfm?key=N14304,CCS,2016,Yes,Produced,"Discovered many previously unknown information leak vulnerabilities in the latest Linux and Android kernels, 19 of which have been confirmed by Linux maintainers and Google, ","Sent to Google and Linux, Yes",No,http://www.cvedetails.com/vulnerabilities-by-types.php,Research,Vulnerabilities
,Hannah,UniSan: Proactive Kernel Memory Initialization to Eliminate Data Leakages,https://dl.acm.org/authorize.cfm?key=N14304,CCS,2016,Yes,Produced,conducted another study of kernel information leak vulnerabilities reported after 2013,No,No,\,Research,Vulnerabilities
,Hannah,New Security Threats Caused by IMS-based SMS Service in 4G LTE Networks,https://dl.acm.org/authorize.cfm?key=N14328,CCS,2016,No,Produced,Vulnerabilities found,Yes,No,Data in paper,Research,Vulnerabilities
,Hannah,The Misuse of Android Unix Domain Sockets and Security Implications,https://dl.acm.org/authorize.cfm?key=N14247,CCS,2016,No,Produced,Identified vulnerabilities in Android daemons and apps,No (sent to developers),No,https://sites.google.com/site/unixdomainsocketstudy/home,Research,Vulnerabilities
,Hannah,On the Practical (In-)Security of 64-bit Block Ciphers Collision Attacks on HTTP over TLS and OpenVPN,https://dl.acm.org/authorize.cfm?key=N14377,CCS,2016,No,Produced,"Various vulnerabilities in Mozilla Firefox, OpenVPN, OpenSSL, Akami, Apple, Microsoft",Yes,No,https://sweet32.info/,Research,Vulnerabilities
,Hannah,Scalable Graph-based Bug Search for Firmware Images,https://dl.acm.org/authorize.cfm?key=N14379,CCS,2016,No,Produced,"Freely available vulnerability database for this effort and for the broader research community, 23 vulnerabilities in firmware images",Yes/(sent to developers),No,\,Research,Vulnerabilities
,Hannah,Call Me Back! Attacks on System Server and System Apps in Android through Synchronous Callback,https://dl.acm.org/authorize.cfm?key=N14248,CCS,2016,No,Produced,Identified six previously unknown vulnerabilities in Android service systems,No (sent to Google),"No",Data in paper,Research,Vulnerabilities
,Muwei,In the Compression Hornet‰Ûªs Nest: A Security Study of Data Compression in Network Services,https://www.usenix.org/conference/usenixsecurity15/technical-sessions/presentation/pellegrino,USENIX,2015,No,Produced,review three popular communication protocols and test 19 implementations against highly-compressed protocol messages and find nine vulerabilities,Yes,No,https://cve.mitre.org/cgi-bin/cvename.cgi?name=CVE-2014-0118,Research,Vulnerabilities
