reason,type,keyWord,,
I am studying the robustness of the financial network system under a DHS S&T grant.  This research is looking for vulnerabilities in the nature of equity market trading.,,,,
"We are looking for data for our data analytics and visualization project especially targeted towards networks infrastructures and / or cybersecurity. The PCH and US Long-haul topology dataset particularly fits our infrastructure data needs while the GT Malware data can help us proceed with our cybersecurity research project. The project will utilize several graph theory techniques, scientific data analytics approaches and also include an interactive visualization web app development as part of the exploratory data analysis (EDA) process. It'll be a great help if we receive approval for the dataset. We shall also responsibly manage and restrict access in accordance to the usage policies in the terms of use.",,,,
Our research is to compare relationships between different cyber threat intelligence sources. Specifically we want to compare the content of this web site with what is available on HAILATAXII.,,,,
PhD Research,,,,
Graduate project research,,,,
To improve network visualization. ,,,,
Exploring the dataset to see if the information that was collected can be used as the input to some of the systems that we developed.,,,,
"We want to look into the dataset and see if the type of data and the information that were collected can be applied to the systems that our lab has developed. Hence we want to use this dataset as a mean to test our systems and produce interesting results out of them.We are currently exploring various dataset to see which one is more applicable to our needs.",,,,
"We are currently working on a research project at CCAA center and we would like to investigate these datasets in order to see whether we can use them. CCAA has been established under the National Science Foundation (NSF) Industry/University Cooperative Research Program (I/UCRC) in September 2013. The center is a public, private, and academic consortium established and led by the University of North Carolina at Charlotte in partnership with George Mason University and a broad membership of industry and government organizations.",,,,
"Hi. I would like to use the long haul fiber lines that you show on your map. I do not need any data or information about the lines, I just want to show where they are in the US like you do in your original map. I am planning on incorporating these lines into a map I am making, and the long haul fiber lines will just be background information. These lines are going into a map about railways in the U.S. If you would like to see the map I would add it too, let me know and I can send it your way. ",,,,
"Our dependence of the internet has grown much faster than our understanding of its underlying strucure, global dynamics, operational threats, and overall health. Large-scale internet service disruptions due to malware and/or politically motivated activities occur with some regularity.We have developed a methodology that uses dark space data from the UCSD Network Telescope, that identifies networks affected by an outage, and determines what techniques are used to cause deliberate disruption. We obtain metrics to quantitatively gauge the geographic and topological extent of the impact of geophysical disasters on internet infrastructure, and techniques to investigate the chronological dynamics of the outage and restoration.The USC Lander datasets provide reference information on normally reachable hosts/networks for the study and targeted analysis of these large-scale internet outages.We have recently developed methodologies based on passive traffic analysis that allow additional insight into whether a given IP network prefix is actively used.  We will combine our results  with the USC Lander datasets to generate derived datasets that  we plan to share through PREDICT.  Researchers will be able to use these data sets for similar purposes as the existing USC Lander data sets, e.g., inference of address space utilization.This request is a follow-up to similar requests over the last years. We are only requesting the datasets not covered by these earlier requests.",,,,
"We want to examine how different kinds of data like vulnerability scan data, firewall logs, operating system logs, web server logs etc. can be utilized to correlate IDS alerts to real attacks in a risk-aware way. As a result we need real world data that can meet at least some of our requirements.  ",,,,
The data will be used for a revision of the Reverse Traceroute system. It will be used to test support for the types of probes that are used as well as to improve the measurement techniques utilized by the system.,,,,
Malware distribution research,,,,
Analysis of long-haul backbone in Northwest Florida: Understanding fiber-optics infrastructure for economic opportunity,,,,
"In order to protect the members of our university, we want to look at the relationship between risky behavior in the phyiscal world and vulnerability to phishing attack. In other words, we want to see if things like smoking, excessive drinking, or promiscuity can predict when someone is more likely to trust a ""phishy""-looking email. We can't say for certain what we will do with the data in the logs until we see the fields available, but we are planning on looking at general demographics first.",,,,
Researching various long-haul communications links involving MIT facilities.,,,,
research of fiber routing paths for CT research network diversity,,,,
The data will be used to develop and test anomaly detection algorithms as part of a Capstone project for the MSPA graduation program at Northwestern University.,,,,
Research in attacker modeling,,,,
We are going to use this dataset for our NSF funded project. The aim of our project is to minimize the redundant probing on internet measurement techniques.,,,,
"As a participant in the Computational Cybersecurity in Compromised Environments (C3E) workshop, I plan to use this dataset to research solutions to the C3E challenge problem",,,,
We are going to use this data to perform our experiments on our NSF funded Internet Measurement project. We aim to create a new way of probing system that reduces the probing overhead.,,,,
"The motivation of our project is to develop a comprehensive system that will capture the Internet topology at fine granularity and periodically provide snapshots of the Internet backbone. The mapping system will then be utilized to investigate topological characteristics of the Internet and provide an underlay for applications to optimize their communications.This data sets will be merged with the others we are collecting from CAIDA,ROUTEVIEWS and CIDR in order to have the current collection of datasets together that we can run our tests on them. ",,,,
I am researching on novel ways to analyze a large quantity of system generated logs and messages to extract relevant security information and categorize security events. The data will be used to measure the performance of the feature extraction and event classification algorithms that I am developing. ,,,,
"Apply big data Techniques to Malware analysisClassify viruses using Dynamic behavior data and static features",,,,
Conducting network research and data analysis to identify new methods for communicating in an emerging technical environment. Developing and testing algorithms which may be applied to additional data sets.,,,,
We would like to investigate the possibility of using this dataset in one of our projects at Center for Configuration Analytics and Automation (CCAA). CCAA is a multi-university and multi-industry consortium established and led by the University of North Carolina at Charlotte in partnership with George Mason University and a broad membership of industry and government organizations,,,,
Use for malware analysis research project in Georgia Tech.,,,,
"The intended purpose for this request is to incorporate the DNS data feed into a Security Onion deployment. The Security Onion machine includes NSM tools, such as Bro IDS, which will allow for alerting and reporting of suspicious, or anomalous activity. The goal is to gauge the effectives of incorporating an external entities DNS feed (Georgia Tech).",,,,
The Astrolavos lab aims to provide generalizable solutions to security problems with high operational impact. We need malware related datasets to form ground truth of many projects.,,,,
Threat intelligence platform development,,,,
Just some comparison with other feed data.,,,,
"I work in the information security operations center, and would like the data for IOCs that will help find malicious traffic.",,,,
Member of SIGCOMM program committee and would like to review electronic component of published paper,,,,
The data will be used for a revision of the Reverse Traceroute system. It will be used to test support for the types of probes that are used as well as to improve the measurement techniques utilized by the system. ,,,,
For participation in the 2015 C3E challenge.  http://cps-vo.org/group/c3e/ccp,,,,
For the 2015 C3E challenge.  http://cps-vo.org/group/c3e/ccp,,,,
We intend to use this dataset as part of our ongoing border blocking project. Our goal for the use of the data would be to further reduce malicious incoming traffic destined for Duke.,,,,
"Correlate passive DNS pcap information with domains used by malicious or suspect executables.Correlate passive DNS data with other threat intel collected at GWU.Our goals are to improve detection and classification of existing data seen on our SIEM.We also just want to take a look at the data feed and its format to determine how it may best server the network security team at GWU.",,,,
"Operational security at Emory University, such alerting on activity for included hosts, or blocking requests to included hosts",,,,
to determine the effectiveness of algorithms on infiltration and ex-filtration of an attack on a system. ,,,,
This data will be used for research on network intrustion detection,,,,
The research this data is used for Network Intrusion Detection.,,,,
Conducting targeted traceroutes from cloud service providers,,,,
"This project focuses on NetFlow data. We attempt to transform theincoming stream of low-level data to a high-level understanding of thenetworkÃƒÂ¢Ã‚â‚¬Ã‚â„¢s operational status and reach actionable recommendations. EachNetFlow record includes some basic information about the sampled flow,including its source and destination address, duration, size, etc. Anindividual NetFlow record cannot give us much information about whathappens in the network. Therefore, instead of trying to understand whathappens at the level of individual flows, we focus our analysis on thelevel of aggregated flows. Aggregation will not be ÃƒÂ¢Ã‚â‚¬Ã‚Å“hardwiredÃƒÂ¢Ã‚â‚¬Ã‚Âù, e.g.,based on fixed prefix resolution. Instead, we will propose a clusteringalgorithm for flow aggregation that selects automatically the set offeatures that produce the most homogeneous clusters of NetFlow records.We will utilize spatio-temporal information of the NetFlow dataset torefine clusters to a meaningful homogeneous level. For example, a goodcluster of NetFlow records may end up being all NetFlix traffic thatoriginates from a certain Limelight caching site in Atlanta to allComcast customers in Macon GA during a 6-hour time period.After the clustering step is performed, the next task will be toidentify significant correlations between clusters.Temporal correlationsof these clusters are leveraged to form a graphical model between them.The graphical model with nodes being clusters of flows and edges beingtemporal correlations between them offers parsimonious model of networkdynamics. We will use this model to monitor the network for behavioralshifts and anomalies, which can be proxies for security attacks, networkproblems, structural changes or real changes in the behavior of thenetwork subscribers.",,,,
determine the effectiveness of determine infiltration and ex-filtration of malicious attitudes. ,,,,
"Our project involves studying various characteristics of real Internet traffic.  Our study (which has been approved by IRB,  CWRU IRB Protocol Number:  IRB-2012-171)   involves operating a traffic monitor on the border between our own campus and the Internet and analyzing collected traffic at this vantage point.  Our goal is to study TCP algorithm details,  including questions such as ACKs that cover multiple segments, and  frequency of TCP timestamp use.   We would like to augment our analysis with another vantage point.   Specifically, we are requesting 1 day of data containing just IP and TCP headers (including TCP options).   ",,,,
The motivation of the project is to develop a comprehensive system that will capture the Internet topology at fine granularity and periodically provide snapshots of the Internet backbone. The mapping system will then be utilized to investigate topological characteristics of the Internet and provide an underlay for applications to optimize their communications.,,,,
View and analyze traffic to work test effectiveness of snort rules,,,,
Data analysis for IDS/IPS tuning exercise,,,,
I am a graduate student at Texas A&M University researching deterrence in cybersecurity policy.  I am trying to conduct quantitative analysis on unclassified cyber data to see if major cyber events have caused a change in activity.  I will be using the data to conduct statistical analysis and then possibly be used in a research paper.  I do not intend to publish this paper or otherwise disclose it beyond the professor of the course.,,,,
"Continued work to identify and confirm high latency hosts, investigate subnet structure, develop failure detection methods based on observations of real ping responses.",,,,
The motivation of the project is to develop a comprehensive system that will capture the Internet topology at fine granularity and periodically provide snapshots of the Internet backbone. ,,,,
"Goals:1. Find top hacking methodology2. Find tools used3. Find ports usedObjective: Research past event data to prep team for national competition. This will not necessarily be used right now for publication but will be used to enhance classroom experience as well as prep experience for the CCDC groups.",,,,
Research attack vectors and successful exploitation attempts in order to build stronger defenses.,,,,
Conduct analysis of traffic used in a national cyber defense competition to use as a basis for other cyber defense competitions.,,,,
"Our dependence on the Internet has grown much faster than our understanding of its underlying structure, global dynamics, operational threats, and overall health. We have developed metrics to quantitatively gauge the geographic and topological extent of the impact of geophysical disasters on internet infrastructure, and techniques as they manifest themselves on the UCSD Network Telescope. This dataset will provide required reference information on known Internet outages.",,,,
"We intend to analyze the polygonal foot print of address blocksover the world in order to get a clear picture of IP block levelvisualization. We also intend to show how much of a given IP block is actually in use, in a visual manner.",,,,
Data sets support the analysis of paths (by organization) from major content providers to end-user networks.,,,,
"We intend to analyze the polygonal foot print of address blocks over the world in order to get a clear picture of IP block level visualization. We also intend to show how much of a given IP block is actually in use, in a visual manner.",,,,
I intend to use this information as research to help provide further understanding as to what sort of scale attacks take place on the Internet.,,,,
"I am currently advising Yitian Tang, an undergraduate student at the  University of Illinois at Urbana Champaign, in the context of an undergraduate research program, on Quickest Change Detection (QCD) methods, which is one of my research areas. One of the main goals of our project is to illustrate the usefulness of these techniques to the area of  cybersecurity.  Various QCD techniques have been proposed in the literature in order to design anomaly-based intrusion detection schemes.  We aim to explore the performance of novel techniques from quickest detection to this area and compare them with existing methods.  ",,,,
"Our dependence on the Internet has grown much faster than our understanding of its underlying structure, global dynamics, operational threats, and overall health. Large-scale internet service disruptions due to malware and/or politically-motiviated activities occur with some regularity. We have developed a methodology, using dark space data from the UCSD Network Telescope, that can identify the networks that are affected by an outage, and can determine what techniques are used to cause a deliberate disruption. We have developed metrics to quantitatively gauge the geographic and topological extent of the impact of geophysical disasters on internet infrastructure, and techniques to investigate the chronological dynamics of the outage and restoration. The USC Lander datasets will provide required reference information on normally reachable hosts/networks for the study and targeted analysis of these large-scale Internet outages.",,,,
"This project is intended to understand responsiveness properties of arbitrary internet hosts and subnetting characteristics.  The survey data is particularly useful given its repeated probing of wide aspects of the internet.  We now hope to look at longitudinal properties given older and newer data from what we have previously studied, and to confirm that conclusions observed in previously requested data held in 2014.NOTE: this is a partial renewal of survey_reprobing data previously requested including datasets 20111102-20131017, which need not be made available for download.",,,,
"Trace the source IP obfuscated due to network address translations (NAT).However, the data would be useful only if some of the devices are performing NAT and are operating at the Internet Level.",,,,
"Project: Perform IP trace using Syslog data to detect IP address obfuscation due to Network Address Translation (NAT)However, I would like some of the devices to have some NAT and have these devices operate at the Internet level.",,,,
"We are currently using the BGP data available from Route Views and RIPE to perform analysis on Internet topology and routing events, particularly as it relates to nation-states and organizations of interest. We would like to acquire additional data about Internet topology to perform additional analysis, and determine whether the CAIDA topology data provides additional insight missing from the data sources we're already using.",,,,
"Determining connectivity of large cloud service providers, such as Amazon AWS, via traceroutes to hitlist IPs.",,,,
Analysis of DoS attack traffic data in order to develop attack detection and mitigation mechanisms. Existing attack data will be used to extract features in order to select parameters required for training of a learning system which should detect generic DoS attack.,,,,
"Our dependence on the Internet has grown much faster than our understanding of its underlying structure, global dynamics, operational threats, and overall health. Large-scale internet service disruptions due to malware and/or politically-motiviated activities occur with some regularity. We have developed a methodology, using dark space data from the UCSD Network Telescope, that can identify the networks that are affected by an outage, and can determine what techniques are used to cause a deliberate disruption. We have developed metrics to quantitatively gauge the geographic and topological extent of the impact of geophysical disasters on internet infrastructure, and techniques to investigate the chronological dynamics of the outage and restoration. The USC Lander datasets will provide required reference information on normally reachable hosts/networks for the study and targeted analysis of these large-scale Internet outages.Note that this request is for the same datasets requested in earlier requests (id 8061 and 6800).",,,,
"These census, history and hitlist datasets provide reference information about reachable hosts and network, useful in several CAIDA studies, such as the analysis of network outages.",,,,
"The USC Lander datasets provide reference information on normally reachable hosts and networks, useful in various CAIDA studies such as network outages and network congestion.",,,,
"The project is to detecting cyber attack using artificial intelligence, such as clustering, KVM and SVM. The dataset will be used to clustering and training vector machine meanwhile testing training result. ",,,,
"Sorry to submit two separate request. As a new user, I apologize for the trouble. The same as my first request, basic purpose of the project is to look into clustering application in DDoS amplification. I'm mainly focusing on DNS amplification, but according to several papers similar amplification strategy can be used in NTP, SMTP and P2P. The dataset will be used to find special feature of attack traffic and cluster them with those features. It may help us to detect an attack from legal traffic. This request is for another two protocols I mentioned: NTP and SMTP",,,,
"Basic purpose of the project is to look into clustering application in DDoS amplification. I'm mainly focusing on DNS amplification, but according to several papers similar amplification strategy can be used in NTP, SMTP and P2P. The dataset will be used to find special feature of attack traffic and cluster them with those features. It may help us to detect an attack from legal traffic. ",,,,
We are working on Data Analytics Cyber Security project. The main goal of this project is to analyze the data to prevent cyber security threats. We use this data to analyze the various scenarios possible with this threats.,,,,
"The research project is about using multilevel memristors for hashing. This is a purely academic research project, and the data will be used to simulate hashing in an internet router.",,,,
Abstract: Large scale attack traffic present challenges identifying and classifying attack behaviors. Offline host and flow clustering attempt to group similar behaviors in order to expedite analysis. The goal of this research is to move such clustering online and generate attack models. The NCCDC logs will be mined for observables in order to cluster and produce the models.,,,,
To improve the visualization and processing of CAIDA's ITDK.,,,,
"This data set request revolves around the detection of anomalies in NTP traffic using advanced ideas in unsupervised machine learning.   In particular, we propose to use algorithms such as robust principal component analysis and manifold learning to assess the normal background state of a computer network and thereby detect sparse, anomalous departures from that ambient background.  The requested data will form a foundation for the development and validation of our algorithmic approaches.",,,,
"The goal of my research is to use ideas such as Robust Principal Component Analysis and Manifold learning for the detection of anomalies in network traffic.  This data will allow the testing of these ideas on synthetically generated data.Key objectives include the detection of anomalies that are indicative of network attacks.",,,,
"Study the economic impacts of protests. In order to do this we need high frequency data on economic activity and we believe internet traffic is a good proxy for this. The idea is to assess what are the economic consequences of protest and how people adapt to it.  For example, do people compensate for days lost (because of protests) overworking days before or after? How do governments (or other parties) react to protest depending on the extent of the protest and its impact on economic activity. ",,,,
The goal of the task is to extract features and develop a machine learning method that will be able to categorize passive DNA data into benign and malicious.  ,,,,
I would like to use this dataset to help me in executing network intrusion detection system that has the capabilities of dealing with imbalanced data between the normal and abnormal behaviour and the dealing with dynamic profiles to each the future traffic using the on-line statistics methods. ,,,,
"I am working on an Internet Oracle that will predict paths based on observed traceroutes. To do this, I need to collect a data set that targets a moderate number of destination hosts from a set of traceroute vantage points. I would like to issue a traceroute to each BGP atom. The hitlist will be used to choose likely responsive host within each BGP atom. ",,,,
I would like to use this dataset to analyze the raw data for a Statistics class.  I hope to find some trends and correlations that I can use as the foundation for my dissertation in Cyber-Security.  Eventually I would like to show that a security analyst can use passed malware trends to predict future malware attacks.,,,,
"DDoS classification for our CS194-16 Data Science course.  We would like to be able to successfully classify different types of DDoS attacks given characteristics of packet traces within a given time period, which can help in mitigating such attacks.",,,,
