reason,type,keyWord,,
"I am currently working on developing a  framework that enables American Indian Tribes to easily collect and analyze data regarding broadband coverage on reservations that could be used as part of the application for FCC grant funding for broadband and telecom build-out.  I would like to use this data to establish finer-grained patterns in diurnal Internet usage in Tribal areas in the United States. This would be used as motivation for research into Tribal broadband development, as it is expected to show daily usage patterns similar to those observed in developing and low-GDP areas. ",,,,
The data will potentially be used for a research funded by the Distributed Analytics and Security Institute at Mississippi State University. The purpose of the research is to develop innovative methods and tools to better understand and defend against phishing attacks.  ,,,,
"We are a group of undergraduates at UPenn who are doing research into data visualization, especially with regards to anomaly detection. We have a full research proposal if requested.",,,,
"We are interested in information visualization, particularly with respect to anomalies in large data sets. We plan to use open source software to do the analysis and front-end, and just need sample data to get started with our tests. We have a full research proposal available if desired.",,,,
"Study the economic impacts of protests. In order to do this we need high frequency data on economic activity and we believe internet traffic is a good proxy for this. The idea is to assess what are the economic consequences of protest and how people adapt to it.For example, do people compensate for days lost (because of protests) overworking days before or after? How do governments (or other parties) react to protest depending on the extent of the protest and its impact on economic activity.We intend to combine the internet address survey reporbing data with maxmind geolite database(http://dev.maxmind.com/geoip/geoip2/geolite2/) to get the number of active IP addresses in a region.",,,,
"Project abstract:The rise of Cloud computing is being driven by the need to access content and services on any device. With the migration of access networks to all-IP and the growing trend of SDN-enabled networks, a shift in network architecture has begun that allows opportunity for a unified security architecture. This project proposes the design and creation of this architecture, comprised by a set of virtualized integrated network edge functions, that can provide early attack mitigation and protection against coordinated attacks originating across a diverse set of networks. Our approach simplifies and improves overall security for both Cloud and access networks. The dataset will be used to test our detection algorithms.",,,,
"My research project is about using situation awareness in cyber security domain. The goal of this project is to identify the relevant information that are sufficient to describe the attack. So I need some data, which includes both normal network packages and attacks. ",,,,
This request for the IP histlist data is for the use of this data in the iPlane project (http://iplane.cs.washington.edu). The IPs in this hitlist will be used as the targets for iPlane's probes.,,,,
This data will be used to develop a research paper on cyber security that will be submitted to the Journal of Information Systems.,,,,
To analyze cybersecurity for a potential publication in the Journal of Information Systems ,,,,
"I'm working on the study of pattern detection of different types of traffic. The goal is to identify and model specific behavior patterns for different users (or activities) in the system. I'd like to compare the models collected from users on each year of the competition and see how/if they evolve. ",,,,
"C3E challenge problem - Malware discovery",,,,
"Taking into account and managing risk perception is a major aspect of successful risk management. After all, many safety interventions ÃƒÂ¢Ã‚â‚¬Ã‚â€œ like cancer screenings or keeping computer software up-to-date ÃƒÂ¢Ã‚â‚¬Ã‚â€œ depend on the participation of the public for success.      There have been numerous studies on the relationship between actuarial risk and risk perception. It is well documented that risk perception and actuarial risk are not often aligned. For example, people perceive risks they dread or take involuntarily as more severe than others, so that skiing or plastic surgery are experienced as much less risky than they actually are.      For cyber security, the relationship between risk perception and actuarial risk is much less well studied. Most studies investigate how risk perception impacts behavior, e.g., to bank and shop online.     This study would shed light on the origins of risk perceptions rather than its consequences by combining data on actuarial risk with data from risk perception surveys in several countries. The PREDICT database would provide data on the actuarial risk, i.e., the frequency of various types of cyber-attacks. A simple regression analysis would reveal, whether people in countries suffering more attacks or in countries from which more attacks originate are more concerned about cybersecurity.     If there is a large gap between actuarial risk and risk perception ÃƒÂ¢Ã‚â‚¬Ã‚â€ù i.e., if people feel safe when they should not-, policy to manage cyber risk perception and to boost participation by the public in keeping computer systems safe is urgently needed. If there is no such gap, policymakers should try to benefit from the publicÃƒÂ¢Ã‚â‚¬Ã‚â„¢s awareness in order to develop cost-efficient cyber risk management efforts.  ",,,,
C3E challenge problem,,,,
Abstract: Large scale attack traffic present challenges identifying and classifying attack behaviors. Offline host and flow clustering attempt to group similar behaviors in order to expedite analysis. The goal of this research is to move such clustering online and generate attack models. The Skaion sensor alerts will be mined for observables in order to cluster and produce the models.,,,,
Abstract: Large scale attack traffic present challenges identifying and classifying attack behaviors. Offline host and flow clustering attempt to group similar behaviors in order to expedite analysis. The goal of this research is to move such clustering online and generate attack models. The DShield sensor alerts will be mined for observables in order to cluster and produce the models.,,,,
The motivation of the project is to develop a comprehensive system that will capture the Internet topology at fine granularity and periodically provide snapshots of the Internet backbone. The mapping system will then be utilized to investigate topological characteristics of the Internet and provide an underlay for applications to optimize their communications. Compared to the existing Internet topology measurement platforms.,,,,
need the dataset to test a new algorithm for attack detection,,,,
This work is in connection with the challenge problem for the C3E workshop - sponsored by SCORE. We will investigate recognizable patterns in DNS records for malware detection. ,,,,
Evaluation of large scale anomalies using information distance metrics.,,,,
"This research project focuses on using a cutting-edge graph database, STINGER (stingergraph.com), and proprietary analysis algorithms to find anomalous or interesting patterns of network access. We plan to use Netflow data to build a graph of connection activity which will store the protocol, port, length of connection, amount of bytes transferred, and any other relevant attributes for each connection. We will then use graph analytics to detect anomalous behavior, centers of gravity, and common network paths. We also want to determine how the network flows differ depending on protocol. In addition to static analysis of the complete graph, we plan to playback the Netflow data to build the graph in ""real time"" and perform streaming analysis. Overall, we wish to perform these analyses in anticipation of detecting interesting, anomalous, or malicious behavior on a high-throughput network in real time.",,,,
Our goal is to detect DDoS attacks using clustering techniques and principal  component analysis. We need multiple timeseries in order to achieve this. Our initial analysis involves post forensic analysis of the data sets. We would also like to explore real time detection using the findings of this analysis.,,,,
Network and Information Processing,,,,
I would like to get the data in order to research malware detection techniques for the 2014 C3E workshop.  This database was identified as useful for the challenge problem.  The results of my team's analysis of the data will be presented at the workshop this October (2014).,,,,
"We are now research into high performance traffic classification using feature decomposition and utilize parallel computing. Also we want to detect abnormal behavior of traffic flow. Please provides us this valuable dataset. Thank you! ",,,,
We are now research into high performance traffic classification using feature decomposition and utilize parallel computing. Also we want to detect abnormal behavior of traffic flow. Please provides us this valuable dataset. Thank you! ,,,,
We are researching into a highly performance traffic classification algorithm that can also detect abnormal condition of the traffic flow using features decomposition to boost performance. Please provide us DoS data set to train our algorithm. Thank you!,,,,
Conducting traceroutes to inspect the average number of AS hops from a cloud service provider to other Internet prefixes. Using the hitlist to determine the best IPs to direct the traceroutes towards.,,,,
 the purpose of requesting this dataset is to use it in a research project about flow-based intrusion detection. The purpose of this research project is to utilize semantics and context in intrusion detection,,,,
This data will be used by Georgia Tech CyberSecurity operations as a feed into various operational tools to help better protect the Georgia Tech users and data.,,,,
"We consider the problem of large scale multiple testing for data that have spatially clustered signals. With this structure, we apply techniques from change-point inference and propose a boundary detection algorithm so that the spatial clustering information can be utilized. We show that by exploiting the spatial structure, the precision of a multiple testing procedure can be improved substantially",,,,
"We are working under an NSF grant to produce a map of the Internet backbone. We will use this data in developing our own database, along with data on A.S. relationships. Thanks for your help!",,,,
"I will be directing my focus to this resource of data for a independent study in the Computer Science of my university. I must understand data format, structure, and domain knowledge.",,,,
"Our dependence of the internet has grown much faster than our understanding of its underlying strucure, global dynamics, operational threats, and overall health. Large-scale internet service disruptions due to malware and/or politically motivated activities occur with some regularity.We have developed a methodology that uses dark space data from the UCSD Network Telescope, that identifies networks affected by an outage, and determines what techniques are used to cause deliberate disruption. We obtain metrics to quantitatively gauge the geographic and topological extent of the impact of geophysical disasters on internet infrastructure, and techniques to investigate the chronological dynamics of the outage and restoration.The USC Lander datasets provide reference information on normally reachable hosts/networks for the study and targeted analysis of these large-scale internet outages.This request is a follow-up to requests submitted in April and November 2013. If possible, we request that standing access is granted to future census hitlist, history and census datasets for the USC Lander West monitor (i.e. the it##w sequence of datasets).",,,,
Look to mine spam for malicious URLs and other indicators to more proactive identify malicious infrastructure for remediation.,,,,
Using the data to analyze for patterns to more proactively identify use of DNS in malware.,,,,
The goal of this project is to determine which domains/networks have previously been involved with hosting malware activity with the overall intent that this will be anther input source into our project that is trying to determine the overall reputation of various networks on the Internet.  The information will be aggregated up from individual IP addresses to higher level aggregations such as prefixes/ASes or even organizations.,,,,
"Helping federal civilian government organizations fuse and prioritize indicator sets as well as create improved situational awareness of intruder  activity, and enrich publications to advance the state of practice in Internet security analysis.",,,,
"The goal of this research is to determine a better estimate of the number of active hosts in a given prefix.  Our current approach to network reputation simply looks at the entire size of the prefix which gives us a lower-bound on the intensity of malicious activity (most mild estimate).For example we might detect x fraction of a prefix to be malicious but in reality it might be worse as the entire prefix might not actually be used.",,,,
Our research project studies network outages using a different set of methods.  Our goal in using this data is to compare and validate.,,,,
We plan to use Internet census data to study measurement dataset biases.,,,,
Our project studies network reliability semicolon we intend to use this data to compare and validate our separate measurement technique.,,,,
We perform anomaly detection on big communication data.,,,,
Working on Internet Measurement Project (NSF funded) for Dr.Mehmet Gunes at University of Nevada - Reno. I am a student. I am woking on software to parse and sort measurement data for our project.,,,,
"This data is part of the NCCDC competition. This data contains custom malware used by the red team as well as numerous uses of metasploit and potentially data relevant to mapping out red team pivoting between compromised machines. This project aims to understand the red team.The goal of this project is to extract custom malware, fingerprint it, and the traffic it creates.",,,,
"The research is related to network topology modeling and mapping, and its purpose is ""achieving a Subnet level map"" and ""studying characteristics of Subnets"" by using most recent dataset of subnets.In Detail, after sampling subnets in target domains, we will estimate their global characteristics and derive proper estimators for various subnet characteristics.",,,,
Model behavior profile for anomaly detection,,,,
"Our dependence on the Internet has grown much faster than our understanding of its underlying structure, global dynamics, operational threats, and overall health. Large-scale internet service disruptions due to malware and/or politically-motiviated activities occur with some regularity.We have developed a methodology, using dark space data from the UCSD Network Telescope, that can identify the networks that are affected by an outage, and can determine what techniques are used to cause a deliberate disruption. We have developed metrics to quantitatively gauge the geographic and topological extent of the impact of geophysical disasters on internet infrastructure, and techniques to investigate the chronological dynamics of the outage and restoration.The USC Lander datasets will provide required reference information on normally reachable hosts/networks for the study and targeted analysis of these large-scale Internet outages. This request is a follow-on to a request submitted in April 2013 (title: Strategies for combining heterogeneous datasets for the characterization of network outage events).",,,,
Apply the use of entropy for paramter selection for intrusion detection. Entropy is calculated for the different parameters presented and algorithms applied to select the most relevemt parameters to detect different classes of attacks.,,,,
"Analyzing the statistical characteristics of cyber threats as exhibited by Georgia Tech's sinkhole data. This datasets are complementary to the other datasets that my research team has been analyzing.",,,,
"We are performing a longitudinal study of malware population across the Internet, trying to understand what are the most/least infected regions and investigating trends over time. We will compare/integrate data from different sources and aggregate data at AS level or at country/city level through IP geolocation.",,,,
"We consider the problem of efficient online anomaly detection in computer network traffic. The problem is approached statically, as that of sequential change-point detection. A multi-cycle setting of quickest change detection is a natural fit for this problem. We propose a novel score-based multi-cyclic detection algorithm.As a case study, we are going to verify our algorithm using network traffic with maliciousness embedded. ",,,,
"Characterize scanners of IPv4 address spacebased on what shows up in darknet address space.We plan to compare what we see in a large (/8) darknet in this data with our own small internal darknets.",,,,
"Firewalls are the primary security devices in cyber defense. Yet, the security of firewalls depends on the quality of protection obtained by the firewall policy hardening.The lack of metrics and attack incident data make measuring the security of firewall policies a challenging task. This requires defining a set of objective metrics to measure and to compare quality of protection of firewall policies objectively.This research project intends to propose a new set of quantitative metrics that can be used to measure and to compare the security level of firewall policies in an enterprise network. The presented metrics should be proven to be (1) valid as compared with the ground truth, and (2) practically useful as each one implies actionable security hardening. ÃƒÂ¢Ã‚â‚¬Ã‚Å“DShield dataset ÃƒÂ¢Ã‚â‚¬Ã‚Å“ will be used to show that the implementation and usability of these metrics are attainable and affordable.",,,,
"I am doing research on different types of attacks, and I would like to find a way to develop cyber resilience framework, including prevention, sustainment, and recovery.",,,,
"Our dependence on the Internet has rapidly grown much stronger than ourcomprehension of its underlying structure, global dynamics, operationalthreats, and overall network health. Wide-scale Internet service disruptionsand even politically motivated interference with Internet access in orderto hinder anti-government organization are not new.We have developed a methodology, using dark space data from the UCSD NetworkTelescope, that can identify which networks are affected by an outage, andwhich techniques are used to effect a deliberate disruption. We have alsodeveloped metrics to quantitatively gauge the geographic and topologicalextent of the impact of geophysical disasters on Internet infrastructure, andtechniques to investigate the chronological dynamics of the outage andrestoration.The USC Lander address history and hitlist datasets will provide referenceinformation on normally reachable hosts/networks for the study and targetedanalysis of these large-scale Internet outages.",,,,
This research is concerned with the design and analysis of statistical methodology for rapid intrusion detection in cybersecurity. Real data are needed to validate the proposed algorithms.,,,,
"The basis of the research is to study the feature of various network flows and use the parametric estimation method and fitting test to find the difference between the flows in their distribution and parameters. But what we have got now is not sufficient for the statistical research. More dataset , especially the DoS/DDoS attack ones, are need to go on. We would apply for three datasets: Dos 80-20110715, UniformnAttack Traces Generated20070821-20041202 and UniformAttack traces-20070115.DoS 80-20110715 is used to study DoS attack with background traffic. UniformnAttack Traces Generated20070821-20041202 and UniformAttack traces-20070115 are used to study the same uniform attack with different background traffic. We will use statistical software such as Matlab to get the statistical characteristics and then more researches will be done. We will be appreciated if our request are approved.",,,,
"This dataset will be used to test anomaly detectors of observed DNS activity, particularly fluxing. ",,,,
"We want to develop module for DDoS attack detection. In particular, we want to test existing DDoS detection tool such as Snort on this dataset.",,,,
The research is focused on private sector funding for information security.  Are businesses allocated sufficient resources to information security to combat the growing number of cyber attacks?  The requested data will be used to create trends in the quantity of attacks over time.,,,,
"In this project, we aim to study internet traffic  and detect what indicators could help in identifying security incidents. We are interested in using this dataset to craft a profile of baseline traffic in absence of incidents.",,,,
"This work is part of CAIDA's SaTC project (""Detection and analysis of large-scale Internet infrastructure outages"") funded by NSF.  All work will be conducted at CAIDA, UC San Diego.          http://www.caida.org/funding/satc/This project will result in an experimental operational deployment to validate and extend an empirically-grounded methodology for detection and analysis of large-scale Internet outages. In addition to improving our understanding of how measurements yield insights into network behavior, and strengthening our ability to model large scale complex networks, use of such a system will also illuminate infrastructure vulnerabilities that derive from architectural, topological, or economic constraints, suggesting how to mitigate or eliminate these weaknesses in future Internet architecture and measurement research. A deployed platform will be able to detect and monitor connectivity disruption and censorship events on a planetary scale thus enabling situational awareness of the nature and causes of network outages to national decision-makers who must determine the type and extent of proper response.We need a set of known responding destinations so that we can regularly probe them to determine outages caused by Hurricane Sandy and other causes.",,,,
"For purposes of our research, we propose to use this data to study abnormalities in network activity. An abnormality in network activity/traffic flow is determined by an unusual shift or increase from the base probability between two givennodes. The objective of this study is to understand and define the normal occurrence of activity on a network using ascanning approach, in order to be able to detect any anomalies or groups of anomalies (an anomalous window) in thetraffic flow and how it related to particular topology of nodes in the network. The contributions of this study are directed towards providing new insights on the issue of cyber security, particularly from a data mining perspective.",,,,
"For purposes of our research, we propose to use this data to study abnormalities in network activity.  An abnormality in network activity/traffic flow is determined by an unusual shift or increase from the base probability between two given nodes. The objective of this study is to understand and define the normal occurrence of activity on a network using a scanning approach, in order to be able to detect any anomalies or groups of anomalies (an anomalous window) in the traffic flow and how it related to particular topology of nodes in the network. The contributions of this study are directed towards providing new insights on the issue of cyber security, particularly from a data mining perspective.",,,,
