reason,type,keyWord,,
"The motivation of the project is to develop a comprehensive system that will capture the Internet topology at fine granularity and periodicallyprovide snapshots of the Internet backbone. The mapping system will then be utilized to investigate topological characteristics of the Internet andprovide an underlay for applications to optimize their communications. Compared to the existing Internet topology measurement platforms, thesystem will (i) build Internet topology graphs with higher accuracy as the system integrates several mechanisms to efficiently handle large-scalemeasurement data; (ii) work at higher level of granularity by providing backbone topology maps at link layer; (iii) periodically release annotatednetwork topologies in addition to the raw measurement data so that the community can utilize them in their experiments and optimize networkcommunications; (iv) help in understanding Internet topology dynamics and providing network enhancements; and (v) provide a graph indexing toolto process and analyze large-scale networks. In particular, we will be using the IP addresses discovered(actively responding to the ICMP calls) in thisdataset as feed to our probing system to further expand our target range in our measurement campaign. Web Page of our project can be found inthis link: im.cse.unr.edu",,,,
Attempting to leverage modern classification techniques to attempt to predict DoS attacks.,,,,
Large-scale ELK analysis of network security traffic.  Identification of behavioral trends that can be used to enhance defenses.,,,,
Internal ICMP_ECHO_REPLY comparison with GT-based IPv4-wide ping sweep.,,,,
Requesting an update on the previous data obtained to better understand regional physical infrastructure of the Internet,,,,
"Hi, I'm working on big data visualization and pattern recognition, from a cybersecurity perspective. Your dataset would help me research proper patterns to help identify threats.",,,,
I'm working on a big data visualization tool and this dataset would help my work in identifying data visual patterns. Thank you!,,,,
Need to do a cross domain privacy sharing predictive analysis based on different times.,,,,
Need to do a cross domain privacy sharing predictive analysis.,,,,
To test a DDoS detection technique.,,,,
"The motivation of the project is to develop a comprehensive system that will capture the Internet topology at fine granularity and periodically provide snapshots of the Internet backbone. The mapping system will then be utilized to investigate topological characteristics of the Internet and provide an underlay for applications to optimize their communications. Compared to the existing Internet topology measurement platforms, the system will (i) build Internet topology graphs with higher accuracy as the system integrates several mechanisms to efficiently handle large-scale measurement data; (ii) work at higher level of granularity by providing backbone topology maps at link layer; (iii) periodically release annotated network topologies in addition to the raw measurement data so that the community can utilize them in their experiments and optimize network communications; (iv) help in understanding Internet topology dynamics and providing network enhancements; and (v) provide a graph indexing tool to process and analyze large-scale networks.In particular, we will be using the IP addresses discovered(actively responding to the ICMP calls) in this dataset as feed to our probing system to further expand our target range in our  measurement campaign.Web Page of our project can be found in this link: im.cse.unr.edu",,,,
"Our dependence of the internet has grown much faster than our understandingof its underlying structure, global dynamics, operational threats, and overallhealth. Large-scale internet service disruptions due to malware and/orpolitically motivated activities occur with some regularity.We have developed a methodology that uses dark space data from the UCSDNetwork Telescope, that identifies networks affected by an outage, anddetermines what techniques are used to cause deliberate disruption.We obtain metrics to quantitatively gauge the geographic and topologicalextent of the impact of geophysical disasters on internet infrastructure,and techniques to investigate the chronological dynamics of the outageand restoration.The USC Lander datasets provide reference information on normally reachablehosts/networks for the study and targeted analysis of these large-scaleinternet outages",,,,
"Our dependence of the internet has grown much faster than our understandingof its underlying structure, global dynamics, operational threats, and overallhealth. Large-scale internet service disruptions due to malware and/orpolitically motivated activities occur with some regularity.We have developed a methodology that uses dark space data from the UCSDNetwork Telescope, that identifies networks affected by an outage, anddetermines what techniques are used to cause deliberate disruption.We obtain metrics to quantitatively gauge the geographic and topologicalextent of the impact of geophysical disasters on internet infrastructure,and techniques to investigate the chronological dynamics of the outageand restoration.The USC Lander datasets provide reference information on normally reachablehosts/networks for the study and targeted analysis of these large-scaleinternet outages",,,,
Examining how certificates for the same site differ depending on where the client is located,,,,
"Hi, We are designing an anomaly detection system (on the victim side) for NIST. This dataset will be analyzed to capture the behavior of DoS attack for our research.Thank you!Best,Kang-Hao PengThanks!Kang-Hao Peng",,,,
We are designing an anomaly detection system (on the victim side) for NIST. This dataset will be analyzed to capture the uniform attack behavior for our research. ,,,,
"This data will be used to test new visualization tool for big data that I am currently researching at CMU, using a modified directed forced graph, whose (ultimate) purpose is using visual pattern recognition in aiding in cybersecurity threat detection and pattern recognition. The point behind it is to visualize the data in a way that conveys more information than what a text based medium could. I need this particular data to test specific cases and see how can the visualization be improved.",,,,
"This data will be used to test new visualization tool for big data that I am currently researching at CMU, using a modified directed forced graph, whose (ultimate) purpose is using visual pattern recognition in aiding in cybersecurity threat detection and pattern recognition. The point behind it is to visualize the data in a way that conveys more information than what a text based medium could. I need this particular data to test specific cases and see how can the visualization be improved.",,,,
"Conducting undergraduate research regarding IoT botnet behavior. Attempts to use a series of tools and methods, (such as multiresolution analysis), in order to determine the extent to which Mirai botnet behavior is detectable. Also interested in extending this behavior to similar IoT botnets, that are derivations of Mirai (possibly with extended capabilities). ",,,,
Will use the dataset to study the pattern of the flow in attack and then compare it with the pattern seen for normal datasets.,,,,
"Government funded research to benefit humanitarian aid and disaster relief community. Looking to see if we can correlate changes in network host reponsiveness with power outages/loss of communications infrastructure.",,,,
"Government funded research to benefit humanitarian aid and disaster relief community. Looking to see if we can correlate changes in BGP data with power outages/loss of communications infrastructure.",,,,
Government funded research to benefit humanitarian aid and disaster relief community. Looking to see if we can correlate changes in BGP routing data with loss of power/communications infrastructure.,,,,
need to analyse the dataset to obtain a pattern in attack flow to conduct the experiment and write a paper.,,,,
"Hello,I am a research assistant of Professor Richard La in University of Maryland - College Park. We are interested in the anomaly detection of network traffic. We need the CAIDA dataset to correctly model the DDoS behavior in our aggregate traffic thus improve our system's performance. Thank you.Sincerely,Kang-Hao Peng",,,,
"As a presenter at the Florida Academy of Sciences (FAS) conference 2017 to be held in March, I am conducting experiments in netflow classification. My research is intended to provide benchmarks for researchers in the cybersecurity community regarding the use of three data mining algorithms. Specifically, the title of my presentation is ""A Comparison of Performances of ID3, Random Forest, and One-R in the classification of Netflow data"" For information on FAS, please visit http://www.floridaacademyofsciences.org/.",,,,
Government funded research to benefit the humanitarian aid and disaster relief community. Looking to see if we can correlate reduction in/absence of this kind of network traffic with power outages/loss of communications infrastructure after a disaster.,,,,
Government funded research to benefit humanitarian aid and disaster relief community. Looking to see if we can correlate reduction in this type of network traffic with power outages/loss of communications infrastructure.,,,,
I will study the relationship between access to the Internet and proximity to Internet infrastructure using an instrumental variables procedure for my academic research.,,,,
Seeking to study new relationships between proximity to fiber line cables and access to Internet services using instrumental variable regression techniques for my academic research.,,,,
"I have several aspirational uses for this data:(1) Graph analytics (degree distribution, clustering coefficient, degree centrality, PageRank, etc.) on DoS log data. (2) Use the graphs and analyses from (1)  -- in the form of matrices -- to train a neural network (a common feed-forward NN at first, then perhaps a convolutional NN) to recognize DoS attacks.(3) Compare the ""ML on graphs"" approach from (2) to the more traditional ML on raw log data approaches.(4) Compare the NN approaches of (2) and (3) with other ML techniques: SVM, decision trees, regressions, etc.(5) Static Data Quality measures on this data. (DQ is a vague field, but I'm going to try to make it more precise for real-world use cases.)(6) Dynamic Data Quality measures of this data, as it is a time-series. (DDQ is brand new!)",,,,
Doctorate Research GWU security event identification within companies. ,,,,
Use for doctorate research GWU in regards to security event identification.  ,,,,
"DSHIELD and GT Malware will be used to build and test a Security Analytics project, ",,,,
"DSHIELD and GT Malware will be used to build and test a Security Analytics project,",,,,
To train classifiers for attack detection ,,,,
We will perform time series analyses with this malware data. ,,,,
Will correlate events in cyber security data with known events of interest in service of research on non-traditional indirect indicators and warning,,,,
Develop predictive models of cyber attacks for the IARPA CAUSE program,,,,
Need to recreate results from the SIGCOMM paper that uses this data ,,,,
I am measuring analyst performance shutting down a DOS attack and a APT attack through the Splunk Enterprise. This serves as my DOS attack unless you suggest a better one. Next I will request the APT attack.,,,,
Evaluate new statistical approach for modeling conficker worm in my research,,,,
"I am doing a project on DDoS detection for my Network Forensics class at John Jay College.  At the moment I'm comparing the 2007 DDoS dataset from CAIDA with their 2016 network trace, using a variety of analysis tools.  The purpose of the project is to hypothesize criteria for finding (or finding suggestions of) DDoS traffic or botnet recruitment.  So far I'm primarily using self-written Python scripts to process .pcaps, and SiLK for flow data.  ",,,,
"We are studying query volume and replica selection anomalies associated with the d-root name server and would like to integrate broader statistics to determine whether events observed in samples of d-root also appear more broadly, or conversely, whether events occur but are missed by our approach or data.  We expect that routing information may explain replica selection anomalies and traffic volume shifts.",,,,
This data will be used for academic research on statistical inference for cyber attacking patterns over time and over IP addresses. ,,,,
"I am trying to build a simulation model for cyber-attacks, primarily network based attacks. I am going to use the dataset to verify the simulation results.",,,,
I plan to use the data to create simulation model to test different types of cyber-attacks.,,,,
"We want to study the dataset and build a Machine Learning based model to detect malicious traffic. How we can avoid the false alarm conditions and a really really fast model. In real time, we have to take decision promptly. After receiving the dataset we can analyze and construct features from it.",,,,
Import in the Splunk lookup for ip tagging purposes. Thank you. Splunk queries limited to the team of 4.,,,,
To investigate spam campaigns from malware,,,,
"Re: DSR-158We plan on building on the work in ÃƒÂ¢Ã‚â‚¬Ã‚Å“Day After Patch Tuesday Effects Observable in IP Darkspace TrafficÃƒÂ¢Ã‚â‚¬Ã‚Âù (Tanja Zseby, Alistair King, Nevil Brownlee, and K. C. Claffy, 2013) by expanding the focus to a comparative analysis of other network facing software, as well as moving towards a different statistical approach (Net increase in traffic, rather than increased unique source IPs).We plan on analyzing the difference from the mean traffic on that day of week for the affected protocol. Ãƒâ€_Ã‚Â We will use the ÃƒÂ¢Ã‚â‚¬Ã‚Å“Patch Tuesday DatasetÃƒÂ¢Ã‚â‚¬Ã‚Âù, normalized based on standard traffic for that weekday and other factors, such as simultaneous patching, to endeavor to sort which service patches lead to the largest increase in traffic.",,,,
"We are studying RR support on the internet.  We begin by sending an RR ping to a hitlist destination for each BGP prefix.  For prefixes whose hitlist IP does not respond, we need other historically active IPs to ping.  For larger aggregates (e.g. /16) we can choose other hitlist destinations, however for /24 networks, we need other candidates.",,,,
for investigating internet-wide scanners.,,,,
I will use this data set as a base for my project for  the course(Quantitative Methods and Experimental Design in CS ) . I will apply quantitative analysis methods on this set and build statistical profile for anomaly and normal traffic,,,,
This dataset would be used as a basis for generating an extensive inter-AS connectivity map (with a city granularity) for the US. This dataset is needed since it outlines the fiber infrastructure of the US and could facilitate in creating this map.,,,,
I will use this data set as a base for my project in the course(Quantitative Methods and Experimental Design in CS ) . I will apply quantitative analysis methods on this set.,,,,
Discover previously-unknown amplification vulnerable UDP protocols,,,,
"Two fold:1) To develop a course for graduate students on the use of big data and machine learning techniques to identify performance and network anomalies.2) To develop machine learning techniques to identify performance and network anomalies and to categorize them.",,,,
The data will be used in an ongoing study on the current state of IPv4 Record Route support on the internet.  Selected addresses will be pinged with RR packets to asses the responsiveness and reachability from our vantage points.,,,,
The data-set will be used in an empirical study to improve classification performance of different algorithms by alleviating data quality challenges (e.g. Class imbalance),,,,
"Only internally as test data for the algorithms we developed. We have some recent results hopefully can be used to identify suspicious sequences of events, which we would like to have some realistic data to test on, in order to verify the ideas. ",,,,
Research improves cyber-security.,,,,
We are interested in enriching our monitoring infrastructure with DNS data from malware datasets. These network IOCs can be tagged in our sensors for followup.,,,,
We will use it to validate our findings about biases of passive observation,,,,
Research project for DDoS Detection,,,,
Graph mining research,,,,
Data will be used in our IDS model.,,,,
It will be used as a test data set for testing our IDS model,,,,
for the education of the faculty member,,,,
We're researching alternate paths/locations for our disaster recovery/business continuity program.,,,,
Investigating Internet-wide Scanners,,,,
Conduct network research and data analysis to identify new methods for communicating in an emerging technical environment. Develop and test algorithms that may be applied to additional data sets.,,,,
DDoS detection/mitigation algorithm research.,,,,
DDoS detection/mitigation algorithm research,,,,
"I am part of a project group that is exploring the potential of an adaptive, distributed DDoS detection system.  To test our system, I plan to make use of the tools available for replaying attack traffic within DeterLab (http://deter-project.org/about_deterlab).  For this reason, I am seeking access to publicly available DDoS datasets, and particularly those that involve packet data.",,,,
Evaluate the performance of a SDN architecture for research purposes,,,,
Project looking at the effects of cable connection on political outcomes in West Africa.,,,,
We will use this dataset to test our attack detection tool,,,,
We will test our attack detection tool on this dataset,,,,
We will test our attack detection tool with this dataset,,,,
learning/testing of IDS system,,,,
Project looking at the effects of the Internet on political participation,,,,
Project looking at the effects of the Internet on political participation in the US,,,,
Working on a research paper which is an extension of other papers my team has worked on with this particular data set.,,,,
The data will be used for research purposes. The research aims to find a way to detect and mitigate attacks with a network based attack vector in a cloud environment,,,,
Training/Testing for DDoS detection algorithm,,,,
The data will be used to study malware activities targeting various locations over the world. ,,,,
The data will be used to create a more realistic attack source topology for a DDoS defense simulation study. Only the source IP or source prefix will be used.,,,,
The data will be used for purely research purposes. Our Research aims to detect attacks which have a network based vector and develop methods to mitigate the damage.,,,,
I am working with Michael Kallitsis on a data mining competition for U-M graduates.  The data are to be used in that effort.,,,,
We would like to use the DNS dataset for malware research.,,,,
"The purpose of this data is to act as a source of synthetic data to demonstrate an anomaly detector and data visualization capability in a research conference (CNW 2016) held at MIT Lincoln Laboratory. We intend to (a) run the pcaps in this data set through an IDS system to generate IDS alerts, and (b) process the pcaps to generate netflow records as well as DNS records. These output data will be used as input to a publicly releasable demonstration  of our anomaly detection and data visualization tool. The data sets we normally use, being real as opposed to synthetic, are not releasable. Note that the underlying pcaps which make up the data set will not be disclosed, only IDS alerts, netflows, and DNS records.",,,,
"We have a project that aims to estimate network distance between arbitrary Internet endpoints. For this purpose, we utilize Content Distribution Networks and ENDS0 client-subnet extension (ECS). Our measurement system requires no additional infrastructure to be deployed. The measured endpoints do not need to participate by sending or responding to probes. Our systemfurther generates no load on endpoints. It only queries DNS, whose infrastructure is designed for large loads. In order to validate our system's effectiveness, i.e., its ability to estimate network distance, we would significantly benefit from the requested data set. In particular, we have experienced anomalous behavior that we believe could be resolved by using the requested data set.",,,,
To validate certain statistical anomaly detection methods,,,,
"Our dependence of the internet has grown much faster than our understanding of its underlying strucure, global dynamics, operational threats, and overall health. Large-scale internet service disruptions due to malware and/or politically motivated activities occur with some regularity. We have developed a methodology that uses dark space data from the UCSD Network Telescope, that identifies networks affected by an outage, and determines what techniques are used to cause deliberate disruption. We obtain metrics to quantitatively gauge the geographic and topological extent of the impact of geophysical disasters on internet infrastructure, and techniques to investigate the chronological dynamics of the outage and restoration. The USC Lander datasets provide reference information on normally reachable hosts/networks for the study and targeted analysis of these large-scale internet outages. We have recently developed methodologies based on passive traffic analysis that allow additional insight into whether a given IP network prefix is actively used. We will combine our results with the USC Lander datasets to generate derived datasets that we plan to share through PREDICT. Researchers will be able to use these data sets for similar purposes as the existing USC Lander data sets, e.g., inference of address space utilization. This request is a follow-up to similar requests over the last years. We are only requesting the datasets not covered by these earlier requests.",,,,
"The purpose of the project is to correlate different logs from an enterprise network with the IDS alerts to improve the current state-of-the-art intrusion detection mechanism. But we have not found such logs from an enterprise network that are publicly available. So, the initial idea is to collect the existing datasets which meets a subset of our requirements and check whether those data can be correlated with some other datasets (i.e. botnets, malware DNS requests).",,,,
To validate certain statistical anomaly detection methods.,,,,
To validate certain statistical anomaly detection methods,,,,
To validate certain statistical anomaly detection methods.,,,,
To validate certain statistical anomaly detection methods,,,,
I want to use the data to help verify a new tool that attempts to identify inter-AS link interfaces.,,,,
The dataset is needed to validate certain anomaly detection methods.,,,,
A study of internet infrastructure for an urban focused architectural studio at Yale University.,,,,
"Conducting targeted traceroutes from cloud service providers. The connectivity of large cloud service providers, such as Amazon AWS, will be inferred from traceroutes to the hitlist IPs.",,,,
"Project Proposal: The mission of the UTSA Cyber Security Association is to provide training and professional events for students of the university who are interested in cyber security.In keeping with that mission, we will use the data from the NCCD Competitions to create training for our members on the identification of network attacks on large enterprise networks.The nature of the some of the questions we hope to answer are as follows:How do you select and isolate a signal/flow from the noise of routine network traffic, without direct visualization of the network traffic through Wireshark?How do you determine if a signal/flow is malicious without direct visualization of the network traffic through Wireshark? Does your cybersecurity solution/tool scale across massive amounts of data? ( greater than 1TB).Dataset Choice (Why this data set?):The best penetration testers/researchers in industry, and the best security minded college students are competing against each other.  This presents a rare opportunity to analyze ÃƒÂ¢Ã‚â‚¬Ã‚Å“security principles in practice.ÃƒÂ¢Ã‚â‚¬Ã‚ÂùSince there are multiple teams, each team presents discrete sets of data for analysis of security principles.  Thus we potentially get multiple data points.Since the data is captured from a cyber competition there is a guarantee of ""malicious"" traffic, and this guarantee presents with a data set against which our goals, questions, tools, and potential solutions can be tested.The data set has clear start and finish times, and is relatively short in duration (two days), but is saturated with different types of ""malicious traffic.""The data set is as close to a standard model as a researcher may find ""in the wild.""  That is, the strict rules governing red/blue team actions, and the same equipment/scenarios across multiple teams creates a fairly standardized model from which to conduct research.Final Goal:Create training slides (based on the above statements) for our student members.Thank you,Jose David Mireles",,,,
Review of prior year's competition,,,,
"We are developing a new method of increasing the efficiency of intrusion detection systems.  The request file should be a useful test set.",,,,
