Name,URL,Conf.,Year,Used,Description,Produced,Description,Data,PDF_file_name
The Emperor's New Password Manager: Security Analysis of Web-based Password Managers.,https://www.usenix.org/conference/usenixsecurity14/technical-sessions/presentation/li_zhiwei,uss,2014,No,\,No,\,Non-data,sec14-paper-li-zhiwei.pdf
"LibFTE: A Toolkit for Constructing Practical, Format-Abiding Encryption Schemes.",https://www.usenix.org/conference/usenixsecurity14/technical-sessions/presentation/luchaup,uss,2014,No,\,No,\,Non-data,sec14-paper-luchaup.pdf
When Governments Hack Opponents: A Look at Actors and Technology.,https://www.usenix.org/conference/usenixsecurity14/technical-sessions/presentation/marczak,uss,2014,No,\,Yes,"We searched for the dis- tinctive SSL certificates in two Internet Census service probes, and SSL certificate scans from ZMap|we probed all of the IP ad- dresses that we collected|our fingerprints matched 92 dis- tinct IP addresses in 35 different countries.",Data,sec14-paper-marczak.pdf
Revisiting SSL/TLS Implementations: New Bleichenbacher Side Channels and Attacks.,https://www.usenix.org/conference/usenixsecurity14/technical-sessions/presentation/meyer,uss,2014,No,\,No,\,Non-data,sec14-paper-meyer.pdf
Gyrophone: Recognizing Speech from Gyroscope Signals.,https://www.usenix.org/conference/usenixsecurity14/technical-sessions/presentation/michalevsky,uss,2014,No,\,No,\,Non-data,sec14-paper-michalevsky.pdf
Security Analysis of a Full-Body Scanner.,https://www.usenix.org/conference/usenixsecurity14/technical-sessions/presentation/mowery,uss,2014,No,\,No,\,Non-data,sec14-paper-mowery.pdf
From the Aether to the Ethernet - Attacking the Internet using Broadcast Digital Television.,https://www.usenix.org/conference/usenixsecurity14/technical-sessions/presentation/oren,uss,2014,No,\,Yes,Our analysis was based on the NASA SEDAC Metropolitan Statistical Areas dataset ,Data,sec14-paper-oren.pdf
Preventing Cryptographic Key Leakage in Cloud Virtual Machines.,https://www.usenix.org/conference/usenixsecurity14/technical-sessions/presentation/pattuk,uss,2014,No,\,No,\,Non-data,sec14-paper-pattuck.pdf
X-Force: Force-Executing Binary Programs for Security Applications.,https://www.usenix.org/conference/usenixsecurity14/technical-sessions/presentation/peng,uss,2014,No,\,No,\,Non-data,sec14-paper-peng.pdf
Faster Private Set Intersection Based on OT Extension.,https://www.usenix.org/conference/usenixsecurity14/technical-sessions/presentation/pinkas,uss,2014,No,\,No,\,Non-data,sec14-paper-pinkas.pdf
Optimizing Seed Selection for Fuzzing.,https://www.usenix.org/conference/usenixsecurity14/technical-sessions/presentation/rebert,uss,2014,No,\,Yes,"All seed files gathered for our fuzzing ex- periments (4,912,142 files making up more than 6TB of data) were automatically crawled from the internet us- ing the Bing API. ",Data,sec14-paper-rebert.pdf
DSCRETE: Automatic Rendering of Forensic Information from Memory Images via Application Logic Reuse.,https://www.usenix.org/conference/usenixsecurity14/technical-sessions/presentation/saltaformaggio,uss,2014,No,\,No,\,Non-data,sec14-paper-saltaformaggio.pdf
Cardinal Pill Testing of System Virtual Machines.,https://www.usenix.org/conference/usenixsecurity14/technical-sessions/presentation/shi,uss,2014,No,\,No,\,Non-data,sec14-paper-shi.pdf
Password Managers: Attacks and Defenses.,https://www.usenix.org/conference/usenixsecurity14/technical-sessions/presentation/silver,uss,2014,Yes,we surveyed Alexa Top 500 sites ,No,\,Data,sec14-paper-silver.pdf
Automatically Detecting Vulnerable Websites Before They Turn Malicious.,https://www.usenix.org/conference/usenixsecurity14/technical-sessions/presentation/soska,uss,2014,Yes,"data from PhishTank | From a related measurement project [19], we obtained a list, collected between October 20, 2011 and September 16, 2013, of 738,479 unique links,",Yes,"We randomly sampled the entire .com zone file from January 14th, 2014. ",Data,sec14-paper-soska.pdf
Precise Client-side Protection against DOM-based Cross-Site Scripting.,https://www.usenix.org/conference/usenixsecurity14/technical-sessions/presentation/stock,uss,2014,No,\,Yes,"We used the method- ology applied for our previous paper [18] to collect a set of 1,602 unique real-world DOM-based XSS vulner- abilities on 958 domains. ",Data,sec14-paper-stock.pdf
"The Long Taile"" of Typosquatting Domain Names.""",https://www.usenix.org/conference/usenixsecurity14/technical-sessions/presentation/szurdi,uss,2014,Yes,"we collect registration data from the WHOIS global database. |The Alexa list of the top 1 million sites from March 15, 2013 serves as a benchmark for popularity |we check the typo domains from the .com zone file against twelve different domain name blacklists.",Yes,We collect DNS data to explore the background infrastructure serving these domains. |We use a web crawler to obtain the rendered DOM of each page,Data,sec14-paper-szurdi.pdf
Enforcing Forward-Edge Control-Flow Integrity in GCC &amp; LLVM.,https://www.usenix.org/conference/usenixsecurity14/technical-sessions/presentation/tice,uss,2014,No,\,No,\,Non-data,sec14-paper-tice.pdf
A Bayesian Approach to Privacy Enforcement in Smartphones.,https://www.usenix.org/conference/usenixsecurity14/technical-sessions/presentation/tripp,uss,2014,Yes,"we relied on (i) an extensive study by Hornyack et al. spanning 1,100 top-popular free Android apps |",No,\,Data,sec14-paper-tripp.pdf
Scheduler-based Defenses against Cross-VM Side-channels.,https://www.usenix.org/conference/usenixsecurity14/technical-sessions/presentation/varadarajan,uss,2014,No,\,No,\,Non-data,sec14-paper-varadarajan.pdf
JIGSAW: Protecting Resource Access by Inferring Programmer Expectations.,https://www.usenix.org/conference/usenixsecurity14/technical-sessions/presentation/vijaykumar,uss,2014,No,\,No,\,Non-data,sec14-paper-vijayakumar.pdf
Towards Detecting Anomalous User Behavior in Online Social Networks.,https://www.usenix.org/conference/usenixsecurity14/technical-sessions/presentation/viswanath,uss,2014,No,\,Yes,"We collected three datasets to capture normal user behav- ior. The first dataset is the 719 users that are part of the SIGCOMM [33] and COSN [24] Facebook groups. | For our second dataset, we use the random sampling of Facebook users described in Section 4.1. |A compromise between the two extremes is our third dataset:| We collected data for three types of anomalous behav- iors: fake (Sybil) accounts that do not have any normal user activity|We then used Selenium to crawl the publicly visible data for these users|we crawled the publicly-visible user behavior of the black-market users who liked our pages.|The Yelp dataset consists of all 92,725 Yelp reviewers in the San Francisco area|We collected the publicly visible like and Time- line [34] activity of 13,991 users over the 26 month pe- riod ending in August 2013. |The Twitter dataset consists of a random sample of 100K out of the 19M Twitter users",Data,sec14-paper-viswanath.pdf
Dynamic Hooks: Hiding Control Flow Changes within Non-Control Data.,https://www.usenix.org/conference/usenixsecurity14/technical-sessions/presentation/vogl,uss,2014,No,\,No,\,Non-data,sec14-paper-vogl.pdf
Man vs. Machine: Practical Adversarial Detection of Malicious Crowdsourcing Workers.,https://www.usenix.org/conference/usenixsecurity14/technical-sessions/presentation/wang,uss,2014,No,\,Yes,"We need a base- line dataset of normal users for comparison.|We extract two different baseline datasets.|We extract records of 20,416 crowdturfing campaigns",Data,sec14-paper-wang-gang.pdf
Effective Attacks and Provable Defenses for Website Fingerprinting.,https://www.usenix.org/conference/usenixsecurity14/technical-sessions/presentation/wang_tao,uss,2014,Yes,"We selected our list of 5,000 non- monitored pages from Alexaês top 10,000",Yes,We use a list of 90 instances each of 100 sensitive pages |,Data,sec14-paper-wang-tao.pdf
On the Feasibility of Large-Scale Infections of iOS Devices.,https://www.usenix.org/conference/usenixsecurity14/technical-sessions/presentation/wang_tielei,uss,2014,No,\,Yes,"We collected and built a pas- sive DNS database|We utilized technology provided by Damballa to collect HTTP headers|We obtained DNS traffic from two large ISPs in the US,",Data,sec14-paper-wang-tielei.pdf
TapDance: End-to-Middle Anticensorship without Flow Blocking.,https://www.usenix.org/conference/usenixsecurity14/technical-sessions/presentation/wustrow,uss,2014,No,Alexa top million domains ,No,sample of the IPv4 address space listening on port ,Non-data,sec14-paper-wustrow.pdf
"FLUSH+RELOAD: A High Resolution, Low Noise, L3 Cache Side-Channel Attack.",https://www.usenix.org/conference/usenixsecurity14/technical-sessions/presentation/yarom,uss,2014,No,\,No,\,Non-data,sec14-paper-yarom.pdf
SSOScan: Automated Testing of Web Applications for Single Sign-On Vulnerabilities.,https://www.usenix.org/conference/usenixsecurity14/technical-sessions/presentation/zhou,uss,2014,No,\,Yes,"We analyze the click data collected from the top 10,000 sites |We evaluated SSOScan by running it on the list of the most popular 20,000 websites",Data,sec14-paper-zhou.pdf
Privee: An Architecture for Automatically Analyzing Web Privacy Policies.,https://www.usenix.org/conference/usenixsecurity14/technical-sessions/presentation/zimmeck,uss,2014,Yes,we selected the majority of our policies randomly from the Alexa top 500 websites for the U.S. ,Yes,The database holds a total of 100 training policies.,Data,sec14-paper-zimmeck.pdf
Trustworthy Whole-System Provenance for the Linux Kernel,https://www.usenix.org/conference/usenixsecurity15/technical-sessions/presentation/bates,uss,2015,No,\,Yes,\,Non-data,sec15-paper-bates.pdf
De-anonymizing Programmers via Code Stylometry,https://www.usenix.org/system/files/conference/usenixsecurity15/sec15-paper-caliskan-islam.pdf,uss,2015,No,\,Yes,"We collected C++ source of thousands of contestants| We identified the most important 928 fea- tures out of 120,000|Wecollectedalargerdatasetof1,600programmers",Data,sec15-paper-caliskan-islam.pdf
Protocol State Fuzzing of TLS Implementations,https://www.usenix.org/system/files/conference/usenixsecurity15/sec15-paper-de-ruiter.pdf,uss,2015,No,\,Yes,\,Non-data,sec15-paper-de-ruiter.pdf
Automatic Generation of Data-Oriented Exploits,https://www.usenix.org/system/files/conference/usenixsecurity15/sec15-paper-hu.pdf,uss,2015,No,\,Yes,FLOWSTITCH generates 19 data-oriented attacks from 8 vulnerable programs.,Data,sec15-paper-hu.pdf
Investigating the Computer Security Practices and Needs of Journalists,https://www.usenix.org/conference/usenixsecurity15/technical-sessions/presentation/mcgregor,uss,2015,No,\,Yes,employed in a range of well-respected,Data,sec15-paper-mcgregor.pdf
To Pin or Not to Pin__ÓHelping App Developers Bullet Proof Their TLS Connections,https://www.usenix.org/system/files/conference/usenixsecurity15/sec15-paper-oltrogge.pdf,uss,2015,No,\,Yes,"We found 2,878,454 connections in custom code of which we identified 145,243 as TLS connections|We evaluate the update behaviour of 871,911 unique users|We found cus- tom TrustManager implementations in 42,902 apps|Our data extraction showed that of these apps, 573,258 imple- mented network connections",Data,sec15-paper-oltrogge.pdf
Securing Self-Virtualizing Ethernet Devices,https://www.usenix.org/conference/usenixsecurity15/technical-sessions/presentation/smolyar,uss,2015,No,\,Yes,\,Non-data,sec15-paper-smolyar.pdf
Evilcohort: detecting communities of malicious accounts on online services,https://www.usenix.org/system/files/conference/usenixsecurity15/sec15-paper-stringhini.pdf,uss,2015,No,\,Yes,we observed the email-sending activity on a large web- mail service.,Data,sec15-paper-stringhini.pdf
Measuring Real-World Accuracies and Biases in Modeling Password Guessability,https://www.usenix.org/conference/usenixsecurity15/technical-sessions/presentation/ur,uss,2015,No,\,Yes,"We examine 13,345 passwords from four sets created|The passwords in these sets were collected",Data,sec15-paper-ur.pdf
All Your Biases Belong to Us: Breaking RC4 in WPA-TKIP and TLS,https://www.usenix.org/system/files/conference/usenixsecurity15/sec15-paper-vanhoef.pdf,uss,2015,No,\,Yes,\,Non-data,sec15-paper-vanhoef.pdf
EASEAndroid: Automatic Policy Analysis and Refinement for Security Enhanced Android via Large-Scale Semi-Supervised Learning,https://www.usenix.org/conference/usenixsecurity15/technical-sessions/presentation/wang-ruowen,uss,2015,No,\,Yes,on 1.3 million audit logs,Data,sec15-paper-wang-ruowen.pdf
IDENTITY THEFT AS A TEACHABLE MOMENT,,weis,2016,Yes,"We use the Federal Reserve Bank of New York Consumer Credit Panel/Equifax data set (hereafter, CCP), combined with additional information on the timing (placement) and type of fraud alerts obtained from Equifax by the Payment Cards Center.",No,\,Data,WEIS_2016_paper_14-1.pdf
Whack-a-mole: Asymmetric Conflict and Guerrilla Warfare in Web Security ,,weis,2016,No,\,No,\,Non-data,WEIS_2016_paper_15-2.pdf
Identifying How Firms Manage Cybersecurity Investment ,,weis,2016,No,\,Yes,We recruited a total of 40 executives for this study ,Data,WEIS_2016_paper_19-1.pdf
Strategic News Bundling and Privacy Breach Disclosures,,weis,2016,Yes,The data for stock prices comes from the Center for Research in Security Prices (CRSP).|DatalossDB.org|Databreaches.net|PHIprivacy.net|Privacy Rights Clearinghouse,No,\,Data,WEIS_2016_paper_20-1.pdf
The Days Before Zero Day:Investment Models for Secure Software Engineering ,,weis,2016,No,\,No,\,Non-data,WEIS_2016_paper_21-2.pdf
Measuring Attitude towards Risk Treatment Actions amongst Information Security Professionals: an Experimental Approach,,weis,2016,No,\,No,\,Non-data,WEIS_2016_paper_22-5.pdf
Market Segmentation and Software Security: Pricing Patching Rights,,weis,2016,No,\,No,\,Non-data,WEIS_2016_paper_33-2.pdf
Data Security in the Digital Age: Reputation and Strategic Interactions in Security Investments ,,weis,2016,No,\,No,\,Non-data,WEIS_2016_paper_34-4.pdf
Privacy and Security Through the Lens of the Federal Trade Commissionês Bureau of Economics,,weis,2016,No,\,No,\,Non-data,WEIS_2016_paper_36-1.pdf
National-level risk assessment: A multi-country study of malware infections,,weis,2016,Yes,"The data was collected by Microsoft Malicious Software Removal Tool (MSRT), a malware cleaner utility that scans computers for infections of specific, prevalent malicious software and helps remove these infections",Yes,"The five less infected countries were Aland Islands (1.4%), Japan (3%), Cayman Islands (3.4%), Finland (3.6%) and Liechtenstien (3.7%), while the five most infected countries were Ethiopia (63.8%), Iraq (54.5%), Pakistan (54.2%), Yemen (51.8%) and Sudan (51.2%)",Data,WEIS_2016_paper_38-2-1.pdf
Malware and Market Share,,weis,2016,No,\,No,\,Non-data,WEIS_2016_paper_4-1.pdf
Risk Management for Third Party Payment Networks ,,weis,2016,Yes,"we analyzed one year of transac- tion data from the TPP network, spanning from from 1/8/2014 till 1/8/2015 and collected by Adyen, a globally active PSP.",No,\,Data,WEIS_2016_paper_43_1.pdf
MyTrackingChoices: Pacifying the Ad-Block War by Enforcing User Privacy Preferences,,weis,2016,Yes,"We incorporate Alexa.comês 500 top Web sites for almost each of the top-level categories.|we have approximately 76000 entries for English language. Three additional lists of unigrams and bigrams, although with a fewer number of entries, are also available for French, Spanish and Italian.|The collected data is from those users of MyTrackingChoices who downloaded it directly from Chrome Web Store. In order to study blocking ad behaviors.",No,\,Data,WEIS_2016_paper_48.pdf
Estimating the costs of consumer-facing cybercrime: A tailored instrument and representative data for six EU countries,,weis,2016,Yes,"We develop an instrument to measure the prevalence of cybercrime and the costs to consumers. We collected representative data for adult Internet users in the following six European member states (in protocol order): Germany (DE), Estonia (EE), Italy (IT), the Netherlands (NL), Poland (PL), and the United Kingdom (UK).",No,\,Data,WEIS_2016_paper_54-2.pdf
Join Me on a Market for Anonymity ,,weis,2016,Yes,We used JoinMarketês built-in order book watcher to monitor the available o_ers and stored a snapshot about every five minutes since the beginning of June 2015 until the end of January 2016. ,No,\,Data,WEIS_2016_paper_58.pdf
Determining an Optimal Threshold on the Online Reserves of a Bitcoin Exchange ,,weis,2016,No,\,No,\,Non-data,WEIS_2016_paper_68-2.pdf
The Impact of DDoS and Other Security Shocks on Bitcoin Currency Exchanges: Evidence from Mt. Gox ,,weis,2016,Yes,a trade history of Mt. Gox transactions was publicly leaked. ,,,Data,WEIS_2016_paper_7.pdf
Perverse Incentives in Security Contracts: A Case Study in the Colombian Power Grid,,weis,2016,No,\,No,\,Non-data,WEIS_2016_paper_71-1.pdf
"Given Enough Eyeballs, All Bugs Are Shallow? Revisiting Eric Raymond with Bug Bounty Programs",,weis,2016,Yes,"We have investigated a public data set of 35 public bug bounty programs from the HackerOne website. We collected the rewards received by security researchers, with their timestamps",No,\,Data,WEIS_2016_paper_76.pdf
International Comparison of Bank Fraud Reimbursement: Customer Perceptions and Contractual Terms,,weis,2016,Yes,"We surveyed the terms and conditions of 30 banks operating in 25 countries. The terms and conditions were reviewed to identify instructions or advice on security. This included how users should handle the PINs associated with their cards, as well as telephone and Internet banking credentials.|We recruited 151 participants in total: 41, 56 and 54 participants from the DE, UK and US respectively.",No,\,Data,WEIS_2016_paper_78-1.pdf
Metric tree-like structures in real-life networks: an empirical study,https://arxiv.org/pdf/1402.3364.pdf,,2016,Yes,"Our datasets come from different domains like Internet measurements,",No,\,Data,1402.3364.pdf
Evidence of spatial embedding in the IPv4 router-level Internet network,https://arxiv.org/pdf/1410.3340v1.pdf,,2014,Yes,by the Center for Applied Internet Data Analysis (CAIDA)|the MaxMind Geolite database for a subset of the routers to varying levels of precision.,No,\,Data,1410.3340v1.pdf
A Novel Methodology of Router-To-AS Mapping inspired by Community Discovery,https://arxiv.org/ftp/arxiv/papers/1512/1512.03916.pdf,,2015,Yes,PeeringDB IP-to-AS ground truth Data,No,\,Data,1512.03916.pdf
On Measuring the Geographic Diversity of Internet Routes,https://arxiv.org/pdf/1601.01116v1.pdf,,2016,Yes,Therefore we used the data ,No,\,Data,1601.01116v1.pdf
Towards Characterizing International Routing Detours,https://arxiv.org/pdf/1606.05047.pdf,,2016,Yes,MaxMind GeoLite,No,\,Data,1606.05047.pdf
An Empirical Comparison of Botnet Detection Methods,https://pdfs.semanticscholar.org/eabb/a0b46f4325d28d6e02f4ebbf70f40a1263a5.pdf,,2014,Yes,The dataset used in the paper includes an IRC-based Botnet|indexed three Botnet datasets2 until|A custom botnet dataset was created to verify five| Ericsson Research created a normal dataset that was used in Saad|A considerable amount of malware traffic in pcap forma|Another dataset with malware logs and benign logs was collected in NexGinRC|The last dataset analyzed,No,\,Data,a0b46f4325d28d6e02f4ebbf70f40a1263a5.pdf
"Lost in Space: Improving Inference ofIPv4 Address Space Utilization",http://www.caida.org/publications/papers/2014/lost_in_space/lost_in_space.pdf,,2014,Yes,We analyzed BGP announcements captured by all|we used a dataset compiled by Geoff Hus- ton|We collected unsampled NetFlow records| We collected per-flow logs from a vantage| We collected full packet traces from the|Our fourth VP is a large European IXP inter-|We used the ISI Internet Census dataset|We extracted IP addresses from logs of Project,No,\,Data,lost_in_space.pdf
How and How Much Traceroute Confuses Our Understanding of Network Paths,http://wpage.unina.it/pescape/doc/routerpaths_lanman2016.pdf,,2016,Yes," selected at random from a list of 102,404 reachable destinations|Our dataset contains more than 900 thousand",No,\,Data,routerpaths_lanman2016.pdf