Name,URL,Conf.,Year,Used,Description,Produced,Description,Data,PDF_file_name
Observing common spam in Twitter and email.,http://doi.acm.org/10.1145/2398776.2398824,imc,2012,Yes,"To compare spam in tweets and email, we start with two sets of public messages, Twitter and Yahoo, both collected in March 2011. |We check the domains in our data sets against several public URL blacklists in the first week of May 2011. URIBL and SURBL are DNS-based blacklists with domain names found in the body of spam emails, but generally not in legitimate emails. PhishTank lists phishing URLs voted by users. To detect malware, we use the list published by malwaredomains.com. Finally, for both malware and phishing domains, we use the Google Safebrowsing API to check against Googleês constantly up- dated blacklists.|we use data from the spamtrap set up by Ramachandran and Feam- ster|Alexa top 10,000 |we use DNS lookup information collected by Verisign.",No,\,Data,p461-lumezanu.pdf
Beyond friendship: modeling user activity graphs on social network-based gifting applications.,http://doi.acm.org/10.1145/2398776.2398826,imc,2012,Yes,"our review (using Developer Analyt- ics [27]) in January 2012 showed that 74.4% of the top 250 Facebook applications by MAU were Flash or text-based gaming applications, while 9.43% were gifting applications, followed by other smaller genres of applications. ",Yes,Our user activity traces capture 2.2 billion activities. |Our user activity traces capture 2.2 billion activities.|Our user activity traces for Hugged capture 1.6 billion user activities.,Data,p467-nazir.pdf
Inside dropbox: understanding personal cloud storage services.,http://doi.acm.org/10.1145/2398776.2398827,imc,2012,Yes,"We installed Tstat at 4 vantage points in 2 European coun- tries and collected data from March 24, 2012 to May 5, 2012. ",No,\,Data,p481-drago.pdf
Reducing allocation errors in network testbeds.,http://doi.acm.org/10.1145/2398776.2398828,imc,2012,Yes,We analyze eight years of data about DeterLabês operation col- lected from its inception in February 2004 until February 2012. ,No,\,Data,p495-mirkovic.pdf
Sharing the cost of backbone networks: cui bono?,http://doi.acm.org/10.1145/2398776.2398830,imc,2012,Yes,"We use several datasets from a tier-1 backbone network, which interconnects with other ISPs that it serves. ",No,\,Data,p509-gyarmati.pdf
RasterZip: compressing network monitoring data with support for partial decompression.,http://doi.acm.org/10.1145/2398776.2398783,imc,2012,No,Six days of NetFlow traces of access traffic from a large |A two month NetFlow trace of internal and external,No,\,Non-data,p51-fusco.pdf
"Content delivery and the natural evolution of DNS: remote dns trends, performance issues and alternative solutions.",http://doi.acm.org/10.1145/2398776.2398831,imc,2012,Yes,"top 1,000 sites |We base our analyses on data contributed by 10,923 end hosts distributed across 99 countries and 752 ASes, providing a diverse set of vantage points.",No,\,Data,p523-otto.pdf
"Measuring the deployment of IPv6: topology, routing and performance.",http://doi.acm.org/10.1145/2398776.2398832,imc,2012,Yes,"We use a variety of data sources and analysis methods, ",No,\,Data,p537-dhamdhere.pdf
Measuring the impact of the copyright amendment act on New Zealand residential DSL users.,http://doi.acm.org/10.1145/2398776.2398833,imc,2012,Yes,Packet traces that were captured using a passive monitor placed within the core network of a New Zealand ISP were used for this study.,No,\,Data,p551-alcock.pdf
Wire-speed statistical classification of network traffic on commodity hardware.,http://doi.acm.org/10.1145/2398776.2398784,imc,2012,Yes,Real traffic consists of a packet-level trace sniffed in 2009 ,No,\,Data,p65-santiago.pdf
Fathom: a browser-based network measurement platform.,http://doi.acm.org/10.1145/2398776.2398786,imc,2012,No,\,No,\,Non-data,p73-dhawan.pdf
Mitigating sampling error when measuring internet client IPv6 capabilities.,http://doi.acm.org/10.1145/2398776.2398787,imc,2012,No,\,Yes,We use the data collected between 16th of May 2011 and 19th of February 2012 ,Data,p87-zander.pdf
Search + Seizure: The Effectiveness of Interventions on SEO Campaigns,http://conferences2.sigcomm.org/imc/2014/papers/p359.pdf,IMC (Internet Measurement Conference),2014,No,\,Yes,"Using eight months of empirical crawled data, we identify 52 distinct SEO campaigns| we were able to periodically collect AWStats data for 647 storefronts|In the PSR data set, we found 68,193 ",Data,p359.pdf
Detecting Malicious Activity with DNS Backscatter,http://conferences.sigcomm.org/imc/2015/papers/p197.pdf,IMC on Internet Measurements,2015,Yes,This paper uses DNS datasets from three authorities|we have data from all seven of their anycast sites|We also use data for M-Root| we draw on 9 months of data taken at the M-Root server,No,\,Data,p197.pdf
The MALICIA Dataset: Identification and Analysis of Drive-by Download Operations.,https://lirias.kuleuven.be/bitstream/123456789/464045/1/malicia_dataset.pdf,International Journal of Information Security,2015,No,\,Yes,we have built an infrastructure to track individual exploit servers over time|We receive feeds of drive-by download URLs,Data,malicia_dataset.pdf
Friendship and mobility: User movement in location-based social networks.,http://cs.stanford.edu/people/jure/pubs/mobile-kdd11.pdf,KDD,2011,No,\,Yes,We use three different datasets that capture human mobility|We col- lected all the public check-in data between|we also include a dataset of cell phone location trace data,Data,mobile-kdd11.pdf
The Internet Motion Sensor: A Distributed Blackhole Monitoring System,http://web.eecs.umich.edu/~farnam/pubs/2005-bc-ndss.pdf,ndss,2005,Yes,"In this one-week period of measurement, the IMS system",No,\,Data,2005-bc-ndss.pdf
Predicting Users___ Motivations behind Location Check-Ins and Utility Implications of Privacy Protection Mechanisms,http://www.shokri.org/files/Shokri-NDSS2015.pdf,ndss,2015,No,\,Yes,"to grant us access to their Foursquare data, we rewarded them with a fixed amount of money (US $4.5 per HIT [2], [22]). ",Data,Shokri-NDSS2015.pdf
Spectral Fractal Dimension Trajectory to Measure Cognitive Complexity of Malicious DNS Traffic,http://worldcomp-proceedings.com/proc/p2016/SAM3798.pdf,SAM,2016,Yes,Data set from PREDICT USA|Data  set  from  CAIDA  USA,Yes,Data set from our experiment in which a PCAP file,Data,SAM3798.pdf
Measuring IPv6 Adoption,http://web.engr.illinois.edu/~mdbailey/publications/sigcomm14_ipv6.pdf,SIGCOMM,2014,Yes,millions of daily global samples|10 million IPs probed daily|The number of IPv4 prefix allocations grows from roughly 300 per month at the begin-,No,"In the past several years, we typically find more than 300 prefixes allocated per month|we find nearly 69K IPv4 prefix allocations at|",Data,sigcomm14_ipv6.pdf
All Your IFCException Are Belong to Us.,http://dx.doi.org/10.1109/SP.2013.10,sp,2013,No,\,No,\,Non-data,06547098.pdf
"Declarative, Temporal, and Practical Programming with Capabilities.",http://dx.doi.org/10.1109/SP.2013.11,sp,2013,No,\,No,\,Non-data,06547099.pdf
Towards Practical Reactive Security Audit Using Extended Static Checkers.,http://dx.doi.org/10.1109/SP.2013.12,sp,2013,Yes,The properties were derived by studying a set of security vulnerabilities reported in a set of recent MSRC bulletins ,Yes,We identified around 70 vulnerabilities in critical software components,Data,06547100.pdf
SoK: Eternal War in Memory.,http://dx.doi.org/10.1109/SP.2013.13,sp,2013,No,\,No,\,Non-data,06547101.pdf
The Parrot Is Dead: Observing Unobservable Network Communications.,http://dx.doi.org/10.1109/SP.2013.14,sp,2013,No,\,No,\,Non-data,06547102.pdf
"Trawling for Tor Hidden Services: Detection, Measurement, Deanonymization.",http://dx.doi.org/10.1109/SP.2013.15,sp,2013,No,\,Yes,At the end of the experiment we collected 39824 unique onion addresses.|We also fetched the descriptors from the memory of running Tor instances and obtained 58389 descriptors in total,Data,06547103.pdf
SoK: P2PWNED - Modeling and Evaluating the Resilience of Peer-to-Peer Botnets.,http://dx.doi.org/10.1109/SP.2013.17,sp,2013,No,\,No,we enumerated eleven botnets that ,Non-data,06547104.pdf
Finding the Linchpins of the Dark Web: a Study on Topologically Dedicated Hosts on Malicious Web Infrastructures.,http://dx.doi.org/10.1109/SP.2013.18,sp,2013,Yes," Alexa top 60,000 site list and EasyList | Microsoft provides us with around 30 million doorway URLs|We download the malicious URL set posted by the WarningBird project|We run Twitter Search APIs [29] to pick top 10 trending terms every day. |We gather Alexa top 1 million web sites and update them every week. We obtain 2 million URLs in total, most of which are legitimate.",Yes,"Our HIC graph contains in total 60,856 HICs |our approach detects about 5,000 new topologically dedicated malicious hosts and over 20,000 malicious host paths",Data,06547105.pdf
The Crossfire Attack.,http://dx.doi.org/10.1109/SP.2013.19,sp,2013,No,\,No,\,Non-data,06547106.pdf
Ghost Talk: Mitigating EMI Signal Injection Attacks against Analog Sensors.,http://dx.doi.org/10.1109/SP.2013.20,sp,2013,No,\,No,\,Non-data,06547107.pdf
On Limitations of Friendly Jamming for Confidentiality.,http://dx.doi.org/10.1109/SP.2013.21,sp,2013,No,\,No,\,Non-data,06547108.pdf
Ally Friendly Jamming: How to Jam Your Enemy and Maintain Your Own Wireless Connectivity at the Same Time.,http://dx.doi.org/10.1109/SP.2013.22,sp,2013,No,\,No,\,Non-data,06547109.pdf
Practical Timing Side Channel Attacks against Kernel Space ASLR.,http://dx.doi.org/10.1109/SP.2013.23,sp,2013,No,\,No,\,Non-data,06547110.pdf
PrivExec: Private Execution as an Operating System Service.,http://dx.doi.org/10.1109/SP.2013.24,sp,2013,Yes,"In this test, we directed the browsers to visit the top 50 Alexa domains.|In this test, we visited 50 Wikipedia articles.|We cycled 5 times through 10 CNN pages with many embedded images",Yes,"We configured Audacious, a desktop audio player, to iterate through a playlist of 2500 MP3 audio files|We config- ured Feh to load and cycle through 1000 JPEG images|to iterate through a playlist of 100 Matroska files totaling 30 GB containing videos in various formats,|we selected the top 50 applications, excluding all non-free or Ubuntu-specific software.",Data,06547111.pdf
A Hybrid Architecture for Interactive Verifiable Computation.,http://dx.doi.org/10.1109/SP.2013.48,sp,2013,No,\,No,\,Non-data,06547112.pdf
Pinocchio: Nearly Practical Verifiable Computation.,http://dx.doi.org/10.1109/SP.2013.47,sp,2013,No,\,No,\,Non-data,06547113.pdf
ObliviStore: High Performance Oblivious Cloud Storage.,http://dx.doi.org/10.1109/SP.2013.25,sp,2013,No,\,No,\,Non-data,06547114.pdf
Hiding Information in Flash Memory.,http://dx.doi.org/10.1109/SP.2013.26,sp,2013,No,\,No,\,Non-data,06547115.pdf
PUFs in Security Protocols: Attack Models and Security Evaluations.,http://dx.doi.org/10.1109/SP.2013.27,sp,2013,No,\,No,\,Non-data,06547116.pdf
SoK: Secure Data Deletion.,http://dx.doi.org/10.1109/SP.2013.28,sp,2013,No,\,No,\,Non-data,06547117.pdf
Anon-Pass: Practical Anonymous Subscriptions.,http://dx.doi.org/10.1109/SP.2013.29,sp,2013,No,\,No,\,Non-data,06547118.pdf
Privacy-Preserving Ridge Regression on Hundreds of Millions of Records.,http://dx.doi.org/10.1109/SP.2013.30,sp,2013,Yes,we ran our system on real datasets retrieved from the UCI repository,No,\,Data,06547119.pdf
A Scanner Darkly: Protecting User Privacy from Perceptual Applications.,http://dx.doi.org/10.1109/SP.2013.31,sp,2013,Yes,We also experimentally estimated the entropy of sketches on a dataset of 30 frontal face images sampled from the Color FERET database.,Yes,We evaluated DARKLY on 20 OpenCV applications,Data,06547120.pdf
Caveat Coercitor: Coercion-Evidence in Electronic Voting.,http://dx.doi.org/10.1109/SP.2013.32,sp,2013,No,\,No,\,Non-data,06547121.pdf
SoK: The Evolution of Sybil Defense via Social Networks.,http://dx.doi.org/10.1109/SP.2013.33,sp,2013,No,\,No,\,Non-data,06547122.pdf
Zerocoin: Anonymous Distributed E-Cash from Bitcoin.,http://dx.doi.org/10.1109/SP.2013.34,sp,2013,No,\,No,\,Non-data,06547123.pdf
"Design, Implementation and Verification of an eXtensible and Modular Hypervisor Framework.",http://dx.doi.org/10.1109/SP.2013.36,sp,2013,No,\,No,\,Non-data,06547125.pdf
Implementing TLS with Verified Cryptographic Security.,http://dx.doi.org/10.1109/SP.2013.37,sp,2013,No,\,No,\,Non-data,06547126.pdf
An Ideal-Security Protocol for Order-Preserving Encoding.,http://dx.doi.org/10.1109/SP.2013.38,sp,2013,No,\,No,\,Non-data,06547127.pdf
Efficient Garbling from a Fixed-Key Blockcipher.,http://dx.doi.org/10.1109/SP.2013.39,sp,2013,No,\,No,\,Non-data,06547128.pdf
Circuit Structures for Improving Efficiency of Security and Privacy Tools.,http://dx.doi.org/10.1109/SP.2013.40,sp,2013,No,\,No,\,Non-data,06547129.pdf
SoK: SSL and HTTPS: Revisiting Past Challenges and Evaluating Certificate Trust Model Enhancements.,http://dx.doi.org/10.1109/SP.2013.41,sp,2013,No,\,No,\,Non-data,06547130.pdf
Lucky Thirteen: Breaking the TLS and DTLS Record Protocols.,http://dx.doi.org/10.1109/SP.2013.42,sp,2013,No,\,No,\,Non-data,06547131.pdf
Cookieless Monster: Exploring the Ecosystem of Web-Based Device Fingerprinting.,http://dx.doi.org/10.1109/SP.2013.43,sp,2013,Yes,"Alexa top 10,000 sites",Yes,"we used a list of 3,804 domains of sites that, when analyzed by Wepawet | we crawled up to 20 pages for each of the Alexa top 10,000 sites|we ana- lyzed the fingerprinting libraries of three large, commercial companies",Data,06547132.pdf
Practical Control Flow Integrity and Randomization for Binary Executables.,http://dx.doi.org/10.1109/SP.2013.44,sp,2013,No,\,No,\,Non-data,06547133.pdf
Just-In-Time Code Reuse: On the Effectiveness of Fine-Grained Address Space Layout Randomization.,http://dx.doi.org/10.1109/SP.2013.45,sp,2013,No,\,No,\,Non-data,06547134.pdf
Welcome to the Entropics: Boot-Time Entropy in Embedded Devices.,http://dx.doi.org/10.1109/SP.2013.46,sp,2013,No,\,No,\,Non-data,06547135.pdf
seL4: From General Purpose to a Proof of Information Flow Enforcement.,http://dx.doi.org/10.1109/SP.2013.35,sp,2013,No,\,No,\,Non-data,p1690-argyros.pdf
Understanding Address Usage in the Visible Internet,http://www.isi.edu/~johnh/PAPERS/Cai09b.pdf,USC/ISI Technical Report,2009,Yes,We use two ICMP surveys taken by USC|We collected VUSC s at our enterprise in order to compare,No,\,Data,Cai09b.pdf
Understanding the Dark Side of Domain Parking.,https://www.usenix.org/conference/usenixsecurity14/technical-sessions/presentation/alrwais,uss,2014,Yes,them are ranked among the top 100k by Alexa |PassiveDNS set (DNS record collection) pro- vided by the Security Information Exchange,Yes,"we extracted a set of salient features from those|the data used in our study was collected from crawling parked domains.|Those crawlers worked on a list of parked domains,|we made about 24M visits to over 100K parked domains.|we were able to collect 1,015 mone-|We further evaluated the false positive rate that could be introduced by the stamps on a dataset containing 768M redirection chains collected by crawl- ing the top 1M Alexa websites | we labeled the 1.2M monetization chains collected from",Data,sec14-paper-alrwais.pdf
Oxymoron: Making Fine-Grained Memory Randomization Practical by Allowing Code Sharing.,https://www.usenix.org/conference/usenixsecurity14/technical-sessions/presentation/backes,uss,2014,No,\,No,\,Non-data,sec14-paper-backes.pdf
BYTEWEIGHT: Learning to Recognize Functions in Binary Code.,https://www.usenix.org/conference/usenixsecurity14/technical-sessions/presentation/bao,uss,2014,No,\,Yes,"Our data set consisted of 2,200 different binaries compiled with four variables:|our data set consisted of 2,064 binaries in total",Data,sec14-paper-bao.pdf
Succinct Non-Interactive Zero Knowledge for a von Neumann Architecture.,https://www.usenix.org/conference/usenixsecurity14/technical-sessions/presentation/ben-sasson,uss,2014,No,\,No,\,Non-data,sec14-paper-ben-sasson.pdf
Brahmastra: Driving Apps to Test the Security of Third-Party Components.,https://www.usenix.org/conference/usenixsecurity14/technical-sessions/presentation/bhoraskar,uss,2014,Yes,Web of Trust (WoT) database |we use a list of apps categorized as Kids in Amazons Android app store,Yes,"175 out of 220 childrenês apps we tested display ads |We crawled 12,571 unique apps from the Google Play store from late December 2012 till |We then identify the requests made by the ad libraries to their server component us- ing domain names.",Data,sec14-paper-bhoraskar.pdf
A Look at Targeted Attacks Through the Lense of an NGO.,https://www.usenix.org/conference/usenixsecurity14/technical-sessions/presentation/le-blond,uss,2014,Yes,"we then scraped the National Vulnerability Database | we submitted the documents to VirusTotal|In particular, we found 247 RAR and 49 ZIP containing malicious EXE",Yes,"The two volunteers shared with us the headers and content of 1,493 suspi- cious emails | The emails contained 209 links and 1,649 attachments|we observed that malicious emails had been sent to 1,250 unique email addresses and 157 organizations. |Our analysis below was done on 689 malware samples that we extracted from malicious documents.",Data,sec14-paper-blond.pdf
Towards Reliable Storage of 56-bit Secrets in Human Memory.,https://www.usenix.org/conference/usenixsecurity14/technical-sessions/presentation/bonneau,uss,2014,No,\,No,\,Non-data,sec14-paper-bonneau.pdf
iSeeYou: Disabling the MacBook Webcam Indicator LED.,https://www.usenix.org/conference/usenixsecurity14/technical-sessions/presentation/brocker,uss,2014,No,\,No,\,Non-data,sec14-paper-brocker.pdf
ROP is Still Dangerous: Breaking Modern Defenses.,https://www.usenix.org/conference/usenixsecurity14/technical-sessions/presentation/carlini,uss,2014,No,\,No,\,Non-data,sec14-paper-carlini.pdf
On the Practical Exploitability of Dual EC in TLS Implementations.,https://www.usenix.org/conference/usenixsecurity14/technical-sessions/presentation/checkoway,uss,2014,No,\,Yes,We collected a large dataset of TLS session information from servers listening on port 443 in ,Data,sec14-paper-checkoway.pdf
Peeking into Your App without Actually Seeing It: UI State Inference and Novel Android Attacks.,https://www.usenix.org/conference/usenixsecurity14/technical-sessions/presentation/chen,uss,2014,No,\,No,\,Non-data,sec14-paper-chen.pdf
A Large-Scale Analysis of the Security of Embedded Firmwares.,https://www.usenix.org/conference/usenixsecurity14/technical-sessions/presentation/costin,uss,2014,No,\,Yes,"Our crawler collected 759,273 files, for a total of 1.8TB of data. ",Data,sec14-paper-costin.pdf
SpanDex: Secure Password Tracking for Android.,https://www.usenix.org/conference/usenixsecurity14/technical-sessions/presentation/cox,uss,2014,No,\,Yes,"First, we ran 50 popular apps from Googleês Play Store. ",Data,sec14-paper-cox.pdf
Static Detection of Second-Order Vulnerabilities in Web Applications.,https://www.usenix.org/conference/usenixsecurity14/technical-sessions/presentation/dahse,uss,2014,No,\,Yes,Our prototype reported a total of 159 valid second-order vulnerabilities with a |,Data,sec14-paper-dahse.pdf
Burst ORAM: Minimizing ORAM Response Times for Bursty Access Patterns.,https://www.usenix.org/conference/usenixsecurity14/technical-sessions/presentation/dautrich,uss,2014,Yes,The third workload is based on the NetApp Dataset ,No,\,Data,sec14-paper-dautrich.pdf
Stitching the Gadgets: On the Ineffectiveness of Coarse-Grained Control-Flow Integrity Protection.,https://www.usenix.org/conference/usenixsecurity14/technical-sessions/presentation/davi,uss,2014,No,\,No,\,Non-data,sec14-paper-davi.pdf
Ad-Hoc Secure Two-Party Computation on Mobile Devices using Hardware Tokens.,https://www.usenix.org/conference/usenixsecurity14/technical-sessions/presentation/demmler,uss,2014,No,\,No,\,Non-data,sec14-paper-demmler.pdf
An Internet-Wide View of Internet-Wide Scanning.,https://www.usenix.org/conference/usenixsecurity14/technical-sessions/presentation/durumeric,uss,2014,Yes,"The University of Michigan performs regular ZMap scans for HTTPS hosts in order to track the certificate authority ecosystem | Shodan completed 2,294 scans targeting 53 ports, send- ing an estimated 209 billion probes from six servers",Yes,We detected 10.8 million scans from 1.76 million hosts|Our dataset consists of all traffic,Data,sec14-paper-durumeric.pdf
Blanket Execution: Dynamic Similarity Testing for Program Binaries and Components.,https://www.usenix.org/conference/usenixsecurity14/technical-sessions/presentation/egele,uss,2014,No,\,Yes,"In total our dataset consists of 1,140 unique binary applications,| In our dataset 37 different programs contained duplicates ",Data,sec14-paper-egele.pdf
Password Portfolios and the Finite-Effort User: Sustainably Managing Large Numbers of Accounts.,https://www.usenix.org/conference/usenixsecurity14/technical-sessions/presentation/florencio,uss,2014,No,\,No,\,Non-data,sec14-paper-florencio.pdf
Privacy in Pharmacogenetics: An End-to-End Case Study of Personalized Warfarin Dosing.,https://www.usenix.org/conference/usenixsecurity14/technical-sessions/presentation/fredrikson_matthew,uss,2014,No,\,No,\,Non-data,sec14-paper-fredrikson-privacy.pdf
Zê„: An Optimizing Distributing Zero-Knowledge Compiler.,https://www.usenix.org/conference/usenixsecurity14/technical-sessions/presentation/fredrikson,uss,2014,No,\,No,\,Non-data,sec14-paper-fredrikson-z0.pdf
Size Does Matter: Why Using Gadget-Chain Length to Prevent Code-Reuse Attacks is Hard.,https://www.usenix.org/conference/usenixsecurity14/technical-sessions/presentation/goktas,uss,2014,No,\,No,\,Non-data,sec14-paper-goktas.pdf
Targeted Threat Index: Characterizing and Quantifying Politically-Motivated Targeted Malware.,https://www.usenix.org/conference/usenixsecurity14/technical-sessions/presentation/hardy,uss,2014,No,\,Yes,Our primary data source is a collection of e-mails identified by participants |The e-mails examined in this study span over four years,Data,sec14-paper-hardy.pdf
ASM: A Programmable Interface for Extending Android Security.,https://www.usenix.org/conference/usenixsecurity14/technical-sessions/presentation/heuser,uss,2014,No,\,No,\,Non-data,sec14-paper-heuser.pdf
Never Been KIST: Tor's Congestion Management Blossoms with Kernel-Informed Socket Transport.,https://www.usenix.org/conference/usenixsecurity14/technical-sessions/presentation/jansen,uss,2014,Yes,"traceroute data from CAIDA [2], and client/server data from the Tor Metrics Portal [8] and Alexa [1]. ",Yes,"To collect congestion information in Tor, we first ran three live relays ",Data,sec14-paper-jansen.pdf
Hulk: Eliciting Malicious Behavior in Browser Extensions.,https://www.usenix.org/conference/usenixsecurity14/technical-sessions/presentation/kapravelos,uss,2014,Yes,To evaluate Hulk we use two sources of extensions,No,\,Data,sec14-paper-kapravelos.pdf
On the Effective Prevention of TLS Man-in-the-Middle Attacks in Web Applications.,https://www.usenix.org/conference/usenixsecurity14/technical-sessions/presentation/karapanos,uss,2014,No,\,No,\,Non-data,sec14-paper-karapanos.pdf
ret2dir: Rethinking Kernel Isolation.,https://www.usenix.org/conference/usenixsecurity14/technical-sessions/presentation/kemerlis,uss,2014,No,\,No,\,Non-data,sec14-paper-kemerlis.pdf
BareCloud: Bare-metal Analysis-based Evasive Malware Detection.,https://www.usenix.org/conference/usenixsecurity14/technical-sessions/presentation/kirat,uss,2014,No,\,Yes,We first built the ground truth dataset of evasive mal- ware and non-evasive malware samples.,Data,sec14-paper-kirat.pdf
Telepathwords: Preventing Weak Passwords by Reading Users' Minds.,https://www.usenix.org/conference/usenixsecurity14/technical-sessions/presentation/komanduri,uss,2014,No,\,Yes,We recruited participants from Amazonês Mechanical Turk by listing a Human Intelligence Task |We downloaded our encrypted logs to a researcherês workstation for decryption and analysis.,Data,sec14-paper-komanduri.pdf
TRUESET: Faster Verifiable Set Computations.,https://www.usenix.org/conference/usenixsecurity14/technical-sessions/presentation/kosba,uss,2014,No,\,No,\,Non-data,sec14-paper-kosba.pdf
Exit from Hell? Reducing the Impact of Amplification DDoS Attacks.,https://www.usenix.org/conference/usenixsecurity14/technical-sessions/presentation/kuhrer,uss,2014,Yes,we used the MaxMind GeoIP database,Yes,"We run two separated TCP scans to mimic both behaviors. |In total, 66,785,451 HTTP hosts, 23,519,493 Telnet hosts, and 1,845,346 CUPS hosts replied to our requests.|We ran the scans on a weekly basis from Nov 22, 2013 to Feb 21, 2014 to observe potential changes |During the course of our scans, we received 90 emails from administrators asking about the scanning experi- ments.",Data,sec14-paper-kuhrer.pdf
Mimesis Aegis: A Mimicry Privacy Shield-A System's Approach to Data Privacy on Public Cloud.,https://www.usenix.org/conference/usenixsecurity14/technical-sessions/presentation/lau,uss,2014,No,\,No,\,Non-data,sec14-paper-lau.pdf
XRay: Enhancing the Web's Transparency with Differential Correlation.,https://www.usenix.org/conference/usenixsecurity14/technical-sessions/presentation/lecuyer,uss,2014,No,\,No,\,Non-data,sec14-paper-lecuyer.pdf
"SDDR: Light-Weight, Secure Mobile Encounters.",https://www.usenix.org/conference/usenixsecurity14/technical-sessions/presentation/lentz,uss,2014,No,\,No,\,Non-data,sec14-paper-lentz-update.pdf
A Large-Scale Empirical Analysis of Chinese Web Passwords.,https://www.usenix.org/conference/usenixsecurity14/technical-sessions/presentation/li_zhigong,uss,2014,No,\,Yes,"we analyzed a corpus of over 100 million passwords from multiple websites that are in Chinese and English, respectively",Data,sec14-paper-li-zhigong.pdf
