Data,|abstract
the semantics of online authentication in the web are rather
straightforward:
if alice has a certiﬁcate binding bob’s
name to a public key, and if a remote entity can prove knowl-
edge of bob’s private key, then (barring key compromise)
that remote entity must be bob. however, in reality, many
websites—and the majority of the most popular ones—are
hosted at least in part by third parties such as content deliv-
ery networks (cdns) or web hosting providers. put simply:
administrators of websites who deal with (extremely) sensi-
tive user data are giving their private keys to third parties.
importantly, this sharing of keys is undetectable by most
users, and widely unknown even among researchers.

in this paper, we perform a large-scale measurement study
of key sharing in today’s web. we analyze the prevalence
with which websites trust third-party hosting providers with
their secret keys, as well as the impact that this trust has on
responsible key management practices, such as revocation.
our results reveal that key sharing is extremely common,
with a small handful of hosting providers having keys from
the majority of the most popular websites. we also ﬁnd that
hosting providers often manage their customers’ keys, and
that they tend to react more slowly yet more thoroughly to
compromised or potentially compromised keys.

1.

|
Data,|abstract 
advanced persistent threats (apts) are a new breed of internet 
based  smart  threats,  which  can  go  undetected  with  the  existing 
state of-the-art internet traffic monitoring and protection systems.  
with  the  evolution  of  internet  and  cloud  computing,  a  new 
generation  of  smart  apt  attacks  has  also evolved  and  signature 
based  threat  detection  systems  are  proving  to  be  futile  and 
insufficient. one of the essential strategies in detecting apts is to 
continuously  monitor  and  analyze  various  features  of  a  tcp/ip 
connection,  such  as  the  number  of  transferred  packets,  the  total 
count  of  the  bytes  exchanged,  the  duration  of  the  tcp/ip 
connections,  and  details  of  the  number  of  packet  flows.  the 
current  threat  detection  approaches  make  extensive  use  of 
machine learning algorithms that utilize statistical and behavioral 
knowledge  of  the  traffic.  however,  the  performance  of  these 
algorithms  is  far  from  satisfactory  in  terms  of  reducing  false 
negatives  and  false  positives  simultaneously.  mostly,  current 
algorithms  focus  on  reducing  false  positives,  only.  this  paper 
presents  a  fractal  based  anomaly  classification  mechanism,  with 
the  goal  of  reducing  both  false  positives  and  false  negatives, 
simultaneously.  a  comparison  of  the  proposed  fractal  based 
method  with  a  traditional  euclidean  based  machine  learning 
algorithm  (k-nn)  shows  that  the  proposed  method  significantly 
outperforms  the  traditional  approach  by  reducing  false  positive 
and  false  negative  rates,  simultaneously,  while  improving  the 
overall classification rates.  
general terms 
cyber security 
keywords 
advanced persistent threats (apt); remote trojans; machine 
learning; classification; cyber threats; complexity; multifractal 
 

 
 
 
permission to make digital or hard copies of all or part of this work for personal or 
classroom use is granted without fee provided that copies are not made or distributed 
for  profit  or  commercial  advantage  and  that  copies  bear  this  notice  and  the  full 
citation on the first page. copyrights for components of this work owned by others 
than acm must be honored. abstracting with credit is permitted. to copy otherwise, 
or  republish,  to  post  on  servers  or  to  redistribute  to  lists,  requires  prior  specific 
permission and/or a fee. request permissions from permissions@acm.org. 
iwspa'16, march 11 2016, new orleans, la, usa  
© 2016 acm. isbn 978-1-4503-4077-9/16/03…$15.00  
doi: http://dx.doi.org/10.1145/2875475.2875484  

 
 

 
1.  |
Data,|abstract

people travel in the real world and leave their location history in a form of trajectories. these trajec-
tories do not only connect locations in the physical world but also bridge the gap between people and
locations. this paper introduces a social networking service, called geolife, which aims to understand
trajectories, locations and users, and mine the correlation between users and locations in terms of user-
generated gps trajectories. geolife offers three key applications scenarios: 1) sharing life experiences
based on gps trajectories; 2) generic travel recommendations, e.g., the top interesting locations, travel
sequences among locations and travel experts in a given region; and 3) personalized friend and location
recommendation.

1

|
Non-data,|abstract
secure multilinear maps (mmaps) have been shown to have
remarkable applications in cryptography, such as multi-input
functional encryption (mife) and program obfuscation. to
date, there has been little evaluation of the performance of
these applications.
in this paper we initiate a systematic
study of mmap-based constructions. we build a general
framework, called 5gen, to experiment with these applica-
tions. at the top layer we develop a compiler that takes
in a high-level program and produces an optimized matrix
branching program needed for the applications we consider.
next, we optimize and experiment with several mife and
obfuscation constructions and evaluate their performance.
the 5gen framework is modular and can easily accommo-
date new mmap constructions as well as new mife and
obfuscation constructions, as well as being an open-source
tool that can be used by other research groups to experiment
with a variety of mmap-based constructions.

1.

|
Non-data,|abstract
cryptocurrencies, such as bitcoin and 250 similar alt-coins, em-
body at their core a blockchain protocol — a mechanism for a dis-
tributed network of computational nodes to periodically agree on
a set of new transactions. designing a secure blockchain protocol
relies on an open challenge in security, that of designing a highly-
scalable agreement protocol open to manipulation by byzantine or
arbitrarily malicious nodes. bitcoin’s blockchain agreement proto-
col exhibits security, but does not scale: it processes 3–7 transac-
tions per second at present, irrespective of the available computa-
tion capacity at hand.

in this paper, we propose a new distributed agreement proto-
col for permission-less blockchains called elastico. elastico
scales transaction rates almost linearly with available computation
for mining: the more the computation power in the network, the
higher the number of transaction blocks selected per unit time.
elastico is efﬁcient in its network messages and tolerates byzan-
tine adversaries of up to one-fourth of the total computational power.
technically, elastico uniformly partitions or parallelizes the min-
ing network (securely) into smaller committees, each of which pro-
cesses a disjoint set of transactions (or “shards”). while sharding
is common in non-byzantine settings, elastico is the ﬁrst candi-
date for a secure sharding protocol with presence of byzantine ad-
versaries. our scalability experiments on amazon ec2 with up to
1, 600 nodes conﬁrm elastico’s theoretical scaling properties.

1.

|
Non-data,|abstract
we present a software approach to mitigate access-driven
side-channel attacks that leverage last-level caches (llcs)
shared across cores to leak information between security do-
mains (e.g., tenants in a cloud). our approach dynami-
cally manages physical memory pages shared between secu-
rity domains to disable sharing of llc lines, thus prevent-
ing “flush-reload” side channels via llcs. it also man-
ages cacheability of memory pages to thwart cross-tenant
“prime-probe” attacks in llcs. we have implemented
our approach as a memory management subsystem called
cachebar within the linux kernel to intervene on such
side channels across container boundaries, as containers are
a common method for enforcing tenant isolation in platform-
as-a-service (paas) clouds. through formal veriﬁcation,
principled analysis, and empirical evaluation, we show that
cachebar achieves strong security with small performance
overheads for paas workloads.

keywords
cache-based side channel; prime-probe; ﬂush-reload

1.

|
Data,|abstract
in december 2015, juniper networks announced multiple security
vulnerabilities stemming from unauthorized code in screenos, the
operating system for their netscreen vpn routers. the more so-
phisticated of these vulnerabilities was a passive vpn decryption
capability, enabled by a change to one of the elliptic curve points
used by the dual ec pseudorandom number generator.

in this paper, we describe the results of a full independent analysis
of the screenos randomness and vpn key establishment proto-
col subsystems, which we carried out in response to this incident.
while dual ec is known to be insecure against an attacker who
can choose the elliptic curve parameters, juniper had claimed in
2013 that screenos included countermeasures against this type of
attack. we ﬁnd that, contrary to juniper’s public statements, the
screenos vpn implementation has been vulnerable since 2008 to
passive exploitation by an attacker who selects the dual ec curve
point. this vulnerability arises due to apparent ﬂaws in juniper’s
countermeasures as well as a cluster of changes that were all in-
troduced concurrently with the inclusion of dual ec in a single
2008 release. we demonstrate the vulnerability on a real netscreen
device by modifying the ﬁrmware to install our own parameters,
and we show that it is possible to passively decrypt an individual
vpn session in isolation without observing any other network trafﬁc.
we investigate the possibility of passively ﬁngerprinting screenos
implementations in the wild. this incident is an important example
of how guidelines for random number generation, engineering, and
validation can fail in practice.

1.

|
Data,|abstract
to adapt to the rapidly evolving landscape of cyber threats, secu-
rity professionals are actively exchanging indicators of compro-
mise (ioc) (e.g., malware signatures, botnet ips) through public
sources (e.g. blogs, forums, tweets, etc.). such information, of-
ten presented in articles, posts, white papers etc., can be converted
into a machine-readable openioc format for automatic analysis
and quick deployment to various security mechanisms like an in-
trusion detection system. with hundreds of thousands of sources
in the wild, the ioc data are produced at a high volume and veloc-
ity today, which becomes increasingly hard to manage by humans.
efforts to automatically gather such information from unstructured
text, however, is impeded by the limitations of today’s natural lan-
guage processing (nlp) techniques, which cannot meet the high
standard (in terms of accuracy and coverage) expected from the
iocs that could serve as direct input to a defense system.

in this paper, we present iace, an innovation solution for fully
automated ioc extraction. our approach is based on the obser-
vation that the iocs in technical articles are often described in a
predictable way: being connected to a set of context terms (e.g.,
“download”) through stable grammatical relations. leveraging this
observation, iace is designed to automatically locate a putative
ioc token (e.g., a zip ﬁle) and its context (e.g., “malware”, “down-
load”) within the sentences in a technical article, and further an-
alyze their relations through a novel application of graph mining
techniques. once the grammatical connection between the tokens
is found to be in line with the way that the ioc is commonly pre-
sented, these tokens are extracted to generate an openioc item
that describes not only the indicator (e.g., a malicious zip ﬁle) but
also its context (e.g., download from an external source). running
on 71,000 articles collected from 45 leading technical blogs, this
new approach demonstrates a remarkable performance: it gener-
ated 900k openioc items with a precision of 95% and a coverage
over 90%, which is way beyond what the state-of-the-art nlp tech-
nique and industry ioc tool can achieve, at a speed of thousands of
articles per hour. further, by correlating the iocs mined from the
articles published over a 13-year span, our study sheds new light on

1the two lead authors are ordered alphabetically.

permission to make digital or hard copies of all or part of this work for personal or
classroom use is granted without fee provided that copies are not made or distributed
for proﬁt or commercial advantage and that copies bear this notice and the full cita-
tion on the ﬁrst page. copyrights for components of this work owned by others than
acm must be honored. abstracting with credit is permitted. to copy otherwise, or re-
publish, to post on servers or to redistribute to lists, requires prior speciﬁc permission
and/or a fee. request permissions from permissions@acm.org.
ccs’16, october 24-28, 2016, vienna, austria
c(cid:13) 2016 acm. isbn 978-1-4503-4139-4/16/10. . . $15.00
doi: http://dx.doi.org/10.1145/2976749.2978315

figure 1: example of openioc schema.

the links across hundreds of seemingly unrelated attack instances,
particularly their shared infrastructure resources, as well as the im-
pacts of such open-source threat intelligence on security protection
and evolution of attack strategies.
1.
|
Non-data,|abstract
differential privacy is a promising formal approach to data privacy,
which provides a quantitative bound on the privacy cost of an al-
gorithm that operates on sensitive information. several tools have
been developed for the formal veriﬁcation of differentially private
algorithms, including program logics and type systems. however,
these tools do not capture fundamental techniques that have emerged
in recent years, and cannot be used for reasoning about cutting-edge
differentially private algorithms. existing techniques fail to handle
three broad classes of algorithms: 1) algorithms where privacy de-
pends on accuracy guarantees, 2) algorithms that are analyzed with
the advanced composition theorem, which shows slower growth in
the privacy cost, 3) algorithms that interactively accept adaptive
inputs.

we address these limitations with a new formalism extending
aprhl [6], a relational program logic that has been used for proving
differential privacy of non-interactive algorithms, and incorporating
ahl [11], a (non-relational) program logic for accuracy properties.
we illustrate our approach through a single running example, which
exempliﬁes the three classes of algorithms and explores new variants
of the sparse vector technique, a well-studied algorithm from the
privacy literature. we implement our logic in easycrypt, and for-
mally verify privacy. we also introduce a novel coupling technique
called optimal subset coupling that may be of independent interest.

1.

|
Non-data,|abstract
this paper extends the choice available for secure real num-
ber implementations with two new contributions. we will
consider the numbers represented in form a − ϕb where ϕ
is the golden ratio, and in form (−1)s · 2e where e is a
ﬁxed-point number. we develop basic arithmetic operations
together with some frequently used elementary functions.
all the operations are implemented and benchmarked on
sharemind secure multi-party computation framework. it
turns out that the new proposals provide viable alternatives
to standard ﬂoating- and ﬁxed-point implementations from
the performance/error viewpoint in various settings. how-
ever, the optimal choice still depends on the exact require-
ments of the numerical algorithm to be implemented.

keywords
secure ﬁxed- and ﬂoating-point arithmetic, privacy-preserving
data analysis, secure computations

1.

|
Non-data,|abstract
motivated by the impossibility of achieving fairness in secure com-
putation [cleve, stoc 1986], recent works study a model of fair-
ness in which an adversarial party that aborts on receiving output is
forced to pay a mutually predeﬁned monetary penalty to every other
party that did not receive the output. these works show how to de-
sign protocols for secure computation with penalties that guaran-
tees that either fairness is guaranteed or that each honest party ob-
tains a monetary penalty from the adversary. protocols for this task
are typically designed in an hybrid model where parties have access
to a “claim-or-refund” transaction functionality denote f∗

in this work, we obtain improvements on the efﬁciency of these
constructions by amortizing the cost over multiple executions of
secure computation with penalties. more precisely, for computa-
tional security parameter λ, we design a protocol that implements
(cid:96) = poly(λ) instances of secure computation with penalties where
the total number of calls to f∗
keywords: secure computation, fairness, bitcoin, amortization.

cr is independent of (cid:96).

cr.

1.

|
Data,|abstract
when created, the java platform was among the ﬁrst run-
times designed with security in mind. yet, numerous java
versions were shown to contain far-reaching vulnerabilities,
permitting denial-of-service attacks or even worse allowing
intruders to bypass the runtime’s sandbox mechanisms, open-
ing the host system up to many kinds of further attacks.

this paper presents a systematic in-depth study of 87 pub-
licly available java exploits found in the wild. by collecting,
minimizing and categorizing those exploits, we identify their
commonalities and root causes, with the goal of determining
the weak spots in the java security architecture and possible
countermeasures.

our ﬁndings reveal that the exploits heavily rely on a
set of nine weaknesses, including unauthorized use of re-
stricted classes and confused deputies in combination with
caller-sensitive methods. we further show that all attack
vectors implemented by the exploits belong to one of three
categories: single-step attacks, restricted-class attacks, and
information hiding attacks.

the analysis allows us to propose ideas for improving the

security architecture to spawn further research in this area.

1.

|
Data,|abstract
user-driven access control improves the coarse-grained ac-
cess control of current operating systems (particularly in
the mobile space) that provide only all-or-nothing access to
a resource such as the camera or the current location. by
granting appropriate permissions only in response to explicit
user actions (for example, pressing a camera button), user-
driven access control better aligns application actions with
user expectations. prior work on user-driven access con-
trol has relied in essential ways on operating system (os)
modiﬁcations to provide applications with uncompromisable
access control gadgets, distinguished user interface (ui) ele-
ments that can grant access permissions.

this work presents a design, implementation, and evalu-
ation of user-driven access control that works with no os
modiﬁcations, thus making deployability and incremental
adoption of the model more feasible. we develop (1) a user-
level trusted library for access control gadgets, (2) static
analyses to prevent malicious creation of ui events,
ille-
gal ﬂows of sensitive information, and circumvention of our
library, and (3) dynamic analyses to ensure users are not
tricked into granting permissions. in addition to providing
the original user-driven access control guarantees, we use
static information ﬂow to limit where results derived from
sensitive sources may ﬂow in an application.

our implementation targets android applications. we
port open-source applications that need interesting resource
permissions to use our system. we determine in what ways
user-driven access control in general and our implementa-
tion in particular are good matches for real applications.
we demonstrate that our system is secure against a variety
of attacks that malware on android could otherwise mount.

1.

|
Non-data,|abstract
authenticated encryption (ae) schemes are symmetric-key
encryption schemes ensuring strong notions of conﬁden-
tiality and integrity. although various ae schemes are
known, there remains signiﬁcant interest in developing
schemes that are more eﬃcient, meet even stronger secu-
rity notions (e.g., misuse-resistance), or satisfy certain non-
cryptographic properties (e.g., being patent-free).

we present an automated approach for analyzing and syn-
thesizing blockcipher-based ae schemes, signiﬁcantly ex-
tending prior work by malozemoﬀ et al. (csf 2014) who syn-
thesize encryption schemes satisfying conﬁdentiality only.
our main insight is to restrict attention to a certain class of
schemes that is expressive enough to capture several known
constructions yet also admits automated reasoning about
security. we use our approach to generate thousands of
ae schemes with provable security guarantees, both known
(e.g., variants of ocb and ccm) and new. implementing
two of these new schemes, we ﬁnd their performance com-
petitive with state-of-the-art ae schemes.

1.

|
Data,|abstract
there
along with the increasing popularity of mobile devices,
exist severe security and privacy concerns for mobile apps. on
google play, user reviews provide a unique understanding of
security/privacy issues of mobile apps from users’ perspective,
and in fact they are valuable feedbacks from users by considering
users’ expectations. to best assist the end users, in this paper, we
automatically learn the security/privacy related behaviors inferred
from analysis on user reviews, which we call review-to-behavior
ﬁdelity. we design the system autoreb that automatically
assesses the review-to-behavior ﬁdelity of mobile apps. autoreb
employs the state-of-the-art machine learning techniques to
infer the relations between users’ reviews and four categories of
security-related behaviors. moreover, it uses a crowdsourcing
approach to automatically aggregate the security issues from
review-level to app-level. to our knowledge, autoreb is the ﬁrst
work that explores the user review information and utilizes the
review semantics to predict the risky behaviors at both review-level
and app-level.

we crawled a real-world dataset of 2, 614, 186 users, 12, 783
apps and 13, 129, 783 reviews from google play, and use it to
comprehensively evaluate autoreb. the experiment result shows
that our method can predict the mobile app behaviors at user-review
level with accuracy as high as 94.05%, and also it can predict
the security issues at app-level by aggregating the predictions at
review-level. our research offers an insight into understanding the
mobile app security concerns from users’ perspective, and helps
bridge the gap between the security issues and users’ perception.

categories and subject descriptors
d.4.6 [operating system]:
[artiﬁcial intelligence]: learning

security and protection;

i.2.6

general terms
security, privacy, algorithm

permission to make digital or hard copies of all or part of this work for personal or
classroom use is granted without fee provided that copies are not made or distributed
for proﬁt or commercial advantage and that copies bear this notice and the full citation
on the ﬁrst page. copyrights for components of this work owned by others than
acm must be honored. abstracting with credit is permitted. to copy otherwise, or
republish, to post on servers or to redistribute to lists, requires prior speciﬁc permission
and/or a fee. request permissions from permissions@acm.org.
ccs’15, october 12–16, 2015, denver, colorado, usa.

c(cid:2) 2015 acm. isbn 978-1-4503-3832-5/15/10 ...$15.00.

doi: http://dx.doi.org/10.1145/2810103.2813689.

user reviews

auto
reb

app 

behaviors

spamming, ads
financial issue

over-claimed permission
data leakage  

….
…...

autoreb

reviewͲlevelsecurity
behaviorinference

appͲlevelsecurity
behaviorinference

figure 1:
infer the security-related behaviors from users’ reviews.
overview of the framework of autoreb : (a) engine 1: review-level
security behavior inference engine;
(b) engine 2: app-level security
behavior inference engine.

keywords
android; app; risk; information retrieval; perception; learning

1.

|
Non-data,|abstract
kernel hardening has been an important topic since many applica-
tions and security mechanisms often consider the kernel as part of
their trusted computing base (tcb). among various hardening
techniques, kernel address space layout randomization (kaslr)
is the most effective and widely adopted defense mechanism that
can practically mitigate various memory corruption vulnerabilities,
such as buffer overflow and use-after-free. in principle, kaslr
is secure as long as no memory leak vulnerability exists and high
entropy is ensured.

in this paper, we introduce a highly stable timing attack against
kaslr, called drk, that can precisely de-randomize the mem-
ory layout of the kernel without violating any such assumptions.
drk exploits a hardware feature called intel transactional synchro-
nization extension (tsx) that is readily available in most modern
commodity cpus. one surprising behavior of tsx, which is es-
sentially the root cause of this security loophole, is that it aborts a
transaction without notifying the underlying kernel even when the
transaction fails due to a critical error, such as a page fault or an
access violation, which traditionally requires kernel intervention.
drk turned this property into a precise timing channel that can
determine the mapping status (i.e., mapped versus unmapped) and
execution status (i.e., executable versus non-executable) of the priv-
ileged kernel address space. in addition to its surprising accuracy
