Data,|abstract
rupted within the same time period between refreshes. the
only currently known scheme to achieve such strong security
guarantees incurs the considerable cost of several hundred
exponentiations per server. we prove our scheme secure
in the universal composability model, which is well-known
to oﬀer important beneﬁts for password-based primitives,
under the gap one-more diﬃe-hellman assumption in the
random-oracle model. server initialization and refresh must
take place in a trusted execution environment.
initializa-
tion additionally requires a secure message to each server,
but the refresh procedure is non-interactive. we show that
these requirements are easily met in practice by providing
an example deployment architecture.

categories and subject descriptors
d.4.6 [security and protection]: cryptographic control;
d.4.6 [security and protection]: access controls; d.4.6
[security and protection]: authentication

keywords
password veriﬁcation, proactive security, uc security.

1.

|
Non-data,|abstract
in the setting of secure multiparty computation, a set of
parties with private inputs wish to compute some function
of their inputs without revealing anything but their output.
over the last decade, the eﬃciency of secure two-party com-
putation has advanced in leaps and bounds, with speedups of
some orders of magnitude, making it fast enough to be of use
in practice. in contrast, progress on the case of multiparty
computation (with more than two parties) has been much
slower, with very little work being done. currently, the only
implemented eﬃcient multiparty protocol has many rounds
of communication (linear in the depth of the circuit being
computed) and thus is not suited for internet-like settings
where latency is not very low.

in this paper, we construct highly eﬃcient constant-round
protocols for the setting of multiparty computation for semi-
honest adversaries. our protocols work by constructing a
multiparty garbled circuit, as proposed in bmr (beaver et
al., stoc 1990). our ﬁrst protocol uses oblivious transfer
and constitutes the ﬁrst concretely-eﬃcient constant-round
multiparty protocol for the case of no honest majority. our
second protocol uses bgw, and is signiﬁcantly more eﬃcient
than the fairplaymp protocol (ben-david et al., ccs 2008)
that also uses bgw.

we ran extensive experimentation comparing our diﬀer-
ent protocols with each other and with a highly-optimized
implementation of semi-honest gmw. due to our protocol
being constant round, it signiﬁcantly outperforms gmw in
internet-like settings. for example, with 13 parties situated
in the virginia and ireland amazon regions and the sha256
∗
supported by israel science foundation grant 544/13, the cyber se-
curity research center at ben gurion university, and by the frankel
center for computer science.
†
supported by the european research council under the erc con-
solidators grant agreement n. 615172 (hips) and by the biu center
for research in applied cryptography and cyber security in conjunc-
tion with the israel national cyber bureau in the prime minister’s
oﬃce.
‡
istry and by israel science foundation grant 544/13.

supported by a grant from the israeli science and technology min-

permission to make digital or hard copies of all or part of this work for personal or
classroom use is granted without fee provided that copies are not made or distributed
for proﬁt or commercial advantage and that copies bear this notice and the full cita-
tion on the ﬁrst page. copyrights for components of this work owned by others than
acm must be honored. abstracting with credit is permitted. to copy otherwise, or re-
publish, to post on servers or to redistribute to lists, requires prior speciﬁc permission
and/or a fee. request permissions from permissions@acm.org.
ccs’16, october 24-28, 2016, vienna, austria
c(cid:13) 2016 acm. isbn 978-1-4503-4139-4/16/10. . . $15.00
doi: http://dx.doi.org/10.1145/2976749.2978347

circuit with 90,000 gates and of depth 4000, the overall run-
ning time of our protocol is 25 seconds compared to 335
seconds for gmw. furthermore, our online time is under
half a second compared to 330 seconds for gmw.

1.

|
Non-data,|abstract
in the last few years, there has been signiﬁcant interest in de-
veloping methods to search over encrypted data. in the case
of range queries, a simple solution is to encrypt the contents
of the database using an order-preserving encryption (ope)
scheme (i.e., an encryption scheme that supports compar-
isons over encrypted values). however, naveed et al. (ccs
2015) recently showed that ope-encrypted databases are
extremely vulnerable to “inference attacks.”

in this work, we consider a related primitive called order-
revealing encryption (ore), which is a generalization of
ope that allows for stronger security. we begin by con-
structing a new ore scheme for small message spaces which
achieves the “best-possible” notion of security for ore. next,
we introduce a “domain-extension” technique and apply it to
our small-message-space ore. while our domain-extension
technique does incur a loss in security, the resulting ore
scheme we obtain is more secure than all existing (state-
less and non-interactive) ope and ore schemes which are
practical. all of our constructions rely only on symmetric
primitives. as part of our analysis, we also give a tight lower
bound for ope and show that no eﬃcient ope scheme can
satisfy best-possible security if the message space contains
just three messages. thus, achieving strong notions of secu-
rity for even small message spaces requires moving beyond
ope.

finally, we examine the properties of our new ore scheme
and show how to use it to construct an eﬃcient range query
protocol that is robust against the inference attacks of naveed
et al. we also give a full implementation of our new ore
scheme, and show that not only is our scheme more secure
than existing ope schemes, it is also faster: encrypting a
32-bit integer requires just 55 microseconds, which is more
than 65 times faster than existing ope schemes.

∗the full version of this paper [43] with complete proofs is

available at http://eprint.iacr.org/2016/612.

permission to make digital or hard copies of all or part of this work for personal or
classroom use is granted without fee provided that copies are not made or distributed
for proﬁt or commercial advantage and that copies bear this notice and the full cita-
tion on the ﬁrst page. copyrights for components of this work owned by others than
acm must be honored. abstracting with credit is permitted. to copy otherwise, or re-
publish, to post on servers or to redistribute to lists, requires prior speciﬁc permission
and/or a fee. request permissions from permissions@acm.org.
ccs’16, october 24-28, 2016, vienna, austria
c(cid:13) 2016 acm. isbn 978-1-4503-4139-4/16/10. . . $15.00
doi: http://dx.doi.org/10.1145/2976749.2978376

1.

|
Data,|abstract
in this paper, we study the over-the-top (ott) bypass
fraud, a recent form of interconnect telecom fraud. in ott
bypass, a normal phone call is diverted over ip to a voice
chat application on a smartphone, instead of being termi-
nated over the normal telecom infrastructure. this rerout-
ing (or hijack) is performed by an international transit op-
erator in coordination with the ott service provider, but
without explicit authorization from the caller, callee and
their operators. by doing so, they collect a large share of
the call charge and induce a signiﬁcant loss of revenue to
the bypassed operators. moreover, this practice degrades
the quality of service without providing any beneﬁts for the
users.

in this paper, we study the possible techniques to detect
and measure this fraud and evaluate the real impact of ott
bypass on a small european country. for this, we performed
more than 15,000 test calls during 8 months and conducted
a user study with more than 8,000 users.

in our measurements, we observed up to 83% of calls being
subject to ott bypass. additionally, we show that ott
bypass degrades the quality of service, and sometimes collide
with other fraud schemes, exacerbating the quality issues.
our user study shows that ott bypass and its eﬀects are
poorly understood by users.

1.

|
Data,|abstract
recently there has been much interest in performing search queries
over encrypted data to enable functionality while protecting sensi-
tive data. one particularly efﬁcient mechanism for executing such
queries is order-preserving encryption/encoding (ope) which re-
sults in ciphertexts that preserve the relative order of the underlying
plaintexts thus allowing range and comparison queries to be per-
formed directly on ciphertexts. recently, popa et al. (s&p 2013)
gave the ﬁrst construction of an ideally-secure ope scheme and
kerschbaum (ccs 2015) showed how to achieve the even stronger
notion of frequency-hiding ope. however, as naveed et al. (ccs
2015) have recently demonstrated, these constructions remain vul-
nerable to several attacks. additionally, all previous ideal ope
schemes (with or without frequency-hiding) either require a large
round complexity of o(log n) rounds for each insertion, or a large
persistent client storage of size o(n), where n is the number of
items in the database. it is thus desirable to achieve a range query
scheme addressing both issues gracefully.

in this paper, we propose an alternative approach to range queries
over encrypted data that is optimized to support insert-heavy work-
loads as are common in “big data” applications while still maintain-
ing search functionality and achieving stronger security. speciﬁ-
cally, we propose a new primitive called partial order preserving
encoding (pope) that achieves ideal ope security with frequency
hiding and also leaves a sizable fraction of the data pairwise in-
comparable. using only o(1) persistent and o(n) non-persistent
client storage for 0 <  < 1, our pope scheme provides extremely
fast batch insertion consisting of a single round, and efﬁcient search
with o(1) amortized cost for up to o(n1−) search queries. this
improved security and performance makes our scheme better suited
for today’s insert-heavy databases.

|
Non-data,|abstract
pseudo-random number generators (prngs) are a critical
infrastructure for cryptography and security of many com-
puter applications. at the same time, prngs are surpris-
ingly diﬃcult to design, implement, and debug. this paper
presents the ﬁrst static analysis technique speciﬁcally for
quality assurance of cryptographic prng implementations.
the analysis targets a particular kind of implementation
defect, the entropy loss. entropy loss occurs when the en-
tropy contained in the prng seed is not utilized to the
full extent for generating the pseudo-random output stream.
the debian openssl disaster, probably the most prominent
prng-related security incident, was one but not the only
manifestation of such a defect.

together with the static analysis technique, we present its
implementation, a tool named entroposcope. the tool of-
fers a high degree of automation and practicality. we have
applied the tool to ﬁve real-world prngs of diﬀerent de-
signs and show that it eﬀectively detects both known and
previously unknown instances of entropy loss.

keywords
pseudo-random number generator; prng; entropy loss;
information ﬂow; openssl; static analysis; bounded model
checking

1.

|
Non-data,|abstract
modern operating systems use hardware support to protect
against control-ﬂow hijacking attacks such as code-injection
attacks. typically, write access to executable pages is pre-
vented and kernel mode execution is restricted to kernel code
pages only. however, current cpus provide no protection
against code-reuse attacks like rop. aslr is used to pre-
vent these attacks by making all addresses unpredictable for
an attacker. hence, the kernel security relies fundamentally
on preventing access to address information.

we introduce prefetch side-channel attacks, a new class
of generic attacks exploiting major weaknesses in prefetch
instructions. this allows unprivileged attackers to obtain
address information and thus compromise the entire system
by defeating smap, smep, and kernel aslr. prefetch can
fetch inaccessible privileged memory into various caches on
intel x86. it also leaks the translation-level for virtual ad-
dresses on both intel x86 and armv8-a. we build three at-
tacks exploiting these properties. our ﬁrst attack retrieves
an exact image of the full paging hierarchy of a process,
defeating both user space and kernel space aslr. our sec-
ond attack resolves virtual to physical addresses to bypass
smap on 64-bit linux systems, enabling ret2dir attacks.
we demonstrate this from unprivileged user programs on
linux and inside amazon ec2 virtual machines. finally,
we demonstrate how to defeat kernel aslr on windows 10,
enabling rop attacks on kernel and driver binary code. we
propose a new form of strong kernel isolation to protect com-
modity systems incuring an overhead of only 0.06–5.09%.

ccs concepts
•security and privacy → side-channel analysis and
countermeasures; systems security; operating sys-
tems security;

keywords
aslr; kernel vulnerabilities; timing attacks

permission to make digital or hard copies of all or part of this work for personal or
classroom use is granted without fee provided that copies are not made or distributed
for proﬁt or commercial advantage and that copies bear this notice and the full citation
on the ﬁrst page. copyrights for components of this work owned by others than the
author(s) must be honored. abstracting with credit is permitted. to copy otherwise, or
republish, to post on servers or to redistribute to lists, requires prior speciﬁc permission
and/or a fee. request permissions from permissions@acm.org.
ccs’16, october 24 - 28, 2016, vienna, austria
c(cid:13) 2016 copyright held by the owner/author(s). publication rights licensed to acm.
isbn 978-1-4503-4139-4/16/10. . . $15.00
doi: http://dx.doi.org/10.1145/2976749.2978356

1.

|
Non-data,|abstract
security against hardware trojans is currently becoming an
essential ingredient to ensure trust in information systems.
a variety of solutions have been introduced to reach this
goal, ranging from reactive (i.e., detection-based) to pre-
ventive (i.e., trying to make the insertion of a trojan more
diﬃcult for the adversary). in this paper, we show how test-
ing (which is a typical detection tool) can be used to state
concrete security guarantees for preventive approaches to
trojan-resilience. for this purpose, we build on and formal-
ize two important previous works which introduced “input
scrambling” and “split manufacturing” as countermeasures
to hardware trojans. using these ingredients, we present
a generic compiler that can transform any circuit into a
trojan-resilient one, for which we can state quantitative se-
curity guarantees on the number of correct executions of the
circuit thanks to a new tool denoted as “testing ampliﬁca-
tion”. compared to previous works, our threat model covers
an extended range of hardware trojans while we stick with
the goal of minimizing the number of honest elements in
our transformed circuits. since transformed circuits essen-
tially correspond to redundant multiparty computations of
the target functionality, they also allow reasonably eﬃcient
implementations, which can be further optimized if special-
ized to certain cryptographic primitives and security goals.

1.

|
Non-data,|abstract
defenders of enterprise networks have a critical need to
quickly identify the root causes of malware and data leak-
age.
increasingly, usb storage devices are the media of
choice for data exﬁltration, malware propagation, and even
cyber-warfare. we observe that a critical aspect of ex-
plaining and preventing such attacks is understanding the
provenance of data (i.e., the lineage of data from its creation
to current state) on usb devices as a means of ensuring
their safe usage. unfortunately, provenance tracking is
not oﬀered by even sophisticated modern devices. this
work presents provusb, an architecture for ﬁne-grained
provenance collection and tracking on smart usb devices.
provusb maintains data provenance by recording reads
and writes at the block layer and reliably identifying hosts
editing those blocks through attestation over the usb chan-
nel. our evaluation ﬁnds that provusb imposes a one-time
850 ms overhead during usb enumeration, but approaches
nearly-bare-metal runtime performance (90% of through-
put) on larger ﬁles during normal execution, and less than
0.1% storage overhead for provenance in real-world work-
loads. provusb thus provides essential new techniques in
the defense of computer systems and usb storage devices.

1.

|
Data,|abstract
third-party libraries on android have been shown to be se-
curity and privacy hazards by adding security vulnerabilities
to their host apps or by misusing inherited access rights.
correctly attributing improper app behavior either to app
or library developer code or isolating library code from their
host apps would be highly desirable to mitigate these prob-
lems, but is impeded by the absence of a third-party library
detection that is eﬀective and reliable in spite of obfuscated
code. this paper proposes a library detection technique that
is resilient against common code obfuscations and that is
capable of pinpointing the exact library version used in apps.
libraries are detected with proﬁles from a comprehensive
library database that we generated from the original library
sdks. we apply our technique to the top apps on google
play and their complete histories to conduct a longitudinal
study of library usage and evolution in apps. our results
particularly show that app developers only slowly adapt new
library versions, exposing their end-users to large windows
of vulnerability. for instance, we discovered that two long-
known security vulnerabilities in popular libs are still present
in the current top apps. moreover, we ﬁnd that misuse of
cryptographic apis in advertising libs, which increases the
host apps’ attack surface, aﬀects 296 top apps with a cu-
mulative install base of 3.7bn devices according to play. to
the best of our knowledge, our work is ﬁrst to quantify the
security impact of third-party libs on the android ecosystem.

1.

|
Non-data,|abstract
cache side-channel attacks have been extensively studied
on x86 architectures, but much less so on arm processors.
the technical challenges to conduct side-channel attacks on
arm, presumably, stem from the poorly documented arm
cache implementations, such as cache coherence protocols
and cache ﬂush operations, and also the lack of understand-
ing of how diﬀerent cache implementations will aﬀect side-
channel attacks. this paper presents a systematic explo-
ration of vectors for flush-reload attacks on arm pro-
cessors. flush-reload attacks are among the most well-
known cache side-channel attacks on x86. it has been shown
in previous work that they are capable of exﬁltrating sensi-
tive information with high ﬁdelity. we demonstrate in this
work a novel construction of ﬂush-reload side channels on
last-level caches of arm processors, which, particularly, ex-
ploits return-oriented programming techniques to reload in-
structions. we also demonstrate several attacks on android
os (e.g., detecting hardware events and tracing software ex-
ecution paths) to highlight the implications of such attacks
for android devices.

keywords
cache side channels; ﬂush-reload

1.

|
Non-data,|abstract
modern applications often operate on data in multiple administra-
tive domains. in this federated setting, participants may not fully
trust each other. these distributed applications use transactions as
a core mechanism for ensuring reliability and consistency with per-
sistent data. however, the coordination mechanisms needed for
transactions can both leak conﬁdential information and allow unau-
thorized inﬂuence.

by implementing a simple attack, we show these side channels
can be exploited. however, our focus is on preventing such attacks.
we explore secure scheduling of atomic, serializable transactions
in a federated setting. while we prove that no protocol can guaran-
tee security and liveness in all settings, we establish conditions for
sets of transactions that can safely complete under secure schedul-
ing. based on these conditions, we introduce staged commit, a
secure scheduling protocol for federated transactions. this proto-
col avoids insecure information channels by dividing transactions
into distinct stages. we implement a compiler that statically checks
code to ensure it meets our conditions, and a system that schedules
these transactions using the staged commit protocol. experiments
on this implementation demonstrate that realistic federated transac-
tions can be scheduled securely, atomically, and efﬁciently.

1.

|
Non-data,|abstract
large numbers of smart connected devices, also named as the in-
ternet of things (iot), are permeating our environments (homes,
factories, cars, and also our body—with wearable devices) to collect
data and act on the insight derived. ensuring software integrity (in-
cluding os, apps, and conﬁgurations) on such smart devices is then
essential to guarantee both privacy and safety. a key mechanism to
protect the software integrity of these devices is remote attestation:
a process that allows a remote veriﬁer to validate the integrity of
the software of a device. this process usually makes use of a signed
hash value of the actual device’s software, generated by dedicated
hardware. while individual device attestation is a well-established
technique, to date integrity veriﬁcation of a very large number of
devices remains an open problem, due to scalability issues.

in this paper, we present sana, the ﬁrst secure and scalable pro-
tocol for efﬁcient attestation of large sets of devices that works under
realistic assumptions. sana relies on a novel signature scheme to
allow anyone to publicly verify a collective attestation in constant
time and space, for virtually an unlimited number of devices. we
substantially improve existing swarm attestation schemes [5] by sup-
porting a realistic trust model where: (1) only the targeted devices
are required to implement attestation; (2) compromising any device
does not harm others; and (3) all aggregators can be untrusted. we
implemented sana and demonstrated its efﬁciency on tiny sensor
devices. furthermore, we simulated sana at large scale, to assess
its scalability. our results show that sana can provide efﬁcient
attestation of networks of 1, 000, 000 devices, in only 2.5 seconds.

1.

|
Non-data,|abstract
recent literature on ios security has focused on the ma-
licious potential of third-party applications, demonstrating
how developers can bypass application vetting and code-
level protections. in addition to these protections, ios uses
a generic sandbox proﬁle called “container” to conﬁne ma-
licious or exploited third-party applications. in this paper,
we present the ﬁrst systematic analysis of the ios container
sandbox proﬁle. we propose the sandscout framework to
extract, decompile, formally model, and analyze ios sand-
box proﬁles as logic-based programs. we use our prolog-
based queries to evaluate ﬁle-based security properties of the
container sandbox proﬁle for ios 9.0.2 and discover seven
classes of exploitable vulnerabilities. these attacks aﬀect
non-jailbroken devices running later versions of ios. we are
working with apple to resolve these attacks, and we expect
that sandscout will play a signiﬁcant role in the develop-
ment of sandbox proﬁles for future versions of ios.

1.

|
Data,|abstract
because of rampant security breaches in iot devices, searching
vulnerabilities in massive iot ecosystems is more crucial than ever.
recent studies have demonstrated that control-ﬂow graph (cfg)
based bug search techniques can be effective and accurate in iot
devices across different architectures. however, these cfg-based
bug search approaches are far from being scalable to handle an
enormous amount of iot devices in the wild, due to their expen-
sive graph matching overhead. inspired by rich experience in im-
age and video search, we propose a new bug search scheme which
addresses the scalability challenge in existing cross-platform bug
search techniques and further improves search accuracy. unlike
existing techniques that directly conduct searches based upon raw
features (cfgs) from the binary code, we convert the cfgs into
high-level numeric feature vectors. compared with the cfg fea-
ture, high-level numeric feature vectors are more robust to code
variation across different architectures, and can easily achieve real-
time search by using state-of-the-art hashing techniques.

we have implemented a bug search engine, genius, and com-
pared it with state-of-art bug search approaches. experimental re-
sults show that genius outperforms baseline approaches for vari-
ous query loads in terms of speed and accuracy. we also evaluated
genius on a real-world dataset of 33,045 devices which was col-
lected from public sources and our system. the experiment showed
that genius can ﬁnish a search within 1 second on average when
performed over 8,126 ﬁrmware images of 420,558,702 functions.
by only looking at the top 50 candidates in the search result, we
found 38 potentially vulnerable ﬁrmware images across 5 vendors,
and conﬁrmed 23 of them by our manual analysis. we also found
that it took only 0.1 seconds on average to ﬁnish searching for all
154 vulnerabilities in two latest commercial ﬁrmware images from
