Data,|abstract
cused on protecting only the parts of javascript bridges that expose
permissions-protected resources. in this work, our goal is to provide
a generic solution that works for all apps that utilize embedded web
browsers and protects all channels that give access to internal app
and device resources. towards realizing this goal, we built draco,
a uniform and ﬁne-grained access control framework for web code
running on android embedded browsers (viz., webview). draco
provides a declarative policy language that allows developers to
deﬁne policies to specify the desired access characteristics of web
origins in a ﬁne-grained fashion, and a runtime system that dynami-
cally enforces the policies. in contrast with previous work, we do
not assume any modiﬁcations to the android operating system, and
implement draco in the chromium android system webview app
to enable seamless deployment. our evaluation of the the draco
runtime system shows that draco incurs negligible overhead, which
is in the order of microseconds.

keywords
android, webview, access control, origin, javascript bridges, ex-
ploitation, javascript, html5

1.

|
Data,|abstract
searchable symmetric encryption aims at making possible
searching over an encrypted database stored on an untrusted
server while keeping privacy of both the queries and the
data, by allowing some small controlled leakage to the server.
recent work shows that dynamic schemes – in which the
data is eﬃciently updatable – leaking some information on
updated keywords are subject to devastating adaptative at-
tacks breaking the privacy of the queries. the only way
to thwart this attack is to design forward private schemes
whose update procedure does not leak if a newly inserted
element matches previous search queries.

this work proposes Σoφoς as a forward private sse scheme
with performance similar to existing less secure schemes, and
that is conceptually simpler (and also more eﬃcient) than
previous forward private constructions. in particular, it only
relies on trapdoor permutations and does not use an oram-
like construction. we also explain why Σoφoς is an optimal
point of the security/performance tradeoﬀ for sse.

finally, an implementation and evaluation results demon-

strate its practical eﬃciency.

ccs concepts
•security and privacy → privacy-preserving proto-
cols; security protocols; management and querying
of encrypted data;

keywords
searchable symmetric encryption; forward privacy; prov-
able security; implementation

1.

|
Non-data,|abstract
we describe a lightweight protocol for oblivious evaluation of
a pseudorandom function (oprf) in the presence of semi-
honest adversaries.
in an oprf protocol a receiver has
an input r; the sender gets output s and the receiver gets
output f (s, r), where f is a pseudorandom function and s
is a random seed. our protocol uses a novel adaptation of 1-
out-of-2 ot-extension protocols, and is particularly eﬃcient
when used to generate a large batch of oprf instances.
the cost to realize m oprf instances is roughly the cost
to realize 3.5m instances of standard 1-out-of-2 ots (using
state-of-the-art ot extension).

we explore in detail our protocol’s application to semi-
honest secure private set intersection (psi). the fastest state-
of-the-art psi protocol (pinkas et al., usenix 2015) is based
on eﬃcient ot extension. we observe that our oprf can
be used to remove their psi protocol’s dependence on the
bit-length of the parties’ items. we implemented both psi
protocol variants and found ours to be 3.1–3.6× faster than
pinkas et al. for psi of 128-bit strings and suﬃciently large
sets. concretely, ours requires only 3.8 seconds to securely
compute the intersection of 220-size sets, regardless of the
bit length of the items. for very large sets, our protocol is
only 4.3× slower than the insecure na¨ıve hashing approach
for psi.

1.

|
Non-data,|abstract
failing to properly isolate components in the same address
space has resulted in a substantial amount of vulnerabilities.
enforcing the least privilege principle for memory accesses
can selectively isolate software components to restrict at-
tack surface and prevent unintended cross-component mem-
ory corruption. however, the boundaries and interactions
between software components are hard to reason about and
existing approaches have failed to stop attackers from ex-
ploiting vulnerabilities caused by poor isolation.

we present the secure memory views (smv) model: a
practical and eﬃcient model for secure and selective mem-
ory isolation in monolithic multithreaded applications. smv
is a third generation privilege separation technique that of-
fers explicit access control of memory and allows concurrent
threads within the same process to partially share or fully
isolate their memory space in a controlled and parallel man-
ner following application requirements. an evaluation of our
prototype in the linux kernel (tcb < 1,800 loc) shows
negligible runtime performance overhead in real-world ap-
plications including cherokee web server (< 0.69%), apache
httpd web server (< 0.93%), and mozilla firefox web browser
(< 1.89%) with at most 12 loc changes.

1.

|
Data,|abstract
recommender systems typically require users’ history data
to provide a list of recommendations and such recommen-
dations usually reside on the cloud/server. however, the
release of such private data to the cloud has been shown to
put users at risk. it is highly desirable to provide users high-
quality personalized services while respecting their privacy.
in this paper, we develop the ﬁrst enhanced privacy-built-
in client for personalized recommendation (epicrec) sys-
tem that performs the data perturbation on the client side
to protect users’ privacy. our system needs no assumption
of trusted server and no change on the recommendation al-
gorithms on the server side; and needs minimum user inter-
action in their preferred manner, which makes our solution
ﬁt very well into real world practical use.

the design of epicrec system incorporates three main
modules: (1) usable privacy control interface that enables
two user preferred privacy controls, overall and category-
based controls, in the way they understand; (2) user privacy
level quantiﬁcation that automatically quantiﬁes user pri-
vacy concern level from these user understandable inputs;
(3) lightweight data perturbation algorithm that perturbs
user private data with provable guarantees on both diﬀeren-
tial privacy and data utility.

using large-scale real world datasets, we show that, for
both overall and category-based privacy controls, epicrec
performs best with respect to both perturbation quality and
personalized recommendation, with negligible computational
overhead. therefore, epicrec enables two contradictory
goals, privacy preservation and recommendation accuracy.
we also implement a proof-of-concept epicrec system to
demonstrate a privacy-preserving personal computer for movie
recommendation with web-based privacy controls. we be-
lieve epicrec is an important step towards designing a prac-
tical system that enables companies to monetize on user data
using high quality personalized services with strong provable
privacy protection to gain user acceptance and adoption of
their services.

permission to make digital or hard copies of all or part of this work for personal or
classroom use is granted without fee provided that copies are not made or distributed
for proﬁt or commercial advantage and that copies bear this notice and the full cita-
tion on the ﬁrst page. copyrights for components of this work owned by others than
acm must be honored. abstracting with credit is permitted. to copy otherwise, or re-
publish, to post on servers or to redistribute to lists, requires prior speciﬁc permission
and/or a fee. request permissions from permissions@acm.org.
ccs’16, october 24-28, 2016, vienna, austria
c(cid:13) 2016 acm. isbn 978-1-4503-4139-4/16/10. . . $15.00
doi: http://dx.doi.org/10.1145/2976749.2978316

keywords
privacy-preserving recommendation; diﬀerential privacy;
privacy paradox

1.

|
Non-data,|abstract
contemporary vehicles are getting equipped with an increasing
number of electronic control units (ecus) and wireless connec-
tivities. although these have enhanced vehicle safety and efﬁ-
ciency, they are accompanied with new vulnerabilities. in this pa-
per, we unveil a new important vulnerability applicable to several
in-vehicle networks including control area network (can), the
de facto standard in-vehicle network protocol. speciﬁcally, we
propose a new type of denial-of-service (dos), called the bus-
off attack, which exploits the error-handling scheme of in-vehicle
networks to disconnect or shut down good/uncompromised ecus.
this is an important attack that must be thwarted, since the attack,
once an ecu is compromised, is easy to be mounted on safety-
critical ecus while its prevention is very difﬁcult. in addition to
the discovery of this new vulnerability, we analyze its feasibility
using actual in-vehicle network trafﬁc, and demonstrate the attack
on a can bus prototype as well as on two real vehicles. based on
our analysis and experimental results, we also propose and evaluate
a mechanism to detect and prevent the bus-off attack.

1.

|
Data,|abstract
sybil attacks present a signiﬁcant threat to many internet
systems and applications, in which a single adversary in-
serts multiple colluding identities in the system to compro-
mise its security and privacy. recent work has advocated
the use of social-network-based trust relationships to defend
against sybil attacks. however, most of the prior security
analyses of such systems examine only the case of social net-
works at a single instant in time. in practice, social network
connections change over time, and attackers can also cause
limited changes to the networks. in this work, we focus on
the temporal dynamics of a variety of social-network-based
sybil defenses. we describe and examine the eﬀect of novel
attacks based on: (a) the attacker’s ability to modify sybil-
controlled parts of the social-network graph, (b) his ability
to change the connections that his sybil identities main-
tain to honest users, and (c) taking advantage of the regular
dynamics of connections forming and breaking in the hon-
est part of the social network. we ﬁnd that against some
defenses meant to be fully distributed, such as sybillimit
and persea, the attacker can make dramatic gains over time
and greatly undermine the security guarantees of the sys-
tem. even against centrally controlled sybil defenses, the
attacker can eventually evade detection (e.g. against sybil-
infer and sybilrank) or create denial-of-service conditions
(e.g. against ostra and sumup). after analysis and simula-
tion of these attacks using both synthetic and real-world so-
cial network topologies, we describe possible defense strate-
gies and the trade-oﬀs that should be explored. it is clear
from our ﬁndings that temporal dynamics need to be ac-
counted for in sybil defense or else the attacker will be able
to undermine the system in unexpected and possibly dan-
gerous ways.

categories and subject descriptors
c.2.0 [computer-communication networks]: general
– security and protection; k.4.1 [computers and soci-

permission to make digital or hard copies of part or all of this work for personal or
classroom use is granted without fee provided that copies are not made or distributed
for proﬁt or commercial advantage and that copies bear this notice and the full citation
on the ﬁrst page. copyrights for third-party components of this work must be honored.
for all other uses, contact the owner/author(s).
copyright is held by the owner/author(s).
ccs’15, october 12–16, 2015, denver, colorado, usa.
acm 978-1-4503-3832-5/15/10.
http://dx.doi.org/10.1145/2810103.2813693.

ety]: public policy issues – abuse and crime involving
computers; k.6.5 [management of computing and in-
formation systems]: security and protection – authenti-
cation

keywords
sybil attacks; temporal dynamics

1.

|
Data,|abstract
malware detection increasingly relies on machine learning
techniques, which utilize multiple features to separate the
malware from the benign apps. the eﬀectiveness of these
techniques primarily depends on the manual feature engi-
neering process, based on human knowledge and intuition.
however, given the adversaries’ eﬀorts to evade detection
and the growing volume of publications on malware behav-
iors, the feature engineering process likely draws from a frac-
tion of the relevant knowledge.

we propose an end-to-end approach for automatic feature
engineering. we describe techniques for mining documents
written in natural language (e.g. scientiﬁc papers) and for
representing and querying the knowledge about malware in
a way that mirrors the human feature engineering process.
speciﬁcally, we ﬁrst identify abstract behaviors that are as-
sociated with malware, and then we map these behaviors to
concrete features that can be tested experimentally. we im-
plement these ideas in a system called featuresmith, which
generates a feature set for detecting android malware. we
train a classiﬁer using these features on a large data set of
benign and malicious apps. this classiﬁer achieves a 92.5%
true positive rate with only 1% false positives, which is com-
parable to the performance of a state-of-the-art android
malware detector that relies on manually engineered fea-
tures. in addition, featuresmith is able to suggest informa-
tive features that are absent from the manually engineered
set and to link the features generated to abstract concepts
that describe malware behaviors.

1.

|
Non-data,|abstract
lattice-based cryptography oﬀers some of the most attrac-
tive primitives believed to be resistant to quantum com-
puters. following increasing interest from both companies
and government agencies in building quantum computers, a
number of works have proposed instantiations of practical
post-quantum key exchange protocols based on hard prob-
lems in ideal lattices, mainly based on the ring learning
with errors (r-lwe) problem. while ideal lattices facil-
itate major eﬃciency and storage beneﬁts over their non-
ideal counterparts, the additional ring structure that en-
ables these advantages also raises concerns about the as-
sumed diﬃculty of the underlying problems. thus, a ques-
tion of signiﬁcant interest to cryptographers, and especially
to those currently placing bets on primitives that will with-
stand quantum adversaries, is how much of an advantage
the additional ring structure actually gives in practice.

despite conventional wisdom that generic lattices might
be too slow and unwieldy, we demonstrate that lwe-based
key exchange is quite practical: our constant time imple-
mentation requires around 1.3ms computation time for each
party; compared to the recent newhope r-lwe scheme,
communication sizes increase by a factor of 4.7×, but remain
under 12 kib in each direction. our protocol is competitive
when used for serving web pages over tls; when partnered
with ecdsa signatures, latencies increase by less than a fac-
tor of 1.6×, and (even under heavy load) server throughput
only decreases by factors of 1.5× and 1.2× when serving typ-
ical 1 kib and 100 kib pages, respectively. to achieve these
practical results, our protocol takes advantage of several in-
∗
large parts of this work were done when valeria nikolaenko was
an intern at google.

permission to make digital or hard copies of part or all of this work for personal or
classroom use is granted without fee provided that copies are not made or distributed
for proﬁt or commercial advantage and that copies bear this notice and the full citation
on the ﬁrst page. copyrights for third-party components of this work must be honored.
request permissions from permissions@acm.org.
ccs’16 october 24–28, 2016, vienna, austria
copyright is held by the owner/author(s). publication rights licensed to acm.
acm isbn 978-1-4503-4139-4/16/10...15.00
doi: http://dx.doi.org/10.1145/2976749.2978425

novations. these include techniques to optimize communi-
cation bandwidth, dynamic generation of public parameters
(which also oﬀers additional security against backdoors),
carefully chosen error distributions, and tight security pa-
rameters.

keywords
post-quantum cryptography; learning with errors; key ex-
change; openssl; tls

1.

|
Non-data,|abstract
this work describes the design, implementation, and eval-
uation of Λ◦ λ, a general-purpose software framework for
lattice-based cryptography. the Λ◦λ framework has several
novel properties that distinguish it from prior implementa-
tions of lattice cryptosystems, including the following.
generality, modularity, concision: Λ◦λ deﬁnes a collection
of general, highly composable interfaces for mathematical
operations used across lattice cryptography, allowing for a
wide variety of schemes to be expressed very naturally and
at a high level of abstraction. for example, we implement
an advanced fully homomorphic encryption (fhe) scheme
in as few as 2–5 lines of code per feature, via code that very
closely matches the scheme’s mathematical deﬁnition.
theory aﬃnity: Λ◦ λ is designed from the ground-up
around the specialized ring representations, fast algorithms,
and worst-case hardness proofs that have been developed for
the ring-lwe problem and its cryptographic applications.
in particular, it implements fast algorithms for sampling
from theory-recommended error distributions over arbitrary
cyclotomic rings, and provides tools for maintaining tight
control of error growth in cryptographic schemes.
safety: Λ◦λ has several facilities for reducing code com-
plexity and programming errors, thereby aiding the correct
implementation of lattice cryptosystems. in particular, it
uses strong typing to statically enforce—i.e., at compile time—
a wide variety of constraints among the various parameters.
advanced features: Λ◦ λ exposes the rich hierarchy of
cyclotomic rings to cryptographic applications. we use this
to give the ﬁrst-ever implementation of a collection of fhe
operations known as “ring switching,” and also deﬁne and
analyze a more eﬃcient variant that we call “ring tunneling.”
lastly, this work deﬁnes and analyzes a variety of mathe-
matical objects and algorithms for the recommended usage
of ring-lwe in cyclotomic rings, which we believe will serve
as a useful knowledge base for future implementations.

∗supported by nsf career award ccf-1054495, darpa

fa8750-11-c-0096, the sloan foundation, and google.

permission to make digital or hard copies of all or part of this work for personal or
classroom use is granted without fee provided that copies are not made or distributed
for proﬁt or commercial advantage and that copies bear this notice and the full citation
on the ﬁrst page. copyrights for components of this work owned by others than the
author(s) must be honored. abstracting with credit is permitted. to copy otherwise, or
republish, to post on servers or to redistribute to lists, requires prior speciﬁc permission
and/or a fee. request permissions from permissions@acm.org.
ccs’16, october 24 - 28, 2016, vienna, austria
c(cid:13) 2016 copyright held by the owner/author(s). publication rights licensed to acm.
isbn 978-1-4503-4139-4/16/10. . . $15.00
doi: http://dx.doi.org/10.1145/2976749.2978402

1.

|
Non-data,|abstract
we present simple, practical, and powerful new techniques
for garbled circuits. these techniques result in signiﬁcant
concrete and asymptotic improvements over the state of the
art, for several natural kinds of computations.

for arithmetic circuits over the integers, our construction
results in garbled circuits with free addition, weighted
threshold gates with cost independent of fan-in, and ex-
ponentiation by a ﬁxed exponent with cost independent of
the exponent. for boolean circuits, our construction gives
an exponential improvement over the state of the art for
threshold gates (including and/or gates) of high fan-in.

our construction can be eﬃciently instantiated with prac-
tical symmetric-key primitives (e.g., aes), and is proven
secure under similar assumptions to that of the free-xor
garbling scheme (kolesnikov & schneider, icalp 2008). we
give an extensive comparison between our scheme and state-
of-the-art garbling schemes applied to boolean circuits.

1.

|
Non-data,|abstract
authenticated encryption schemes guarantee both privacy
and integrity, and have become the default level of encryp-
tion in modern protocols. one of the most popular au-
thenticated encryption schemes today is aes-gcm due to
its impressive speed. the current caesar competition is
considering new modes for authenticated encryption that
will improve on existing methods. one property of impor-
tance that is being considered more today – due to multiple
real-life cases of faulty sources of randomness – is that re-
peating nonces and ivs can have disastrous eﬀects on secu-
rity. a (full) nonce misuse-resistant authenticated encryp-
tion scheme has the property that if the same nonce is used
to encrypt the same message twice, then the same cipher-
text is obtained and so the fact that the same message was
encrypted is detected. otherwise, full security is obtained –
even if the same nonce is used for diﬀerent messages.

in this paper, we present a new fully nonce misuse-resistant
authenticated encryption scheme that is based on carefully
combining the gcm building blocks into the siv paradigm
of rogaway and shrimpton. we provide a full proof of secu-
rity of our scheme, and an optimized implementation using
the aes-ni and pclmulqdq instruction sets. we com-
pare our performance to the highly optimized openssl 1.0.2
implementation of gcm and show that our nonce misuse-
resistant scheme is only 14% slower on haswell architecture
and 19% slower on broadwell architecture. on broadwell,
gcm-siv encryption takes only 0.92 cycles per byte, and
gcm-siv decryption is exactly the same as gcm decryp-
tion taking only 0.77 cycles per byte. in addition, we com-
pare to other optimized authenticated-encryption implemen-
tations carried out by bogdanov et al., and conclude that our
mode is very competitive. beyond being very fast, our new
∗
supported by the pqcrypto project, which was partially funded
by the european commission horizon 2020 research programme,
grant #645622.
†
supported by the biu center for research in applied cryptography
and cyber security in conjunction with the israel national cyber
bureau in the prime minster’s oﬃce.

permission to make digital or hard copies of all or part of this work for personal or
classroom use is granted without fee provided that copies are not made or distributed
for proﬁt or commercial advantage and that copies bear this notice and the full cita-
tion on the ﬁrst page. copyrights for components of this work owned by others than
acm must be honored. abstracting with credit is permitted. to copy otherwise, or re-
publish, to post on servers or to redistribute to lists, requires prior speciﬁc permission
and/or a fee. request permissions from permissions@acm.org.
ccs’15, october 12–16, 2015, denver, colorado, usa.
c(cid:13) 2015 acm. isbn 978-1-4503-3832-5/15/10 ...$15.00.
doi: http://dx.doi.org/10.1145/2810103.2813613.

mode of operation uses the same building blocks as gcm
and so existing hardware and software can be utilized to eas-
ily deploy gcm-siv. we conclude that gcm-siv is a viable
alternative to gcm, providing full nonce misuse-resistance
at little cost.

1.

|
Non-data,|abstract
an android app’s graphical user interface (gui) displays
rich semantic and contextual information about the smart-
phone’s owner and app’s execution. such information pro-
vides vital clues to the investigation of crimes in both cyber
and physical spaces. in real-world digital forensics however,
once an electronic device becomes evidence most manual in-
teractions with it are prohibited by criminal investigation
protocols. hence investigators must resort to “image-and-
analyze” memory forensics (instead of browsing through the
subject phone) to recover the apps’ guis. unfortunately,
gui reconstruction is still largely impossible with state-
of-the-art memory forensics techniques, which tend to fo-
cus only on individual in-memory data structures. an an-
droid gui, however, displays diverse visual elements each
built from numerous data structure instances. furthermore,
whenever an app is sent to the background, its gui struc-
ture will be explicitly deallocated and disintegrated by the
android framework. in this paper, we present guitar, an
app-independent technique which automatically reassembles
and redraws all apps’ guis from the multitude of gui data
elements found in a smartphone’s memory image. to do so,
guitar involves the reconstruction of (1) gui tree topol-
ogy, (2) drawing operation mapping, and (3) runtime envi-
ronment for redrawing. our evaluation shows that guitar
is highly accurate (80-95% similar to original screenshots) at
reconstructing guis from memory images taken from a vari-
ety of android apps on popular phones. moreover, guitar
is robust in reconstructing meaningful guis even when fac-
ing gui data loss.
categories and subject descriptors
d.4.6 [operating systems]: security and protection
general terms
security
keywords
memory forensics; android; digital forensics

permission to make digital or hard copies of all or part of this work for personal or
classroom use is granted without fee provided that copies are not made or distributed
for proﬁt or commercial advantage and that copies bear this notice and the full citation
