Detecting Advanced Persistent Threats using Fractal Dimension based Machine Learning Classification ,http://dl.acm.org/citation.cfm?id=2875484,ACM on Privacy and Security Analytics,2016,Yes,"APTs were collected from Contagio malware database, DARPA  Scalable  Network  Monitoring  (SNM)  Program  Traffic",No,\,Data
5Gen: A Framework for Prototyping Applications Using Multilinear Maps and Matrix Branching Programs,https://dl.acm.org/authorize.cfm?key=N14317,CCS,2016,No,\,No,\,Non-data
A Fistful of Bitcoins: Characterizing Payments Among Men with No Names,http://conferences.sigcomm.org/imc/2013/papers/imc182-meiklejohnA.pdf,IMC,2013,Yes,Engaged in transactions with random bitcoin users to gain their addresses with suplementary info from forums and websites (bitcointalk and blockchain),No,\,Data
"Have we Crossed the Line? The Growing Ethical Debate inModern Computer Security Research",http://www.sigsac.org/ccs/CCS2009/pd/abstract_22.pdf,CCS 2009,2009,No,\,No,\,Non-data
The Blaster Worm: Then and Now,http://ieeexplore.ieee.org/stamp/stamp.jsp?arnumber=1492337,IEEE Security and Privacy 3(4),2005,Yes,IMS data of Blaster in August 2003 and 2004,No,\,Data
Analysis of the HTTPS Certificate Ecosystem,http://conferences.sigcomm.org/imc/2013/papers/imc257-durumericAemb.pdf,Sigcomm,2013,Yes,Alexa top 1M sites,Yes,"completed 110 exhaustive scans of the public IPv4 address space.  we completed upwards of 400 billion SYN probes and 2.55 billion TLS handshakes, collecting and parsing 42.4 million unique X.509 certificates from 109 million hosts.",Data